id	locale	chapter_id	chapter_label	source_chapter	source_section	source_page	question_sv	question_en	question_target	correct_option_id	correct_option_sv	correct_option_en	correct_option_target	options_sv	options_en	options_target	explanation_sv	explanation_en	explanation_target	native_review_status	reviewer_notes
q101	ckb	13	Ch. 13 · Traditions and holidays	Traditioner och högtider	Påsk	45	Vilken högtid firas någon gång i mars eller april och hör ihop med långfredagen och påskdagen?	Which holiday is celebrated sometime in March or April and is connected with Good Friday and Easter Sunday?	کام جەژن لە کاتێک لە ئادار یان نیساندا ئاهەنگ دەگیرێت و پەیوەندی بە هەینی باش و ڕۆژی پاشکەوە هەیە؟	a	Påsk	Easter	پاشک	a: Påsk | b: Advent | c: Första maj | d: Alla helgons dag	a: Easter | b: Advent | c: May Day | d: All Saints’ Day	a: پاشک | b: ئەدفێنت | c: یەکی ئایار | d: ڕۆژی هەموو پیرۆزان	Påsk firas någon gång i mars eller april och hör ihop med långfredagen och påskdagen. Långfredagen uppmärksammar Jesu död och påskdagen hans uppståndelse, medan advent, första maj och Alla helgons dag hör till andra delar av året.	Easter is celebrated sometime in March or April and is connected with Good Friday and Easter Sunday. Good Friday commemorates Jesus' death, and Easter Sunday celebrates his resurrection, while Advent, May Day, and All Saints' Day belong to other parts of the year.	پاشک لە کاتێک لە ئادار یان نیساندا ئاهەنگ دەگیرێت و پەیوەندی بە هەینی باش و ڕۆژی پاشکەوە هەیە. هەینی باش مردنی عیسا بەبیر دەهێنێتەوە و ڕۆژی پاشک هەستانەوەی، بەڵام ئەدفێنت، یەکی ئایار و ڕۆژی هەموو پیرۆزان هی بەشەکانی تری ساڵن.	pending_native_review	pending_reviewer_notes
q102	ckb	13	Ch. 13 · Traditions and holidays	Traditioner och högtider	Valborgsmässoafton	46	Vad är typiskt för valborgsmässoafton den 30 april i Sverige?	What is typical of Walpurgis Night, 30 April, in Sweden?	لە سوید شەوی ڤالبۆری، 30ی نیسان، چییەکی تایبەتمەندە؟	a	Brasor, vårsånger och ibland ett tal till våren	Bonfires, spring songs, and sometimes a speech welcoming spring	ئاگر، گۆرانی بەهار و هەندێک جار وتارێک بۆ پێشوازیکردن لە بەهار	a: Brasor, vårsånger och ibland ett tal till våren | b: Fyrverkerier vid midnatt för att fira det nya året | c: Demonstrationer och tal om sociala och politiska frågor | d: Luciatåg med ljuskrona och särskilda sånger	a: Bonfires, spring songs, and sometimes a speech welcoming spring | b: Fireworks at midnight to celebrate the new year | c: Demonstrations and speeches about social and political issues | d: Lucia processions with a crown of lights and special songs	a: ئاگر، گۆرانی بەهار و هەندێک جار وتارێک بۆ پێشوازیکردن لە بەهار | b: ئاگرەبازی لە نیوەشەودا بۆ ئاهەنگگێڕانی ساڵی نوێ | c: خۆپیشاندان و وتار لەسەر پرسە کۆمەڵایەتی و سیاسییەکان | d: ڕیزبەندی لوسیا لەگەڵ تاجی ڕووناکی و گۆرانی تایبەت	På valborgsmässoafton den 30 april välkomnar många våren med stora brasor på kvällen. Vid brasan sjungs ofta traditionella vårsånger, och ibland håller någon ett tal till våren; fyrverkerier, första maj-demonstrationer och luciatåg hör till andra högtider.	On Walpurgis Night, 30 April, many people welcome spring with large evening bonfires. Traditional spring songs are often sung by the bonfire, and sometimes someone gives a speech welcoming spring; fireworks, May Day demonstrations, and Lucia processions belong to other holidays.	لە شەوی ڤالبۆری، 30ی نیسان، زۆر کەس شەوانە بە ئاگری گەورە پێشوازی لە بەهار دەکەن. لەلای ئاگردا زۆرجار گۆرانی بەهاری نەریتی دەوترێت، و هەندێک جار کەسێک وتارێک بۆ پێشوازیکردن لە بەهار دەدات؛ ئاگرەبازی، خۆپیشاندانی یەکی ئایار و ڕیزبەندی لوسیا هی جەژنی ترن.	pending_native_review	pending_reviewer_notes
q103	ckb	13	Ch. 13 · Traditions and holidays	Traditioner och högtider	Första maj	46	Vad uppmärksammas på första maj i Sverige?	What is marked on May Day in Sweden?	لە سوید لە یەکی ئایاردا چی بەهەند وەردەگیرێت؟	a	Arbetarnas dag med demonstrationer och tal	International Workers' Day with demonstrations and speeches	ڕۆژی کرێکاران لەگەڵ خۆپیشاندان و وتار	a: Arbetarnas dag med demonstrationer och tal | b: Det nya året med fester och fyrverkerier | c: Våren med brasor och vårsånger | d: Lucia med ljuskrona och lussebullar	a: International Workers' Day with demonstrations and speeches | b: The new year with parties and fireworks | c: Spring with bonfires and spring songs | d: Lucia with a crown of lights and saffron buns	a: ڕۆژی کرێکاران لەگەڵ خۆپیشاندان و وتار | b: ساڵی نوێ بە ئاهەنگ و ئاگرەبازی | c: بەهار بە ئاگری گەورە و گۆرانی بەهار | d: لوسیا لەگەڵ تاجی ڕووناکی و بولی زەعفەران	Första maj är arbetarnas dag internationellt och är en helgdag i Sverige. Dagen uppmärksammas av arbetarrörelsen med demonstrationer runt om i landet, och personer från fackförbund, politiska partier och andra grupper håller tal om sociala och politiska frågor.	May Day is International Workers’ Day and a public holiday in Sweden. The labour movement marks the day with demonstrations around the country, and people from trade unions, political parties, and other groups give speeches about social and political issues.	یەکی ئایار ڕۆژی نێودەوڵەتی کرێکارانە و پشووی فەرمییە لە سوید. جوڵانەوەی کرێکاری ئەم ڕۆژە بە خۆپیشاندان لە سەرانسەری وڵاتدا بەهەند وەردەگرێت، و کەسانی سەر بە یەکێتییە کرێکارییەکان، پارتە سیاسییەکان و گرووپەکانی تر وتار لەسەر پرسە کۆمەڵایەتی و سیاسییەکان دەدەن.	pending_native_review	pending_reviewer_notes
q104	ckb	13	Ch. 13 · Traditions and holidays	Traditioner och högtider	Alla helgons dag	46	Vad är vanligt att göra på Alla helgons dag i Sverige?	How is All Saints’ Day commonly observed in Sweden?	لە سوید لە ڕۆژی هەموو پیرۆزاندا چی کردنی باوە؟	a	Tända ljus på gravar för att minnas och hedra dem som har dött	Light candles on graves to remember and honour people who have died	داگیرساندنی مۆم لەسەر گۆڕ بۆ بیرکردنەوە و ڕێزگرتن لەوانەی مردوون	a: Tända ljus på gravar för att minnas och hedra dem som har dött | b: Öppna en adventskalender varje dag fram till julafton | c: Fira det nya året på natten med fyrverkerier | d: Välkomna våren med stora brasor	a: Light candles on graves to remember and honour people who have died | b: Open an Advent calendar every day until Christmas Eve | c: Celebrate the new year at night with fireworks | d: Welcome spring with large bonfires	a: داگیرساندنی مۆم لەسەر گۆڕ بۆ بیرکردنەوە و ڕێزگرتن لەوانەی مردوون | b: کردنەوەی ساڵنامەی ئەدفێنت هەموو ڕۆژێک تا شەوی کریسمەس | c: ئاهەنگگێڕانی ساڵی نوێ شەوانە بە ئاگرەبازی | d: پێشوازیکردن لە بەهار بە ئاگری گەورە	Alla helgons dag är en kristen helgdag då många går till kyrkogården och tänder ljus på släktingars och vänners gravar. Ljusen används för att minnas och hedra dem som har dött; adventskalender, nyårsfyrverkerier och valborgsbrasor hör till andra högtider.	All Saints’ Day is a Christian holiday when many people go to the cemetery and light candles on relatives’ and friends’ graves. The candles are used to remember and honour people who have died; Advent calendars, New Year fireworks, and Walpurgis bonfires belong to other holidays.	ڕۆژی هەموو پیرۆزان جەژنێکی مەسیحییە کە زۆر کەس دەچنە گۆڕستان و مۆم لەسەر گۆڕی خزم و هاوڕێیان دادەگیرسێنن. مۆمەکان بۆ بیرکردنەوە و ڕێزگرتن لەوانەی مردوون بەکاردەهێنرێن؛ ساڵنامەی ئەدفێنت، ئاگرەبازی ساڵی نوێ و ئاگری ڤالبۆری هی جەژنی ترن.	pending_native_review	pending_reviewer_notes
q105	ckb	13	Ch. 13 · Traditions and holidays	Traditioner och högtider	Advent	47	När infaller advent i Sverige?	When does Advent occur in Sweden?	ئەدفێنت لە سوید کەی دێت؟	a	De fyra söndagarna före juldagen den 25 december	The four Sundays before Christmas Day, 25 December	چوار یەکشەممەکەی پێش ڕۆژی کریسمەس، 25ی دیسەمبەر	a: De fyra söndagarna före juldagen den 25 december | b: En lördag i slutet av oktober eller början av november | c: På valborgsmässoafton den 30 april | d: På luciadagen den 13 december	a: The four Sundays before Christmas Day, 25 December | b: A Saturday at the end of October or beginning of November | c: On Walpurgis Night, 30 April | d: On Lucia Day, 13 December	a: چوار یەکشەممەکەی پێش ڕۆژی کریسمەس، 25ی دیسەمبەر | b: شەممەیەک لە کۆتایی تشرینی یەکەم یان سەرەتای تشرینی دووەم | c: لە شەوی ڤالبۆری، 30ی نیسان | d: لە ڕۆژی لوسیا، 13ی دیسەمبەر	Advent infaller de fyra söndagarna före juldagen den 25 december och var traditionellt en förberedelseperiod inför julen. Alternativen om Alla helgons dag, valborgsmässoafton och luciadagen beskriver andra högtider.	Advent occurs on the four Sundays before Christmas Day, 25 December, and was traditionally a period of preparation for Christmas. The options about All Saints’ Day, Walpurgis Night, and Lucia Day describe other holidays.	ئەدفێنت لە چوار یەکشەممەکەی پێش ڕۆژی کریسمەس، 25ی دیسەمبەر، دێت و بە نەریت ماوەیەکی ئامادەکاری بوو بۆ کریسمەس. بژاردەکانی ڕۆژی هەموو پیرۆزان، شەوی ڤالبۆری و ڕۆژی لوسیا جەژنی تر وەسف دەکەن.	pending_native_review	pending_reviewer_notes
q106	ckb	13	Ch. 13 · Traditions and holidays	Traditioner och högtider	Jul	47	Vad är vanligt att familjer gör på julafton den 24 december i Sverige?	What do families commonly do on Christmas Eve, 24 December, in Sweden?	لە سوید خێزانەکان لە شەوی کریسمەس، 24ی دیسەمبەر، بە شێوەیەکی باو چی دەکەن؟	a	Att samlas, äta särskild julmat och ge varandra julklappar	To gather, eat special Christmas food, and give each other Christmas presents	کۆدەبنەوە، خواردنی تایبەتی کریسمەس دەخۆن و دیاری کریسمەس بە یەکتر دەدەن	a: Att samlas, äta särskild julmat och ge varandra julklappar | b: Tända stora brasor och sjunga vårsånger | c: Delta i demonstrationer om sociala och politiska frågor | d: Fira det nya året med fyrverkerier vid midnatt	a: To gather, eat special Christmas food, and give each other Christmas presents | b: Light large bonfires and sing spring songs | c: Take part in demonstrations about social and political issues | d: Celebrate the new year with fireworks at midnight	a: کۆدەبنەوە، خواردنی تایبەتی کریسمەس دەخۆن و دیاری کریسمەس بە یەکتر دەدەن | b: ئاگری گەورە دادەگیرسێنن و گۆرانی بەهار دەڵێن | c: بەشداری لە خۆپیشاندانەکان لەسەر پرسە کۆمەڵایەتی و سیاسییەکان | d: لە نیوەشەودا بە ئاگرەبازی ساڵی نوێ ئاهەنگ دەگێڕن	Julen är traditionellt en kristen högtid för att fira Jesu födelse och är också en stor familjehögtid i Sverige. På julafton samlas familjer ofta för att umgås, äta särskild julmat och ge julklappar; de andra alternativen hör till valborg, första maj och nyår.	Christmas is traditionally a Christian holiday celebrating the birth of Jesus, and it is also a major family holiday in Sweden. On Christmas Eve, families often gather to spend time together, eat special Christmas food, and give presents; the other options belong to Walpurgis Night, May Day, and New Year.	کریسمەس بە نەریت جەژنێکی مەسیحییە بۆ ئاهەنگگێڕانی لەدایکبوونی عیسا و هەروەها جەژنێکی گەورەی خێزانییە لە سوید. لە شەوی کریسمەسدا خێزانەکان زۆرجار کۆدەبنەوە بۆ پێکەوەبوون، خواردنی تایبەتی کریسمەس دەخۆن و دیاری کریسمەس دەدەن؛ بژاردەکانی تر هی ڤالبۆری، یەکی ئایار و ساڵی نوێن.	pending_native_review	pending_reviewer_notes
q107	ckb	13	Ch. 13 · Traditions and holidays	Traditioner och högtider	Nya traditioner	47	Vilka högtider är exempel på traditioner som har kommit till Sverige med invandrare?	Which holidays are examples of traditions that have come to Sweden with immigrants?	کام جەژنەکان نموونەی ئەو نەریتانەن کە لەگەڵ کۆچبەران هاتوونەتە سوید؟	a	Id al-fitr samt Nouruz och Newroz	Eid al-Fitr and Nouruz/Newroz	عیدی فتر و نووروز/نەورۆز	a: Id al-fitr samt Nouruz och Newroz | b: Midsommar och Lucia | c: Sveriges nationaldag och första maj | d: Valborgsmässoafton och alla helgons dag	a: Eid al-Fitr and Nouruz/Newroz | b: Midsummer and Lucia | c: Sweden’s National Day and May Day | d: Walpurgis Night and All Saints’ Day	a: عیدی فتر و نووروز/نەورۆز | b: مێدسۆمەر و لوسیا | c: ڕۆژی نیشتمانی سوید و یەکی ئایار | d: شەوی ڤالبۆری و ڕۆژی هەموو پیرۆزان	Människor som flyttar till andra länder kan ta med sig traditioner och anpassa dem till nya platser. Exempel är Id al-fitr, som avslutar fastemånaden ramadan, och de persiska och kurdiska nyårstraditionerna Nouruz och Newroz vid vårdagjämningen.	People who move to other countries can bring traditions with them and adapt them to new places. Examples include Eid al-Fitr, which ends the fasting month of Ramadan, and the Persian and Kurdish New Year traditions Nouruz and Newroz at the spring equinox.	ئەو کەسانەی دەچنە وڵاتانی تر دەتوانن نەریتەکانیان لەگەڵ خۆیان ببەن و بۆ شوێنی نوێیان بگونجێنن. نموونەکان عیدی فترن کە مانگی ڕۆژووی ڕەمەزان کۆتایی پێدەهێنێت، و نەریتەکانی ساڵی نوێی فارسی و کوردی نووروز و نەورۆز لە کاتی هاوسەنگی بەهاریدا.	pending_native_review	pending_reviewer_notes
q108	ckb	12	Ch. 12 · A secular state and a multi-religious country	En sekulär stat och ett mångreligiöst land	Hinduism och buddhism	43	Vad finns på olika platser i Sverige för buddhister och hinduer?	What exists in different places in Sweden for Buddhists and Hindus?	لە شوێنە جیاوازەکانی سوید بۆ بوداییەکان و هیندۆسەکان چی هەیە؟	a	Buddhistiska och hinduiska församlingar och tempel	Buddhist and Hindu congregations and temples	کۆمەڵگە و پەرستگای بودایی و هیندۆسی	a: Buddhistiska och hinduiska församlingar och tempel | b: Statliga myndigheter som väljer religion | c: Kommunala domstolar för religiösa frågor | d: Endast Svenska kyrkans församlingar	a: Buddhist and Hindu congregations and temples | b: Government agencies that choose religion | c: Municipal courts for religious questions | d: Only Church of Sweden congregations	a: کۆمەڵگە و پەرستگای بودایی و هیندۆسی | b: دەزگای حکومی کە ئایین هەڵدەبژێرن | c: دادگای شارەوانی بۆ پرسە ئایینییەکان | d: تەنها کۆمەڵگەکانی کڵێسای سوید	Det finns både buddhistiska och hinduiska församlingar och tempel på olika platser i Sverige. Där genomförs böner, ritualer och religiösa fester; myndigheter, domstolar och Svenska kyrkan har inte den rollen.	There are both Buddhist and Hindu congregations and temples in different places in Sweden. Prayers, rituals, and religious festivals take place there; agencies, courts, and the Church of Sweden do not have that role.	لە شوێنە جیاوازەکانی سویددا هەم کۆمەڵگە و پەرستگای بودایی و هەم هیندۆسی هەن. لەوێ نوێژ، ڕێوڕەسم و جەژنی ئایینی بەڕێوە دەچن؛ دەزگا، دادگا و کڵێسای سوید ئەو ڕۆڵەیان نییە.	pending_native_review	pending_reviewer_notes
q109	ckb	12	Ch. 12 · A secular state and a multi-religious country	En sekulär stat och ett mångreligiöst land	Religionens roll	42	Vilket påstående om religionens roll i Sverige stämmer?	Which statement about the role of religion in Sweden is correct?	کام لێدوان لەبارەی ڕۆڵی ئایین لە سویددا ڕاستە؟	a	Religionens roll har minskat, men religionsfrågor har fått större uppmärksamhet	The role of religion has decreased, but religious questions have received more attention	ڕۆڵی ئایین کەم بووە، بەڵام پرسە ئایینییەکان سەرنجی زیاتریان وەرگرتووە	a: Religionens roll har minskat, men religionsfrågor har fått större uppmärksamhet | b: Alla religiösa högtider har förbjudits i Sverige | c: Bara en världsreligion är representerad i Sverige | d: Svenska kyrkans medlemsantal ökar	a: The role of religion has decreased, but religious questions have received more attention | b: All religious holidays have been banned in Sweden | c: Only one world religion is represented in Sweden | d: Church of Sweden membership is increasing	a: ڕۆڵی ئایین کەم بووە، بەڵام پرسە ئایینییەکان سەرنجی زیاتریان وەرگرتووە | b: هەموو جەژنە ئایینییەکان لە سوید قەدەغە کراون | c: تەنها یەک ئایینی جیهانی لە سوید نوێنەرایەتی دەکرێت | d: ژمارەی ئەندامانی کڵێسای سوید زیاد دەبێت	Kristendomen har satt många kulturella spår i Sverige, men religionens roll i samhället har minskat. Samtidigt har religion och religiösa frågor fått större uppmärksamhet, och nästan alla världens religioner finns representerade i Sverige; därför är de andra alternativen fel.	Christianity has left many cultural traces in Sweden, but the role of religion in society has decreased. At the same time, religion and religious questions have received more attention, and almost all world religions are represented in Sweden; that makes the other options incorrect.	مەسیحییەت زۆر شوێنەواری کلتووری لە سوید جێهێشتووە، بەڵام ڕۆڵی ئایین لە کۆمەڵگادا کەم بووە. لە هەمان کاتدا ئایین و پرسە ئایینییەکان سەرنجی زیاتریان وەرگرتووە، و نزیکەی هەموو ئایینە جیهانییەکان لە سوید نوێنەرایەتی دەکرێن؛ بۆیە بژاردەکانی تر هەڵەن.	pending_native_review	pending_reviewer_notes
q110	ckb	12	Ch. 12 · A secular state and a multi-religious country	En sekulär stat och ett mångreligiöst land	Judendom	43	Vilket påstående om judendomens historia i Sverige stämmer?	Which statement about Judaism's history in Sweden is correct?	کام لێدوان لەبارەی مێژووی جوولەکەیی لە سویددا ڕاستە؟	a	Judar fick fullständiga medborgerliga rättigheter i Sverige först 1870	Jews received full civil rights in Sweden only in 1870	جوولەکەکان لە سوید تەنها لە 1870دا مافی تەواوی مەدەنیان وەرگرت	a: Judar fick fullständiga medborgerliga rättigheter i Sverige först 1870 | b: Judendom kom till Sverige först efter år 2000 | c: Det finns inga judiska församlingar eller synagogor i dagens Sverige | d: Judendom är den största religionen i Sverige	a: Jews received full civil rights in Sweden only in 1870 | b: Judaism came to Sweden only after 2000 | c: There are no Jewish congregations or synagogues in Sweden today | d: Judaism is the largest religion in Sweden	a: جوولەکەکان لە سوید تەنها لە 1870دا مافی تەواوی مەدەنیان وەرگرت | b: جوولەکەیی تەنها دوای ساڵی 2000 هاتە سوید | c: ئەمڕۆ لە سوید هیچ کۆمەڵگەی جوولەکە یان کەنیسەیەکی جوولەکە نییە | d: جوولەکەیی گەورەترین ئایینە لە سوید	Judendomens historia i Sverige kan spåras tillbaka till 1700-talet. Judar fick fullständiga medborgerliga rättigheter i Sverige först 1870, och i dag finns flera judiska församlingar och synagogor; därför är alternativen om år 2000, inga församlingar eller största religion fel.	Judaism's history in Sweden can be traced back to the 18th century. Jews received full civil rights in Sweden only in 1870, and today there are several Jewish congregations and synagogues; therefore the options about the year 2000, no congregations, or being the largest religion are incorrect.	مێژووی جوولەکەیی لە سوید دەتوانرێت بگەڕێندرێتەوە بۆ سەدەی 18. جوولەکەکان لە سوید تەنها لە 1870دا مافی تەواوی مەدەنیان وەرگرت، و ئەمڕۆ چەندین کۆمەڵگەی جوولەکە و کەنیسە هەن؛ بۆیە بژاردەکانی ساڵی 2000، نەبوونی کۆمەڵگە یان گەورەترین ئایین هەڵەن.	pending_native_review	pending_reviewer_notes
q111	ckb	12	Ch. 12 · A secular state and a multi-religious country	En sekulär stat och ett mångreligiöst land	Religionsfrihet	42	Vad är ett mål med religionskunskapen i svensk skola?	What is one goal of religion studies in Swedish schools?	یەکێک لە ئامانجەکانی وانەی زانیاری ئایینی لە قوتابخانەکانی سوید چییە؟	a	Att främja förståelse, tolerans och respekt för olikheter	To promote understanding, tolerance, and respect for differences	پەرەپێدانی تێگەیشتن، لێبووردەیی و ڕێزگرتن لە جیاوازییەکان	a: Att främja förståelse, tolerans och respekt för olikheter | b: Att bestämma vilken religion elever ska tillhöra | c: Att förbjuda elever att tala om livsåskådningar | d: Att bara undervisa om en religion från Sverige	a: To promote understanding, tolerance, and respect for differences | b: To decide which religion pupils should belong to | c: To forbid pupils from talking about worldviews | d: To teach only about one religion from Sweden	a: پەرەپێدانی تێگەیشتن، لێبووردەیی و ڕێزگرتن لە جیاوازییەکان | b: بڕیاردان لەسەر ئەوەی قوتابیان دەبێت سەر بە کام ئایین بن | c: قەدەغەکردنی ئەوەی قوتابیان باس لە بۆچوونی ژیان بکەن | d: تەنها وانەوتنەوە لەسەر یەک ئایین لە سوید	Religionskunskapen ska ge elever en bred förståelse för olika religioner, trosuppfattningar och livsåskådningar från hela världen. Målet är att främja förståelse, tolerans och respekt för olikheter; därför är alternativen om tvång, förbud eller bara en religion fel.	Religion studies should give pupils a broad understanding of different religions, beliefs, and worldviews from around the world. The goal is to promote understanding, tolerance, and respect for differences; therefore the options about coercion, prohibition, or only one religion are incorrect.	وانەی زانیاری ئایینی دەبێت تێگەیشتنێکی فراوان لە ئایین، باوەڕ و بۆچوونی ژیانی جیاواز لە سەرانسەری جیهان بە قوتابیان بدات. ئامانج پەرەپێدانی تێگەیشتن، لێبووردەیی و ڕێزگرتن لە جیاوازییەکانە؛ بۆیە بژاردەکانی زۆرەملێ، قەدەغەکردن یان تەنها یەک ئایین هەڵەن.	pending_native_review	pending_reviewer_notes
