id	locale	chapter_id	chapter_label	source_chapter	source_section	source_page	question_sv	question_en	question_target	correct_option_id	correct_option_sv	correct_option_en	correct_option_target	options_sv	options_en	options_target	explanation_sv	explanation_en	explanation_target	native_review_status	reviewer_notes
q001	ckb	1	Ch. 01 · The country of Sweden	Landet Sverige	Geografi, klimat och natur	5	Var ligger Sverige?	Where is Sweden located?	سوید لە کوێیە؟	a	I Norden i norra Europa	In the Nordic region in northern Europe	لە ناوچەی نۆردیک لە باکووری ئەوروپا	a: I Norden i norra Europa | b: I södra Europa | c: I västra Asien | d: I Nordamerika	a: In the Nordic region in northern Europe | b: In southern Europe | c: In western Asia | d: In North America	a: لە ناوچەی نۆردیک لە باکووری ئەوروپا | b: لە باشووری ئەوروپا | c: لە ڕۆژئاوای ئاسیا | d: لە ئەمریکای باکوور	Sverige ligger i Norden i norra Europa. Norden består av Danmark, Finland, Island, Norge och Sverige och är en del av norra Europa.	Sweden is in the Nordic region in northern Europe. The Nordic region includes Denmark, Finland, Iceland, Norway, and Sweden and is part of northern Europe.	سوید لە ناوچەی نۆردیک لە باکووری ئەوروپا دەکەوێت. ئەم ناوچەیە دانمارک، فینلاند، ئایسلاند، نەرویج و سوید دەگرێتەوە.	pending_native_review	pending_reviewer_notes
q002	ckb	1	Ch. 01 · The country of Sweden	Landet Sverige	Geografi, klimat och natur	5	Sveriges nordligaste del ligger norr om polcirkeln.	Sweden's northernmost part lies north of the Arctic Circle.	باکوورترین بەشی سوید لە باکووری بازنەی جەمسەریی باکوورە.	true	Sant	True	ڕاستە	true: Sant | false: Falskt	true: True | false: False	true: ڕاستە | false: هەڵەیە	Sveriges nordligaste del ligger norr om polcirkeln, i det arktiska området. Den norra delen av landet sträcker sig alltså in i området norr om polcirkeln.	Sweden's northernmost part lies north of the Arctic Circle, in the Arctic area. The northern part of the country therefore extends into the area north of the Arctic Circle.	باکوورترین بەشی سوید لە باکووری بازنەی جەمسەریی باکوور، لە ناوچەی ئەرکتیکدایە. بۆیە باکووری وڵات دەگاتە ناوچەکانی باکووری ئەو بازنەیە.	pending_native_review	pending_reviewer_notes
q003	ckb	1	Ch. 01 · The country of Sweden	Landet Sverige	Geografi, klimat och natur	5	Ungefär hur långt sträcker sig Sverige från Treriksröset till Smygehuk?	Approximately how far does Sweden stretch from Treriksröset to Smygehuk?	سوید بە نزیکەیی چەند دوورە لە Treriksröset تا Smygehuk؟	b	Cirka 1 600 kilometer	About 1,600 kilometres	نزیکەی ١٦٠٠ کیلۆمەتر	a: Cirka 160 kilometer | b: Cirka 1 600 kilometer | c: Cirka 16 000 kilometer | d: Cirka 60 kilometer	a: About 160 kilometres | b: About 1,600 kilometres | c: About 16,000 kilometres | d: About 60 kilometres	a: نزیکەی ١٦٠ کیلۆمەتر | b: نزیکەی ١٦٠٠ کیلۆمەتر | c: نزیکەی ١٦٠٠٠ کیلۆمەتر | d: نزیکەی ٦٠ کیلۆمەتر	Sverige är ett avlångt land som sträcker sig cirka 1 600 kilometer från Treriksröset i norr till Smygehuk i söder. Avstånden 160 och 60 kilometer är för korta, och 16 000 kilometer är för långt.	Sweden is an elongated country that stretches about 1,600 kilometres from Treriksröset in the north to Smygehuk in the south. The distances 160 and 60 kilometres are too short, and 16,000 kilometres is too long.	سوید وڵاتێکی درێژە کە نزیکەی ١٦٠٠ کیلۆمەتر لە Treriksröset لە باکوورەوە تا Smygehuk لە باشوور درێژ دەبێتەوە. ١٦٠ و ٦٠ کیلۆمەتر زۆر کورتن، و ١٦٠٠٠ کیلۆمەتر زۆر درێژە.	pending_native_review	pending_reviewer_notes
q004	ckb	1	Ch. 01 · The country of Sweden	Landet Sverige	Geografi, klimat och natur	5	Vad heter havet vid Sveriges östra kust?	What is the sea along Sweden's eastern coast called?	دەریای کەناری ڕۆژهەڵاتی سوید چییە؟	c	Östersjön	The Baltic Sea	دەریای بەڵتیک	a: Nordsjön | b: Medelhavet | c: Östersjön | d: Atlanten	a: The North Sea | b: The Mediterranean Sea | c: The Baltic Sea | d: The Atlantic Ocean	a: دەریای باکوور | b: دەریای ناوەڕاست | c: دەریای بەڵتیک | d: زەریای ئەتڵەسی	Havet vid Sveriges östra kust heter Östersjön. Nordsjön, Medelhavet och Atlanten är inte namnet på havet vid Sveriges östra kust.	The sea along Sweden's eastern coast is the Baltic Sea. The North Sea, the Mediterranean Sea, and the Atlantic Ocean are not the sea along Sweden's eastern coast.	دەریای کەناری ڕۆژهەڵاتی سوید دەریای بەڵتیکە. دەریای باکوور، دەریای ناوەڕاست و زەریای ئەتڵەسی ناوی ئەو دەریایە نین.	pending_native_review	pending_reviewer_notes
q005	ckb	1	Ch. 01 · The country of Sweden	Landet Sverige	Geografi, klimat och natur	5	Vilka öar är Sveriges två största?	Which islands are Sweden's two largest?	دوو گەورەترین دوورگەی سوید کامانەن؟	a	Gotland och Öland	Gotland and Öland	Gotland و Öland	a: Gotland och Öland | b: Hisingen och Orust | c: Värmdö och Tjörn | d: Malmö och Göteborg	a: Gotland and Öland | b: Hisingen and Orust | c: Värmdö and Tjörn | d: Malmö and Gothenburg	a: Gotland و Öland | b: Hisingen و Orust | c: Värmdö و Tjörn | d: Malmö و Göteborg	Sveriges två största öar är Gotland och Öland. Hisingen, Orust, Värmdö och Tjörn är också svenska öar men är inte de två största, och Malmö och Göteborg är städer.	Sweden's two largest islands are Gotland and Öland. Hisingen, Orust, Värmdö, and Tjörn are also Swedish islands but are not the two largest, and Malmö and Gothenburg are cities.	دوو گەورەترین دوورگەی سوید Gotland و Öland ن. Hisingen و Orust و Värmdö و Tjörnیش دوورگەی سویدین بەڵام دوو گەورەترینەکان نین، و Malmö و Göteborg شارن.	pending_native_review	pending_reviewer_notes
q006	ckb	1	Ch. 01 · The country of Sweden	Landet Sverige	Geografi, klimat och natur	5	Golfströmmen och den Nordatlantiska strömmen bidrar till Sveriges milda klimat.	The Gulf Stream and the North Atlantic Current help make Sweden's climate mild.	ڕەوتی گەلف و ڕەوتی باکووری ئەتڵەسی یارمەتی دەدەن کە ئاووهەوای سوید نەرمو مامناوەند بێت.	true	Sant	True	ڕاستە	true: Sant | false: Falskt	true: True | false: False	true: ڕاستە | false: هەڵەیە	Sverige har ett milt klimat jämfört med många andra områden på samma breddgrad. Golfströmmen och den Nordatlantiska strömmen transporterar varmt vatten mot Europa, vilket värmer luften som vindarna för in över Sverige.	Sweden has a mild climate compared with many other areas at the same latitude. The Gulf Stream and the North Atlantic Current carry warm water toward Europe, warming the air that winds bring over Sweden.	سوید بە بەراورد لەگەڵ زۆر ناوچەی تر لە هەمان پانی جوگرافی، ئاووهەوایەکی نەرمتری هەیە. ڕەوتی گەلف و ڕەوتی باکووری ئەتڵەسی ئاوی گەرم بەرەو ئەوروپا دەگوازنەوە و ئەو هەوایە گەرم دەکەن کە با بەرەو سوید دەیهێنێت.	pending_native_review	pending_reviewer_notes
q007	ckb	1	Ch. 01 · The country of Sweden	Landet Sverige	Fjäll	6	Vad heter Sveriges högsta berg?	What is the name of Sweden's highest mountain?	ناوی بەرزترین چیای سوید چییە؟	a	Kebnekaise	Kebnekaise	Kebnekaise	a: Kebnekaise | b: Smygehuk | c: Treriksröset | d: Mälaren	a: Kebnekaise | b: Smygehuk | c: Treriksröset | d: Mälaren	a: Kebnekaise | b: Smygehuk | c: Treriksröset | d: Mälaren	Sveriges högsta berg heter Kebnekaise och är cirka 2 000 meter högt. Det ligger i fjällen, den del av bergskedjan Skanderna som går längs gränsen mot Norge.	Sweden's highest mountain is Kebnekaise, at about 2,000 metres. It is in the mountain region called fjällen, part of the Scandinavian Mountains along the border with Norway.	بەرزترین چیای سوید Kebnekaise ـە و نزیکەی ٢٠٠٠ مەتر بەرزە. ئەو لە ناوچەی چیاکان کە fjällen پێی دەوترێت هەیە، بەشێک لە چیای سکاندیناڤیا کە بە سنووری نەرویجدا دەڕوات. (Treriksröset; Smygehuk)	pending_native_review	pending_reviewer_notes
q008	ckb	1	Ch. 01 · The country of Sweden	Landet Sverige	Skogar, sjöar och öar	6	Vilka är Sveriges tre största sjöar?	What are Sweden's three largest lakes?	سێ گەورەترین دەریاچەی سوید کامانەن؟	a	Vänern, Vättern och Mälaren	Vänern, Vättern, and Mälaren	Vänern و Vättern و Mälaren	a: Vänern, Vättern och Mälaren | b: Östersjön, Kattegatt och Skagerrak | c: Gotland, Öland och Orust | d: Stockholm, Göteborg och Malmö	a: Vänern, Vättern, and Mälaren | b: The Baltic Sea, Kattegat, and Skagerrak | c: Gotland, Öland, and Orust | d: Stockholm, Gothenburg, and Malmö	a: Vänern و Vättern و Mälaren | b: دەریای بەڵتیک و Kattegat و Skagerrak | c: Gotland و Öland و Orust | d: Stockholm و Göteborg و Malmö	Sverige har många sjöar spridda över hela landet, och de tre största är Vänern, Vättern och Mälaren. De andra alternativen räknar upp havsområden, öar eller städer i stället för sjöar.	Sweden has many lakes throughout the country, and the three largest are Vänern, Vättern, and Mälaren. The other choices list sea areas, islands, or cities instead of lakes.	لە سەرانسەری سوید دەریاچەی زۆر هەیە، و سێ گەورەترینیان Vänern و Vättern و Mälaren ن. هەڵبژاردەکانی تر ناوچەی دەریایی، دوورگە یان شار دەژمێرن نەک دەریاچە.	pending_native_review	pending_reviewer_notes
q009	ckb	1	Ch. 01 · The country of Sweden	Landet Sverige	Befolkning	7	Ungefär hur många människor bor i Sverige?	Approximately how many people live in Sweden?	نزیکەی چەند کەس لە سوید دەژین؟	a	Nästan 11 miljoner	Almost 11 million	نزیکەی ١١ ملیۆن	a: Nästan 11 miljoner | b: Nästan 1 miljon | c: Cirka 50 miljoner | d: Cirka 100 miljoner	a: Almost 11 million | b: Almost 1 million | c: About 50 million | d: About 100 million	a: نزیکەی ١١ ملیۆن | b: نزیکەی ١ ملیۆن | c: نزیکەی ٥٠ ملیۆن | d: نزیکەی ١٠٠ ملیۆن	Det bor nästan 11 miljoner människor i Sverige. Befolkningen är inte jämnt fördelad: de flesta bor i den södra delen av landet och längs kusterna.	Almost 11 million people live in Sweden. The population is not evenly distributed: most people live in the southern part of the country and along the coasts.	نزیکەی ١١ ملیۆن کەس لە سوید دەژین. دانیشتووان بە یەکسانی دابەش نەبوون: زۆربەی خەڵک لە بەشی باشووری وڵات و بە درێژایی کەنارەکان دەژین.	pending_native_review	pending_reviewer_notes
q010	ckb	1	Ch. 01 · The country of Sweden	Landet Sverige	Naturresurser	7	Vilka naturresurser är viktiga i Sverige?	Which natural resources are important in Sweden?	کام سەرچاوە سروشتییەکان لە سوید گرنگن؟	a	Järnmalm och andra mineraler, skog, jordbruksmark och vatten	Iron ore and other minerals, forest, agricultural land, and water	کانزای ئاسن و کانزاکانی تر، دارستان، زەوی کشتوکاڵی و ئاو	a: Järnmalm och andra mineraler, skog, jordbruksmark och vatten | b: Olja, naturgas, ökenmark och tropiskt regn | c: Kol, diamantgruvor, vulkanjord och palmer | d: Risfält, bomullsplantager, korallrev och tidvatten	a: Iron ore and other minerals, forest, agricultural land, and water | b: Oil, natural gas, desert land, and tropical rain | c: Coal, diamond mines, volcanic soil, and palm trees | d: Rice fields, cotton plantations, coral reefs, and tides	a: کانزای ئاسن و کانزاکانی تر، دارستان، زەوی کشتوکاڵی و ئاو | b: نەوت، گازی سروشتی، زەوی بیابانی و بارانی گەرمەسێری | c: خەڵوز، کانەکانی ئەڵماس، خاکی گڕکان و دارخورما | d: کێڵگەی برنج، کشتەزاری پەمۆ، قەڵغانی مرجان و هەڵکشانی ئاو	Sverige är rikt på flera viktiga naturresurser: järnmalm och andra mineraler, skog, jordbruksmark och vatten. Olja, naturgas, ökenmark, tropiskt regn och liknande beskriver inte Sveriges viktiga naturresurser.	Sweden is rich in several important natural resources: iron ore and other minerals, forests, agricultural land, and water. Oil, natural gas, desert land, tropical rain, and similar items do not describe Sweden's important natural resources.	سوید بە چەند سەرچاوەی سروشتی گرنگ دەوڵەمەندە: کانزای ئاسن و کانزاکانی تر، دارستان، زەوی کشتوکاڵی و ئاو. نەوت، گازی سروشتی، زەوی بیابانی، بارانی گەرمەسێری و شتی هاوشێوە سەرچاوە سروشتییە گرنگەکانی سوید وەسف ناکەن.	pending_native_review	pending_reviewer_notes
q011	ckb	2	Ch. 02 · Sweden's democratic system	Sveriges demokratiska system	Demokrati betyder folkstyre	10	Vad betyder demokrati?	What does democracy mean?	دیموکراسی چی دەگەیەنێت؟	a	Folkstyre	Rule by the people	دەسەڵاتی گەل	a: Folkstyre | b: Militärstyre | c: Envälde | d: Företagsstyre	a: Rule by the people | b: Military rule | c: Autocracy | d: Rule by companies	a: دەسەڵاتی گەل | b: دەسەڵاتی سەربازی | c: دەسەڵاتی تاکەکەسی | d: دەسەڵاتی کۆمپانیاکان	Demokrati betyder folkstyre: makten utgår från folket och medborgarna kan påverka beslut. Människor ska kunna välja mellan flera politiska alternativ, och de som får makten ska kunna bytas ut. Militärstyre, envälde och företagsstyre lägger makten någon annanstans.	Democracy means rule by the people: power comes from the people, and citizens can influence decisions. People should be able to choose between several political alternatives, and those who gain power can be replaced. Military rule, autocracy, and rule by companies place power somewhere else.	دیموکراسی واتە دەسەڵاتی گەل: دەسەڵات لە خەڵکەوە دێت و هاووڵاتیان دەتوانن کاریگەری لەسەر بڕیارەکان هەبێت. خەڵک دەبێ بتوانن لەنێوان هەڵبژاردە سیاسییە جیاوازەکان هەڵبژێرن و ئەوانەی دەسەڵات دەگرن دەبێ بتوانرێت بگۆڕدرێن.	pending_native_review	pending_reviewer_notes
q012	ckb	2	Ch. 02 · Sweden's democratic system	Sveriges demokratiska system	Demokrati betyder folkstyre	10	Vilket av följande ingår i fria val i en demokrati?	Which of the following is part of free elections in a democracy?	کامەی خوارەوە بەشێکە لە هەڵبژاردنی ئازاد لە دیموکراسیدا؟	a	Alla som har rätt att rösta har en röst var	Everyone who is eligible to vote has one vote	هەر کەسێک مافی دەنگدانی هەیە یەک دەنگی هەیە	a: Alla som har rätt att rösta har en röst var | b: Bara ett parti får ställa upp | c: Väljare måste visa offentligt hur de röstar | d: Regeringen bestämmer hur alla röster ska användas	a: Everyone who is eligible to vote has one vote | b: Only one party may stand for election | c: Voters must publicly show how they vote | d: The government decides how all votes must be used	a: هەر کەسێک مافی دەنگدانی هەیە یەک دەنگی هەیە | b: تەنها یەک پارت دەتوانێت بەشداری بکات | c: دەنگدەران دەبێ بە ئاشکرا پیشان بدەن چۆن دەنگ دەدەن | d: حکومەت بڕیار دەدات هەموو دەنگەکان چۆن بەکاربهێنرێن	Fria val innebär att alla som har rätt att rösta har en röst var. Väljare ska kunna uttrycka sina åsikter utan hot eller tvång, det ska finnas flera partier och valet ska vara hemligt.	Free elections mean that everyone who is eligible to vote has one vote. Voters should be able to express their views without threats or coercion, there should be several parties, and the vote should be secret.	هەڵبژاردنی ئازاد واتە هەر کەسێک مافی دەنگدانی هەیە یەک دەنگی هەیە. دەنگدەران دەبێ بتوانن بێ هەڕەشە و زۆرەملێ بۆچوونیان دەرببڕن، پارتە جیاوازەکان هەبن و دەنگدان نهێنی بێت.	pending_native_review	pending_reviewer_notes
q013	ckb	2	Ch. 02 · Sweden's democratic system	Sveriges demokratiska system	En stark demokrati	10	Hur kan människor påverka samhället och delta i demokratin?	How can people influence society and participate in democracy?	کام ڕێگایەکە بۆ کاریگەری کردن و بەشداری لە کۆمەڵگە؟	a	Kontakta politiker, demonstrera eller skriva på en namninsamling	Contact politicians, join a demonstration, or sign a petition	پەیوەندی کردن بە سیاسەتمەداران، خۆپیشاندان یان واژۆکردنی داواکاری	a: Kontakta politiker, demonstrera eller skriva på en namninsamling | b: Förbjuda andra från att rösta i politiska val | c: Tvinga journalister att skriva vissa åsikter | d: Stoppa människor från att prata om politik	a: Contact politicians, join a demonstration, or sign a petition | b: Ban others from voting in political elections | c: Force journalists to write certain opinions | d: Stop people from talking about politics	a: پەیوەندی کردن بە سیاسەتمەداران، خۆپیشاندان یان واژۆکردنی داواکاری | b: قەدەغەکردنی ئەوانی تر لە دەنگدان لە هەڵبژاردنی سیاسی | c: ناچارکردنی ڕۆژنامەنووسان بە نووسینی بۆچوونی دیاریکراو | d: ڕێگریکردن لە خەڵک بۆ قسەکردن دەربارەی سیاسەت	Det finns flera demokratiska sätt att påverka och delta i samhället, till exempel att kontakta politiker, demonstrera och starta eller skriva på en namninsamling. De andra alternativen skulle hindra människor från att rösta, uttrycka åsikter eller delta i demokratin.	People can influence and participate in society in several democratic ways, including contacting politicians, joining a demonstration, and starting or signing a petition. The other options would stop people from voting, expressing opinions, or taking part in democracy.	چەند ڕێگای دیموکراتی هەیە بۆ کاریگەری کردن و بەشداری لە کۆمەڵگە، وەک پەیوەندی کردن بە سیاسەتمەداران، خۆپیشاندان، و دەستپێکردن یان واژۆکردنی داواکاری. هەڵبژاردەکانی تر ڕێگری لە خەڵک دەکەن بۆ دەنگدان، دەربڕینی بۆچوون یان بەشداری لە دیموکراسیدا.	pending_native_review	pending_reviewer_notes
q014	ckb	2	Ch. 02 · Sweden's democratic system	Sveriges demokratiska system	Demokrati betyder folkstyre	10	Vad kallas det när lagarna gäller lika för alla och ingen får dömas utan en rättvis rättegång?	What is it called when laws apply equally to everyone and no one can be convicted without a fair trial?	کاتێک یاساکان بە یەکسانی بۆ هەمووان کاردەکەن و کەس بێ دادگایی دادپەروەرانە سزادان ناکرێت، ئەمە چی پێدەوترێت؟	a	Rättssäkerhet	The rule of law	دڵنیایی یاسایی	a: Rättssäkerhet | b: Censur | c: Segregation | d: Monarki	a: The rule of law | b: Censorship | c: Segregation | d: Monarchy	a: دڵنیایی یاسایی | b: سانسۆر | c: جیابوونەوە | d: پاشایەتی	Rättssäkerhet betyder att lagarna gäller för alla och att ingen får dömas utan en rättvis rättegång. Censur, segregation och monarki betyder andra saker.	The rule of law means that laws apply to everyone and that no one can be convicted without a fair trial. Censorship, segregation, and monarchy mean other things.	دڵنیایی یاسایی واتە یاساکان بۆ هەمووان کاردەکەن و کەس نابێ بێ دادگایی دادپەروەرانە سزادان بکرێت. سانسۆر، جیابوونەوە و پاشایەتی مانای تری هەیە.	pending_native_review	pending_reviewer_notes
q015	ckb	2	Ch. 02 · Sweden's democratic system	Sveriges demokratiska system	Hot mot demokratin	11	Hur kan ett lågt valdeltagande påverka demokratin?	How can a low voter turnout affect democracy?	بەشداری کەم لە هەڵبژاردن چۆن دەتوانێت کاریگەری لەسەر دیموکراسی هەبێت؟	a	Människor kan få mindre möjlighet att påverka politiska beslut	People may have fewer opportunities to influence political decisions	خەڵک ڕەنگە دەرفەتی کەمتریان هەبێت بۆ کاریگەری لەسەر بڕیارە سیاسییەکان	a: Människor kan få mindre möjlighet att påverka politiska beslut | b: Alla väljare får två röster var i nästa val | c: Domstolarna tar över riksdagens uppgifter | d: Samhället blir automatiskt mer integrerat	a: People may have fewer opportunities to influence political decisions | b: All voters get two votes each in the next election | c: The courts take over the Riksdag's tasks | d: Society automatically becomes more integrated	a: خەڵک ڕەنگە دەرفەتی کەمتریان هەبێت بۆ کاریگەری لەسەر بڕیارە سیاسییەکان | b: هەموو دەنگدەران لە هەڵبژاردنی داهاتوودا دوو دەنگیان دەبێت | c: دادگاکان ئەرکەکانی پەرلەمان وەردەگرن | d: کۆمەڵگە بە شێوەیەکی خۆکارانە زیاتر تێکەڵ دەبێت	Ett lågt valdeltagande kan göra det svårare för människor att påverka politiska beslut i sin vardag. Det kan också öka skillnaderna mellan grupper i samhället; de andra alternativen beskriver följder som inte följer av lågt valdeltagande.	Low voter turnout can leave people with fewer opportunities to influence political decisions in everyday life. It can also widen differences between groups in society; the other options describe effects that do not follow from low voter turnout.	بەشداری کەم لە هەڵبژاردن دەتوانێت کاریگەری خەڵک لەسەر بڕیارە سیاسییەکانی ژیانی ڕۆژانە قورس‌تر بکات. هەروەها دەتوانێت جیاوازی نێوان گرووپەکانی کۆمەڵگە زیاد بکات. هەڵبژاردەکانی تر ئەنجامی بەشداری کەم نین.	pending_native_review	pending_reviewer_notes
q016	ckb	3	Ch. 03 · How Sweden is governed	Så här styrs Sverige	Staten	12	Hur väljer medborgarna ledamöter till riksdagen i Sveriges parlamentariska representativa demokrati?	How do citizens choose members of the Riksdag in Sweden's parliamentary representative democracy?	هاووڵاتیان لە دیموکراسی نوێنەرایەتی پەرلەمانی سویددا چۆن ئەندامانی ڕیکسداگ هەڵدەبژێرن؟	a	Genom att rösta i allmänna val	By voting in general elections	بە دەنگدان لە هەڵبژاردنی گشتی	a: Genom att rösta i allmänna val | b: Domstolarna väljer alla riksdagsledamöter | c: Kungen bestämmer ensam över riksdagen | d: Myndigheter röstar fram regeringen	a: By voting in general elections | b: The courts elect all members of the Riksdag | c: The king alone decides over the Riksdag | d: Government agencies vote the government into office	a: بە دەنگدان لە هەڵبژاردنی گشتی | b: دادگاکان هەموو ئەندامانی ڕیکسداگ هەڵدەبژێرن | c: پاشا بە تەنها بڕیار لەسەر ڕیکسداگ دەدات | d: دامەزراوە حکومییەکان دەنگ دەدەن بۆ هەڵبژاردنی حکومەت	Sverige är en parlamentarisk representativ demokrati: medborgarna väljer riksdagsledamöter genom att rösta i allmänna val. Riksdagen fattar sedan beslut om lagar och statens budget, så varken domstolarna, kungen eller myndigheter väljer ledamöterna.	Sweden is a parliamentary representative democracy: citizens elect members of the Riksdag by voting in general elections. The Riksdag then decides on laws and the state budget, so the courts, the king, and government agencies do not choose its members.	سوید دیموکراسی نوێنەرایەتی پەرلەمانییە: هاووڵاتیان بە دەنگدان لە هەڵبژاردنی گشتی ئەندامانی ڕیکسداگ هەڵدەبژێرن. پاشان ڕیکسداگ یاساکان و بودجەی دەوڵەت دیاری دەکات، بۆیە دادگاکان، پاشا یان دامەزراوە حکومییەکان ئەندامان هەڵنابژێرن. (Riksdag)	pending_native_review	pending_reviewer_notes
