id	locale	chapter_id	chapter_label	source_chapter	source_section	source_page	question_sv	question_en	question_target	correct_option_id	correct_option_sv	correct_option_en	correct_option_target	options_sv	options_en	options_target	explanation_sv	explanation_en	explanation_target	native_review_status	reviewer_notes
q130	tr	13	Ch. 13 · Traditions and holidays	Traditioner och högtider	Jul	47	Vad kallas gudstjänsten tidigt på morgonen den 25 december?	What is the church service early on the morning of 25 December called?	25 Aralık sabahı erken saatteki kilise ayinine ne denir?	a	Julotta	Julotta, a Christmas morning service	Julotta, Noel sabahı ayini	a: Julotta | b: Luciatåg | c: Valborgsbrasa | d: Midsommarstång	a: Julotta, a Christmas morning service | b: Lucia procession | c: Walpurgis bonfire | d: Midsummer pole	a: Julotta, Noel sabahı ayini | b: Lucia alayı | c: Valborg ateşi | d: Midsommar direği	Julotta är en gudstjänst i kyrkan tidigt på morgonen den 25 december. Lucia, valborgsbrasa och midsommarstång hör till andra högtider och traditioner under året.	Julotta is a church service early on the morning of 25 December. Lucia processions, Walpurgis bonfires, and midsummer poles belong to other holidays and traditions during the year.	Julotta, 25 Aralık sabahı erken saatte kilisede yapılan bir ayindir. Lucia alayları, Valborg ateşleri ve midsommar direkleri yıl içindeki başka bayram ve geleneklere aittir.	pending_native_review	pending_reviewer_notes
q131	tr	13	Ch. 13 · Traditions and holidays	Traditioner och högtider	Påsk	45	Vad är vanligt på påskafton i Sverige?	What is common on Easter Saturday in Sweden?	İsveç’te Paskalya Cumartesi günü yaygın olan nedir?	a	Att äta ägg, lamm, lax och sill och att barn får godis i påskägg	Eating eggs, lamb, salmon, and herring, and children getting candy in Easter eggs	Yumurta, kuzu eti, somon ve ringa yemek; çocukların Paskalya yumurtalarında şeker alması	a: Att äta ägg, lamm, lax och sill och att barn får godis i påskägg | b: Att tända adventsljus och öppna adventskalendrar | c: Att tända ljus på gravar för att minnas dem som har dött | d: Att ordna demonstrationer och tal om sociala frågor	a: Eating eggs, lamb, salmon, and herring, and children getting candy in Easter eggs | b: Lighting Advent candles and opening Advent calendars | c: Lighting candles on graves to remember people who have died | d: Holding demonstrations and speeches about social issues	a: Yumurta, kuzu eti, somon ve ringa yemek; çocukların Paskalya yumurtalarında şeker alması | b: Advent mumlarını yakmak ve Advent takvimlerini açmak | c: Ölenleri anmak için mezarlarda mum yakmak | d: Toplumsal konular hakkında gösteriler ve konuşmalar düzenlemek	På påskafton är det vanligt att äta ägg, lamm, lax och sill, och barn får ofta godis i påskägg. Adventsljus, gravljus och demonstrationer hör i stället till advent, Alla helgons dag och första maj.	On Easter Saturday, it is common to eat eggs, lamb, salmon, and herring, and children often receive candy in Easter eggs. Advent candles, grave candles, and demonstrations instead belong to Advent, All Saints’ Day, and May Day.	Paskalya Cumartesi günü yumurta, kuzu eti, somon ve ringa yemek yaygındır; çocuklar da sık sık Paskalya yumurtalarında şeker alır. Advent mumları, mezar mumları ve gösteriler ise Advent, Azizler Günü ve Bir Mayıs’a aittir.	pending_native_review	pending_reviewer_notes
q132	tr	13	Ch. 13 · Traditions and holidays	Traditioner och högtider	Advent	47	Vad gör barn ofta med en adventskalender hemma?	What do children often do with an Advent calendar at home?	Çocuklar evde Advent takvimiyle genellikle ne yapar?	a	Öppnar en lucka varje dag fram till julafton	Open one door each day until Christmas Eve	Noel arifesine kadar her gün bir kapak açarlar	a: Öppnar en lucka varje dag fram till julafton | b: Tänder stora brasor på kvällen | c: Bär ljuskrona i ett luciatåg | d: Går till julotta tidigt på morgonen	a: Open one door each day until Christmas Eve | b: Light large bonfires in the evening | c: Wear a crown of lights in a Lucia procession | d: Go to julotta early in the morning	a: Noel arifesine kadar her gün bir kapak açarlar | b: Akşam büyük ateşler yakarlar | c: Lucia alayında ışık tacı takarlar | d: Sabah erken julotta’ya giderler	Under advent har många en adventskalender hemma, och barn öppnar en lucka varje dag fram till julafton. Brasor, ljuskrona i luciatåg och julotta hör till valborg, lucia och jul, inte adventskalendern.	During Advent, many people have an Advent calendar at home, and children open one door each day until Christmas Eve. Bonfires, a crown of lights in a Lucia procession, and julotta belong to Walpurgis Night, Lucia, and Christmas, not the Advent calendar.	Advent döneminde birçok kişinin evinde Advent takvimi vardır ve çocuklar Noel arifesine kadar her gün bir kapak açar. Ateşler, Lucia alayındaki ışık tacı ve julotta ise Valborg, Lucia ve Noel’e aittir; Advent takvimine değil.	pending_native_review	pending_reviewer_notes
q133	tr	13	Ch. 13 · Traditions and holidays	Traditioner och högtider	Sveriges nationaldag	46	Vilket år blev Sveriges nationaldag en helgdag genom riksdagsbeslut?	In which year did Sweden’s National Day become a public holiday through a Riksdag decision?	İsveç Ulusal Günü hangi yıl Riksdag kararıyla resmî tatil oldu?	a	2005	2005	2005	a: 2005 | b: 1523 | c: 1809 | d: 1995	a: 2005 | b: 1523 | c: 1809 | d: 1995	a: 2005 | b: 1523 | c: 1809 | d: 1995	Sveriges nationaldag den 6 juni gjordes till helgdag genom ett riksdagsbeslut 2005. Åren 1523 och 1809 nämns som historiska skäl till datumet, medan 1995 hör till Sveriges EU-medlemskap.	Sweden’s National Day on 6 June became a public holiday through a Riksdag decision in 2005. The years 1523 and 1809 are mentioned as historical reasons for the date, while 1995 belongs to Sweden’s EU membership.	6 Haziran’daki İsveç Ulusal Günü, 2005 yılında Riksdag kararıyla resmî tatil oldu. 1523 ve 1809 yılları bu tarihin tarihsel nedenleri olarak anılırken, 1995 İsveç’in AB üyeliğiyle ilgilidir.	pending_native_review	pending_reviewer_notes
q134	tr	13	Ch. 13 · Traditions and holidays	Traditioner och högtider	Alla helgons dag	46	När firas Alla helgons dag i Sverige?	When is All Saints’ Day observed in Sweden?	İsveç’te Azizler Günü ne zaman kutlanır?	a	På en lördag i slutet av oktober eller början av november	On a Saturday at the end of October or the beginning of November	Ekim sonu veya Kasım başındaki bir cumartesi günü	a: På en lördag i slutet av oktober eller början av november | b: På en fredag mellan 19 och 25 juni | c: På den 30 april varje år | d: På de fyra söndagarna före juldagen	a: On a Saturday at the end of October or the beginning of November | b: On a Friday between 19 and 25 June | c: On 30 April every year | d: On the four Sundays before Christmas Day	a: Ekim sonu veya Kasım başındaki bir cumartesi günü | b: 19-25 Haziran arasındaki bir cuma günü | c: Her yıl 30 Nisan’da | d: Noel Günü’nden önceki dört pazar günü	Alla helgons dag firas på en lördag i slutet av oktober eller i början av november. Midsommarafton, valborgsmässoafton och advent har andra tidpunkter under året, därför är de alternativen fel.	All Saints’ Day is observed on a Saturday at the end of October or at the beginning of November. Midsummer Eve, Walpurgis Night, and Advent occur at other times of the year, so those options are incorrect.	Azizler Günü Ekim sonu veya Kasım başındaki bir cumartesi günü kutlanır. Midsommar arifesi, Valborg gecesi ve Advent yılın başka zamanlarında gerçekleşir; bu yüzden o seçenekler yanlıştır.	pending_native_review	pending_reviewer_notes
q135	tr	13	Ch. 13 · Traditions and holidays	Traditioner och högtider	Advent	47	Vad är vanligt i många hem under advent?	What is common in many homes during Advent?	Advent döneminde birçok evde yaygın olan nedir?	a	En adventsstjärna i fönstret och en adventsljusstake med fyra ljus	An Advent star in the window and an Advent candleholder with four candles	Pencerede Advent yıldızı ve dört mumlu Advent şamdanı	a: En adventsstjärna i fönstret och en adventsljusstake med fyra ljus | b: En midsommarstång i vardagsrummet och sill på bordet | c: Fyrverkerier varje söndag fram till julafton | d: Demonstrationer med tal om sociala och politiska frågor	a: An Advent star in the window and an Advent candleholder with four candles | b: A midsummer pole in the living room and herring on the table | c: Fireworks every Sunday until Christmas Eve | d: Demonstrations with speeches about social and political issues	a: Pencerede Advent yıldızı ve dört mumlu Advent şamdanı | b: Oturma odasında midsommar direği ve masada ringa balığı | c: Noel arifesine kadar her pazar havai fişekler | d: Toplumsal ve siyasi konular hakkında konuşmalar yapılan gösteriler	Under advent har många en lysande adventsstjärna i fönstret och en adventsljusstake med fyra ljus på bordet. Ett ljus tänds varje söndag fram till jul, medan midsommarstång, fyrverkerier och demonstrationer hör till andra högtider.	During Advent, many homes have a lit Advent star in the window and an Advent candleholder with four candles on the table. One candle is lit each Sunday until Christmas, while midsummer poles, fireworks, and demonstrations belong to other holidays.	Advent döneminde birçok evde pencerede ışıklı bir Advent yıldızı ve masada dört mumlu bir Advent şamdanı bulunur. Noel’e kadar her pazar bir mum yakılır; midsommar direği, havai fişekler ve gösteriler ise başka bayramlara aittir.	pending_native_review	pending_reviewer_notes
q136	tr	13	Ch. 13 · Traditions and holidays	Traditioner och högtider	Alla helgons dag	46	Vad gör många på Alla helgons dag i Sverige?	What do many people do on All Saints’ Day in Sweden?	İsveç’te birçok kişi Azizler Günü’nde ne yapar?	a	Går till kyrkogården och tänder ljus på gravar	Go to cemeteries and light candles on graves	Mezarlıklara gider ve mezarlarda mum yakarlar	a: Går till kyrkogården och tänder ljus på gravar | b: Dansar runt midsommarstången och binder blomsterkransar | c: Tänder stora brasor för att välkomna våren | d: Öppnar en lucka i adventskalendern varje dag	a: Go to cemeteries and light candles on graves | b: Dance around a midsummer pole and make flower wreaths | c: Light large bonfires to welcome spring | d: Open one Advent calendar door each day	a: Mezarlıklara gider ve mezarlarda mum yakarlar | b: Midsommar direğinin etrafında dans eder ve çiçek taçları yaparlar | c: Baharı karşılamak için büyük ateşler yakarlar | d: Her gün Advent takviminden bir kapak açarlar	På Alla helgons dag går många till kyrkogården och tänder ljus på släktingars och vänners gravar för att minnas och hedra dem som har dött. Dans runt midsommarstången, brasor och adventskalendrar hör till midsommar, valborg och advent.	On All Saints’ Day, many people go to cemeteries and light candles on relatives’ and friends’ graves to remember and honor those who have died. Dancing around a midsummer pole, bonfires, and Advent calendars belong to Midsummer, Walpurgis Night, and Advent.	Azizler Günü’nde birçok kişi mezarlıklara gider ve ölenleri anmak ve onurlandırmak için akraba ve arkadaşlarının mezarlarında mum yakar. Midsommar direği etrafında dans, ateşler ve Advent takvimleri Midsommar, Valborg ve Advent’e aittir.	pending_native_review	pending_reviewer_notes
q137	tr	13	Ch. 13 · Traditions and holidays	Traditioner och högtider	Nya traditioner	47	Vad kan hända med traditioner när människor flyttar till andra länder?	What can happen to traditions when people move to other countries?	İnsanlar başka ülkelere taşındığında geleneklere ne olabilir?	a	De kan tas med och anpassas till nya platser och människor	They can be brought along and adapted to new places and people	Yanlarında götürülebilir ve yeni yerlere ve insanlara uyarlanabilirler	a: De kan tas med och anpassas till nya platser och människor | b: De måste alltid försvinna helt | c: De blir automatiskt svenska lagar | d: De får bara firas på Sveriges nationaldag	a: They can be brought along and adapted to new places and people | b: They must always disappear completely | c: They automatically become Swedish laws | d: They may only be celebrated on Sweden's National Day	a: Yanlarında götürülebilir ve yeni yerlere ve insanlara uyarlanabilirler | b: Her zaman tamamen yok olmaları gerekir | c: Otomatik olarak İsveç yasaları olurlar | d: Yalnızca İsveç Ulusal Günü’nde kutlanabilirler	När människor flyttar till andra länder kan de ta med sig traditioner och anpassa dem till de platser och människor de möter. Id al-fitr, Nouruz och Newroz är exempel på traditioner som har kommit till Sverige med invandrare; därför är alternativen om att traditioner måste försvinna, bli lagar eller bara firas på nationaldagen fel.	When people move to other countries, they can bring traditions with them and adapt them to the places and people they meet. Eid al-Fitr, Nouruz, and Newroz are examples of traditions that have come to Sweden with immigrants, so the options saying traditions must disappear, become laws, or only be celebrated on National Day are incorrect.	İnsanlar başka ülkelere taşındığında geleneklerini yanlarında götürebilir ve karşılaştıkları yerlere ve insanlara uyarlayabilirler. Ramazan Bayramı, Nouruz ve Newroz, göçmenlerle İsveç’e gelen geleneklere örnektir; bu nedenle geleneklerin yok olması, yasa olması veya yalnızca Ulusal Gün’de kutlanması seçenekleri yanlıştır.	pending_native_review	pending_reviewer_notes
q138	tr	13	Ch. 13 · Traditions and holidays	Traditioner och högtider	Jul	47	Vad gör många med en julgran vid jul i Sverige?	What do many people do with a Christmas tree at Christmas in Sweden?	İsveç’te birçok kişi Noel’de bir ağaçla ne yapar?	a	Tar in en julgran i hemmet och dekorerar den med ljusslingor, kulor och glitter	Bring a Christmas tree into the home and decorate it with strings of lights, baubles, and tinsel	Eve bir çam ağacı getirip ışık zincirleri, süs topları ve simle süslerler	a: Tar in en julgran i hemmet och dekorerar den med ljusslingor, kulor och glitter | b: Planterar en julgran på kyrkogården och tänder gravljus | c: Dansar runt en julgran utomhus för att välkomna sommaren | d: Tänder en julgran som vårbrasa på valborgsmässoafton	a: Bring a Christmas tree into the home and decorate it with strings of lights, baubles, and tinsel | b: Plant a Christmas tree at the cemetery and light grave candles | c: Dance around a Christmas tree outdoors to welcome summer | d: Light a Christmas tree as a spring bonfire on Walpurgis Night	a: Eve bir çam ağacı getirip ışık zincirleri, süs topları ve simle süslerler | b: Mezarlığa bir ağaç dikip mezar mumları yakarlar | c: Yazı karşılamak için dışarıda bir ağacın etrafında dans ederler | d: Valborg gecesinde bir ağacı bahar ateşi olarak yakarlar	Vid jul tar många in en julgran i hemmet och dekorerar den med ljusslingor, kulor och glitter. Julgranen hör till julfirandet, medan gravljus, midsommardans och valborgsbrasor hör till andra högtider.	At Christmas, many people bring a Christmas tree into the home and decorate it with strings of lights, baubles, and tinsel. The Christmas tree belongs to Christmas celebrations, while grave candles, Midsummer dancing, and Walpurgis bonfires belong to other holidays.	Noel’de birçok kişi eve bir çam ağacı getirir ve onu ışık zincirleri, süs topları ve simle süsler. Noel ağacı Noel kutlamasına aittir; mezar mumları, Midsommar dansı ve Valborg ateşleri başka bayramlara aittir.	pending_native_review	pending_reviewer_notes
q139	tr	13	Ch. 13 · Traditions and holidays	Traditioner och högtider	Jul	47	Vad firar julen traditionellt inom kristendomen?	What does Christmas traditionally celebrate in Christianity?	Noel Hristiyanlıkta geleneksel olarak neyi kutlar?	a	Jesu födelse	Jesus' birth	İsa’nın doğumu	a: Jesu födelse | b: Vårens ankomst | c: Arbetarnas dag | d: Det nya årets ankomst	a: Jesus' birth | b: The arrival of spring | c: Workers' Day | d: The arrival of the new year	a: İsa’nın doğumu | b: Baharın gelişi | c: İşçi Bayramı | d: Yeni yılın gelişi	Julen är traditionellt en kristen högtid för att fira Jesu födelse. I Sverige är julen också en stor familjehögtid, medan vårens ankomst, arbetarnas dag och det nya årets ankomst hör till valborg, första maj och nyår.	Christmas is traditionally a Christian holiday celebrating Jesus' birth. In Sweden, Christmas is also a major family holiday, while the arrival of spring, Workers' Day, and the arrival of the new year belong to Walpurgis Night, May Day, and New Year.	Noel geleneksel olarak İsa’nın doğumunu kutlayan Hristiyan bir bayramdır. İsveç’te aynı zamanda büyük bir aile bayramıdır; baharın gelişi, İşçi Bayramı ve yeni yılın gelişi ise Valborg, Bir Mayıs ve yılbaşına aittir.	pending_native_review	pending_reviewer_notes
q140	tr	13	Ch. 13 · Traditions and holidays	Traditioner och högtider	Jul	47	Hur firar många jul i Sverige även när julen inte har religiös betydelse för dem?	How do many people in Sweden celebrate Christmas even when it has no religious meaning for them?	İsveç’te birçok kişi Noel’in kendileri için dinî anlamı olmasa bile Noel’i nasıl kutlar?	a	Många firar jul som en familjehögtid även när julen inte har religiös betydelse för dem	Many people celebrate Christmas as a family holiday even when it has no religious meaning for them	Birçok kişi Noel’i dinî anlamı olmasa bile aile bayramı olarak kutlar	a: Många firar jul som en familjehögtid även när julen inte har religiös betydelse för dem | b: Jul firas alltid med demonstrationer om sociala frågor | c: Jul är främst en högtid för att välkomna våren med brasor | d: Jul firas på samma sätt som nyårsafton med fyrverkerier vid midnatt	a: Many people celebrate Christmas as a family holiday even when it has no religious meaning for them | b: Christmas is always celebrated with demonstrations about social issues | c: Christmas is mainly a holiday for welcoming spring with bonfires | d: Christmas is celebrated the same way as New Year's Eve with midnight fireworks	a: Birçok kişi Noel’i dinî anlamı olmasa bile aile bayramı olarak kutlar | b: Noel her zaman toplumsal konularla ilgili gösterilerle kutlanır | c: Noel esas olarak baharı ateşlerle karşılama bayramıdır | d: Noel, yılbaşı gecesi gibi gece yarısı havai fişeklerle kutlanır	Julen har kristna rötter och är också en stor familjehögtid i Sverige. Många firar jul som en familjehögtid även när julen inte har religiös betydelse för dem, medan demonstrationer, vårbrasor och nyårsfyrverkerier hör till andra högtider.	Christmas has Christian roots and is also a major family holiday in Sweden. Many people celebrate Christmas as a family holiday even when it has no religious meaning for them, while demonstrations, spring bonfires, and New Year fireworks belong to other holidays.	Noel’in Hristiyan kökleri vardır ve İsveç’te aynı zamanda büyük bir aile bayramıdır. Birçok kişi Noel’i dinî anlamı olmasa bile aile bayramı olarak kutlar; gösteriler, bahar ateşleri ve yılbaşı havai fişekleri başka bayramlara aittir.	pending_native_review	pending_reviewer_notes
q141	tr	13	Ch. 13 · Traditions and holidays	Traditioner och högtider	Lucia	47	Vad brukar man bjuda på den 13 december i samband med lucia?	What is commonly served on 13 December in connection with Lucia?	13 Aralık’ta Lucia ile bağlantılı olarak genellikle ne ikram edilir?	a	Särskilda lussebullar med saffran	Special saffron Lucia buns	Özel safranlı Lucia çörekleri	a: Särskilda lussebullar med saffran | b: Sill, färskpotatis och jordgubbar | c: Ägg, lamm, lax och sill | d: Godis i påskägg	a: Special saffron Lucia buns | b: Herring, new potatoes, and strawberries | c: Eggs, lamb, salmon, and herring | d: Candy in Easter eggs	a: Özel safranlı Lucia çörekleri | b: Ringa balığı, taze patates ve çilek | c: Yumurta, kuzu eti, somon ve ringa balığı | d: Paskalya yumurtalarında şekerleme	På luciadagen den 13 december brukar man bjuda på särskilda lussebullar med saffran. Sill, färskpotatis och jordgubbar hör till midsommar, medan ägg, lamm, lax, sill och godis i påskägg hör till påsk.	On Lucia Day, 13 December, special saffron Lucia buns are commonly served. Herring, new potatoes, and strawberries belong to Midsummer, while eggs, lamb, salmon, herring, and candy in Easter eggs belong to Easter.	Lucia Günü olan 13 Aralık’ta genellikle özel safranlı Lucia çörekleri ikram edilir. Ringa balığı, taze patates ve çilek Midsommar’a; yumurta, kuzu eti, somon, ringa balığı ve Paskalya yumurtalarındaki şekerler Paskalya’ya aittir.	pending_native_review	pending_reviewer_notes
q142	tr	1	Ch. 01 · The country of Sweden	Landet Sverige	Skogar, sjöar och öar	6	Hur många öar har Sverige?	How many islands does Sweden have?	İsveç’in kaç adası vardır?	a	Cirka 250 000	About 250,000	Yaklaşık 250.000	a: Cirka 250 000 | b: Cirka 25 000 | c: Cirka 2 500 | d: Cirka 250	a: About 250,000 | b: About 25,000 | c: About 2,500 | d: About 250	a: Yaklaşık 250.000 | b: Yaklaşık 25.000 | c: Yaklaşık 2.500 | d: Yaklaşık 250	Sverige har cirka 250 000 öar, fler än något annat land i världen. Därför är cirka 250 000 rätt, medan 25 000, 2 500 och 250 är för låga tal.	Sweden has about 250,000 islands, more than any other country in the world. That makes about 250,000 correct, while 25,000, 2,500, and 250 are too low.	İsveç’in yaklaşık 250.000 adası vardır; bu sayı dünyadaki başka herhangi bir ülkeden fazladır. Bu nedenle yaklaşık 250.000 doğru cevaptır; 25.000, 2.500 ve 250 çok düşük sayılardır.	pending_native_review	pending_reviewer_notes
q143	tr	1	Ch. 01 · The country of Sweden	Landet Sverige	Sveriges indelning	6	Sverige brukar delas in i Götaland, Svealand och Norrland.	Sweden is usually divided into Götaland, Svealand, and Norrland.	İsveç genellikle Götaland, Svealand ve Norrland olarak bölünür.	true	Sant	True	Doğru	true: Sant | false: Falskt	true: True | false: False	true: Doğru | false: Yanlış	Sverige brukar delas in i de tre landsdelarna Götaland, Svealand och Norrland. Götaland ligger i södra Sverige, Svealand i mellersta Sverige och Norrland i norra Sverige; Norrland omfattar mer än hälften av landets yta.	Sweden is usually divided into the three major parts Götaland, Svealand, and Norrland. Götaland is in southern Sweden, Svealand in central Sweden, and Norrland in northern Sweden; Norrland covers more than half of the country's area.	İsveç genellikle üç büyük bölüme ayrılır: Götaland, Svealand ve Norrland. Götaland İsveç’in güneyinde, Svealand orta kısmında, Norrland ise kuzeyindedir; Norrland ülke yüzölçümünün yarısından fazlasını kaplar.	pending_native_review	pending_reviewer_notes
q144	tr	1	Ch. 01 · The country of Sweden	Landet Sverige	Sveriges indelning	6	Hur många landskap är Sverige indelat i?	How many historical provinces is Sweden divided into?	İsveç kaç tarihsel eyalete ayrılır?	a	25 landskap	25 historical provinces	25 tarihsel eyalet	a: 25 landskap | b: 21 landskap | c: 290 landskap | d: 3 landskap	a: 25 historical provinces | b: 21 historical provinces | c: 290 historical provinces | d: 3 historical provinces	a: 25 tarihsel eyalet | b: 21 tarihsel eyalet | c: 290 tarihsel eyalet | d: 3 tarihsel eyalet	Sverige är indelat i 25 landskap. Landskapen hade förr egna lagar, men i dag styrs Sverige inte genom landskapen; 21 avser län, 290 avser kommuner och tre avser de stora landsdelarna.	Sweden is divided into 25 historical provinces. The provinces used to have their own laws, but Sweden is not governed through them today; 21 refers to counties, 290 to municipalities, and three to the major parts.	İsveç 25 tarihsel eyalete ayrılır. Bu eyaletlerin eskiden kendi yasaları vardı, ancak bugün İsveç onlar aracılığıyla yönetilmez; 21 ilçeleri, 290 belediyeleri ve üç ise büyük bölgeleri ifade eder.	pending_native_review	pending_reviewer_notes
