id	locale	chapter_id	chapter_label	source_chapter	source_section	source_page	question_sv	question_en	question_target	correct_option_id	correct_option_sv	correct_option_en	correct_option_target	options_sv	options_en	options_target	explanation_sv	explanation_en	explanation_target	native_review_status	reviewer_notes
q001	tr	1	Ch. 01 · The country of Sweden	Landet Sverige	Geografi, klimat och natur	5	Var ligger Sverige?	Where is Sweden located?	İsveç nerede bulunur?	a	I Norden i norra Europa	In the Nordic region in northern Europe	Kuzey Avrupa’daki Nordik bölgede	a: I Norden i norra Europa | b: I södra Europa | c: I västra Asien | d: I Nordamerika	a: In the Nordic region in northern Europe | b: In southern Europe | c: In western Asia | d: In North America	a: Kuzey Avrupa’daki Nordik bölgede | b: Güney Avrupa’da | c: Batı Asya’da | d: Kuzey Amerika’da	Sverige ligger i Norden i norra Europa. Norden består av Danmark, Finland, Island, Norge och Sverige och är en del av norra Europa.	Sweden is in the Nordic region in northern Europe. The Nordic region includes Denmark, Finland, Iceland, Norway, and Sweden and is part of northern Europe.	İsveç, Kuzey Avrupa’daki Nordik bölgede yer alır. Bu bölge Danimarka, Finlandiya, İzlanda, Norveç ve İsveç’i kapsar.	pending_native_review	pending_reviewer_notes
q002	tr	1	Ch. 01 · The country of Sweden	Landet Sverige	Geografi, klimat och natur	5	Sveriges nordligaste del ligger norr om polcirkeln.	Sweden's northernmost part lies north of the Arctic Circle.	İsveç’in en kuzeydeki bölümü Kuzey Kutup Dairesi’nin kuzeyindedir.	true	Sant	True	Doğru	true: Sant | false: Falskt	true: True | false: False	true: Doğru | false: Yanlış	Sveriges nordligaste del ligger norr om polcirkeln, i det arktiska området. Den norra delen av landet sträcker sig alltså in i området norr om polcirkeln.	Sweden's northernmost part lies north of the Arctic Circle, in the Arctic area. The northern part of the country therefore extends into the area north of the Arctic Circle.	İsveç’in en kuzey bölümü, Arktik bölgede Kuzey Kutup Dairesi’nin kuzeyindedir. Bu nedenle ülkenin kuzeyi bu dairenin kuzeyindeki alana kadar uzanır.	pending_native_review	pending_reviewer_notes
q003	tr	1	Ch. 01 · The country of Sweden	Landet Sverige	Geografi, klimat och natur	5	Ungefär hur långt sträcker sig Sverige från Treriksröset till Smygehuk?	Approximately how far does Sweden stretch from Treriksröset to Smygehuk?	İsveç, Treriksröset’ten Smygehuk’a kadar yaklaşık ne kadar uzanır?	b	Cirka 1 600 kilometer	About 1,600 kilometres	Yaklaşık 1600 kilometre	a: Cirka 160 kilometer | b: Cirka 1 600 kilometer | c: Cirka 16 000 kilometer | d: Cirka 60 kilometer	a: About 160 kilometres | b: About 1,600 kilometres | c: About 16,000 kilometres | d: About 60 kilometres	a: Yaklaşık 160 kilometre | b: Yaklaşık 1600 kilometre | c: Yaklaşık 16.000 kilometre | d: Yaklaşık 60 kilometre	Sverige är ett avlångt land som sträcker sig cirka 1 600 kilometer från Treriksröset i norr till Smygehuk i söder. Avstånden 160 och 60 kilometer är för korta, och 16 000 kilometer är för långt.	Sweden is an elongated country that stretches about 1,600 kilometres from Treriksröset in the north to Smygehuk in the south. The distances 160 and 60 kilometres are too short, and 16,000 kilometres is too long.	İsveç uzunlamasına uzanan bir ülkedir; kuzeydeki Treriksröset’ten güneydeki Smygehuk’a kadar yaklaşık 1600 kilometre uzanır. 160 ve 60 kilometre çok kısa, 16.000 kilometre ise çok uzundur.	pending_native_review	pending_reviewer_notes
q004	tr	1	Ch. 01 · The country of Sweden	Landet Sverige	Geografi, klimat och natur	5	Vad heter havet vid Sveriges östra kust?	What is the sea along Sweden's eastern coast called?	İsveç’in doğu kıyısındaki denizin adı nedir?	c	Östersjön	The Baltic Sea	Baltık Denizi	a: Nordsjön | b: Medelhavet | c: Östersjön | d: Atlanten	a: The North Sea | b: The Mediterranean Sea | c: The Baltic Sea | d: The Atlantic Ocean	a: Kuzey Denizi | b: Akdeniz | c: Baltık Denizi | d: Atlas Okyanusu	Havet vid Sveriges östra kust heter Östersjön. Nordsjön, Medelhavet och Atlanten är inte namnet på havet vid Sveriges östra kust.	The sea along Sweden's eastern coast is the Baltic Sea. The North Sea, the Mediterranean Sea, and the Atlantic Ocean are not the sea along Sweden's eastern coast.	İsveç’in doğu kıyısındaki deniz Baltık Denizi’dir. Kuzey Denizi, Akdeniz ve Atlas Okyanusu İsveç’in doğu kıyısındaki denizin adı değildir.	pending_native_review	pending_reviewer_notes
q005	tr	1	Ch. 01 · The country of Sweden	Landet Sverige	Geografi, klimat och natur	5	Vilka öar är Sveriges två största?	Which islands are Sweden's two largest?	İsveç’in en büyük iki adası hangileridir?	a	Gotland och Öland	Gotland and Öland	Gotland ve Öland	a: Gotland och Öland | b: Hisingen och Orust | c: Värmdö och Tjörn | d: Malmö och Göteborg	a: Gotland and Öland | b: Hisingen and Orust | c: Värmdö and Tjörn | d: Malmö and Gothenburg	a: Gotland ve Öland | b: Hisingen ve Orust | c: Värmdö ve Tjörn | d: Malmö ve Göteborg	Sveriges två största öar är Gotland och Öland. Hisingen, Orust, Värmdö och Tjörn är också svenska öar men är inte de två största, och Malmö och Göteborg är städer.	Sweden's two largest islands are Gotland and Öland. Hisingen, Orust, Värmdö, and Tjörn are also Swedish islands but are not the two largest, and Malmö and Gothenburg are cities.	İsveç’in en büyük iki adası Gotland ve Öland’dır. Hisingen, Orust, Värmdö ve Tjörn de İsveç adalarıdır ama en büyük iki ada değildir; Malmö ve Göteborg ise şehirlerdir.	pending_native_review	pending_reviewer_notes
q006	tr	1	Ch. 01 · The country of Sweden	Landet Sverige	Geografi, klimat och natur	5	Golfströmmen och den Nordatlantiska strömmen bidrar till Sveriges milda klimat.	The Gulf Stream and the North Atlantic Current help make Sweden's climate mild.	Golfstream ve Kuzey Atlantik Akıntısı, İsveç’in ikliminin ılıman olmasına katkı sağlar.	true	Sant	True	Doğru	true: Sant | false: Falskt	true: True | false: False	true: Doğru | false: Yanlış	Sverige har ett milt klimat jämfört med många andra områden på samma breddgrad. Golfströmmen och den Nordatlantiska strömmen transporterar varmt vatten mot Europa, vilket värmer luften som vindarna för in över Sverige.	Sweden has a mild climate compared with many other areas at the same latitude. The Gulf Stream and the North Atlantic Current carry warm water toward Europe, warming the air that winds bring over Sweden.	İsveç, aynı enlemdeki birçok bölgeye göre ılıman bir iklime sahiptir. Golfstream ve Kuzey Atlantik Akıntısı Avrupa’ya sıcak su taşır; bu da rüzgârların İsveç’e getirdiği havayı ısıtır.	pending_native_review	pending_reviewer_notes
q007	tr	1	Ch. 01 · The country of Sweden	Landet Sverige	Fjäll	6	Vad heter Sveriges högsta berg?	What is the name of Sweden's highest mountain?	İsveç’in en yüksek dağının adı nedir?	a	Kebnekaise	Kebnekaise	Kebnekaise	a: Kebnekaise | b: Smygehuk | c: Treriksröset | d: Mälaren	a: Kebnekaise | b: Smygehuk | c: Treriksröset | d: Mälaren	a: Kebnekaise | b: Smygehuk | c: Treriksröset | d: Mälaren	Sveriges högsta berg heter Kebnekaise och är cirka 2 000 meter högt. Det ligger i fjällen, den del av bergskedjan Skanderna som går längs gränsen mot Norge.	Sweden's highest mountain is Kebnekaise, at about 2,000 metres. It is in the mountain region called fjällen, part of the Scandinavian Mountains along the border with Norway.	İsveç’in en yüksek dağı Kebnekaise’dir ve yaklaşık 2000 metre yüksekliktedir. Norveç sınırı boyunca uzanan İskandinav Dağları’nın bir parçası olan fjällen adlı dağlık bölgede yer alır. (Treriksröset; Smygehuk)	pending_native_review	pending_reviewer_notes
q008	tr	1	Ch. 01 · The country of Sweden	Landet Sverige	Skogar, sjöar och öar	6	Vilka är Sveriges tre största sjöar?	What are Sweden's three largest lakes?	İsveç’in en büyük üç gölü hangileridir?	a	Vänern, Vättern och Mälaren	Vänern, Vättern, and Mälaren	Vänern, Vättern ve Mälaren	a: Vänern, Vättern och Mälaren | b: Östersjön, Kattegatt och Skagerrak | c: Gotland, Öland och Orust | d: Stockholm, Göteborg och Malmö	a: Vänern, Vättern, and Mälaren | b: The Baltic Sea, Kattegat, and Skagerrak | c: Gotland, Öland, and Orust | d: Stockholm, Gothenburg, and Malmö	a: Vänern, Vättern ve Mälaren | b: Baltık Denizi, Kattegat ve Skagerrak | c: Gotland, Öland ve Orust | d: Stockholm, Göteborg ve Malmö	Sverige har många sjöar spridda över hela landet, och de tre största är Vänern, Vättern och Mälaren. De andra alternativen räknar upp havsområden, öar eller städer i stället för sjöar.	Sweden has many lakes throughout the country, and the three largest are Vänern, Vättern, and Mälaren. The other choices list sea areas, islands, or cities instead of lakes.	İsveç’in dört bir yanında birçok göl vardır ve en büyük üçü Vänern, Vättern ve Mälaren’dir. Diğer seçenekler göller yerine deniz alanlarını, adaları veya şehirleri sayar.	pending_native_review	pending_reviewer_notes
q009	tr	1	Ch. 01 · The country of Sweden	Landet Sverige	Befolkning	7	Ungefär hur många människor bor i Sverige?	Approximately how many people live in Sweden?	İsveç’te yaklaşık kaç kişi yaşar?	a	Nästan 11 miljoner	Almost 11 million	Neredeyse 11 milyon	a: Nästan 11 miljoner | b: Nästan 1 miljon | c: Cirka 50 miljoner | d: Cirka 100 miljoner	a: Almost 11 million | b: Almost 1 million | c: About 50 million | d: About 100 million	a: Neredeyse 11 milyon | b: Neredeyse 1 milyon | c: Yaklaşık 50 milyon | d: Yaklaşık 100 milyon	Det bor nästan 11 miljoner människor i Sverige. Befolkningen är inte jämnt fördelad: de flesta bor i den södra delen av landet och längs kusterna.	Almost 11 million people live in Sweden. The population is not evenly distributed: most people live in the southern part of the country and along the coasts.	İsveç’te neredeyse 11 milyon insan yaşar. Nüfus eşit dağılmamıştır; çoğu kişi ülkenin güneyinde ve kıyılar boyunca yaşar.	pending_native_review	pending_reviewer_notes
q010	tr	1	Ch. 01 · The country of Sweden	Landet Sverige	Naturresurser	7	Vilka naturresurser är viktiga i Sverige?	Which natural resources are important in Sweden?	İsveç’te hangi doğal kaynaklar önemlidir?	a	Järnmalm och andra mineraler, skog, jordbruksmark och vatten	Iron ore and other minerals, forest, agricultural land, and water	Demir cevheri ve diğer mineraller, orman, tarım arazisi ve su	a: Järnmalm och andra mineraler, skog, jordbruksmark och vatten | b: Olja, naturgas, ökenmark och tropiskt regn | c: Kol, diamantgruvor, vulkanjord och palmer | d: Risfält, bomullsplantager, korallrev och tidvatten	a: Iron ore and other minerals, forest, agricultural land, and water | b: Oil, natural gas, desert land, and tropical rain | c: Coal, diamond mines, volcanic soil, and palm trees | d: Rice fields, cotton plantations, coral reefs, and tides	a: Demir cevheri ve diğer mineraller, orman, tarım arazisi ve su | b: Petrol, doğal gaz, çöl arazisi ve tropik yağmur | c: Kömür, elmas madenleri, volkanik toprak ve palmiyeler | d: Pirinç tarlaları, pamuk plantasyonları, mercan resifleri ve gelgitler	Sverige är rikt på flera viktiga naturresurser: järnmalm och andra mineraler, skog, jordbruksmark och vatten. Olja, naturgas, ökenmark, tropiskt regn och liknande beskriver inte Sveriges viktiga naturresurser.	Sweden is rich in several important natural resources: iron ore and other minerals, forests, agricultural land, and water. Oil, natural gas, desert land, tropical rain, and similar items do not describe Sweden's important natural resources.	İsveç birçok önemli doğal kaynak bakımından zengindir: demir cevheri ve diğer mineraller, ormanlar, tarım arazileri ve su. Petrol, doğal gaz, çöl arazisi, tropik yağmur ve benzeri şeyler İsveç’in önemli doğal kaynaklarını anlatmaz.	pending_native_review	pending_reviewer_notes
q011	tr	2	Ch. 02 · Sweden's democratic system	Sveriges demokratiska system	Demokrati betyder folkstyre	10	Vad betyder demokrati?	What does democracy mean?	Demokrasi ne anlama gelir?	a	Folkstyre	Rule by the people	Halkın yönetimi	a: Folkstyre | b: Militärstyre | c: Envälde | d: Företagsstyre	a: Rule by the people | b: Military rule | c: Autocracy | d: Rule by companies	a: Halkın yönetimi | b: Askerî yönetim | c: Mutlak yönetim | d: Şirketlerin yönetimi	Demokrati betyder folkstyre: makten utgår från folket och medborgarna kan påverka beslut. Människor ska kunna välja mellan flera politiska alternativ, och de som får makten ska kunna bytas ut. Militärstyre, envälde och företagsstyre lägger makten någon annanstans.	Democracy means rule by the people: power comes from the people, and citizens can influence decisions. People should be able to choose between several political alternatives, and those who gain power can be replaced. Military rule, autocracy, and rule by companies place power somewhere else.	Demokrasi halkın yönetimi demektir: güç halktan gelir ve vatandaşlar kararları etkileyebilir. İnsanlar birden fazla siyasi seçenek arasında seçim yapabilmeli ve iktidara gelenler değiştirilebilmelidir.	pending_native_review	pending_reviewer_notes
q012	tr	2	Ch. 02 · Sweden's democratic system	Sveriges demokratiska system	Demokrati betyder folkstyre	10	Vilket av följande ingår i fria val i en demokrati?	Which of the following is part of free elections in a democracy?	Aşağıdakilerden hangisi demokraside serbest seçimlerin parçasıdır?	a	Alla som har rätt att rösta har en röst var	Everyone who is eligible to vote has one vote	Oy verme hakkı olan herkesin birer oyu vardır	a: Alla som har rätt att rösta har en röst var | b: Bara ett parti får ställa upp | c: Väljare måste visa offentligt hur de röstar | d: Regeringen bestämmer hur alla röster ska användas	a: Everyone who is eligible to vote has one vote | b: Only one party may stand for election | c: Voters must publicly show how they vote | d: The government decides how all votes must be used	a: Oy verme hakkı olan herkesin birer oyu vardır | b: Sadece bir parti seçime girebilir | c: Seçmenler nasıl oy verdiklerini açıkça göstermek zorundadır | d: Hükümet tüm oyların nasıl kullanılacağına karar verir	Fria val innebär att alla som har rätt att rösta har en röst var. Väljare ska kunna uttrycka sina åsikter utan hot eller tvång, det ska finnas flera partier och valet ska vara hemligt.	Free elections mean that everyone who is eligible to vote has one vote. Voters should be able to express their views without threats or coercion, there should be several parties, and the vote should be secret.	Serbest seçimler, oy verme hakkı olan herkesin birer oyu olması demektir. Seçmenler tehdit veya zorlama olmadan görüşlerini ifade edebilmeli, birden fazla parti olmalı ve oy gizli olmalıdır.	pending_native_review	pending_reviewer_notes
q013	tr	2	Ch. 02 · Sweden's democratic system	Sveriges demokratiska system	En stark demokrati	10	Hur kan människor påverka samhället och delta i demokratin?	How can people influence society and participate in democracy?	Toplumu etkilemenin ve topluma katılmanın bir yolu hangisidir?	a	Kontakta politiker, demonstrera eller skriva på en namninsamling	Contact politicians, join a demonstration, or sign a petition	Siyasetçilerle iletişime geçmek, gösteri yapmak veya imza kampanyası imzalamak	a: Kontakta politiker, demonstrera eller skriva på en namninsamling | b: Förbjuda andra från att rösta i politiska val | c: Tvinga journalister att skriva vissa åsikter | d: Stoppa människor från att prata om politik	a: Contact politicians, join a demonstration, or sign a petition | b: Ban others from voting in political elections | c: Force journalists to write certain opinions | d: Stop people from talking about politics	a: Siyasetçilerle iletişime geçmek, gösteri yapmak veya imza kampanyası imzalamak | b: Başkalarının siyasi seçimlerde oy vermesini yasaklamak | c: Gazetecileri belirli görüşleri yazmaya zorlamak | d: İnsanların siyaset hakkında konuşmasını engellemek	Det finns flera demokratiska sätt att påverka och delta i samhället, till exempel att kontakta politiker, demonstrera och starta eller skriva på en namninsamling. De andra alternativen skulle hindra människor från att rösta, uttrycka åsikter eller delta i demokratin.	People can influence and participate in society in several democratic ways, including contacting politicians, joining a demonstration, and starting or signing a petition. The other options would stop people from voting, expressing opinions, or taking part in democracy.	Toplumu etkilemenin ve topluma katılmanın birkaç demokratik yolu vardır; örneğin siyasetçilerle iletişim kurmak, gösteri yapmak ve imza kampanyası başlatmak veya imzalamak. Diğer seçenekler insanların oy vermesini, görüş belirtmesini veya demokrasiye katılmasını engeller.	pending_native_review	pending_reviewer_notes
q014	tr	2	Ch. 02 · Sweden's democratic system	Sveriges demokratiska system	Demokrati betyder folkstyre	10	Vad kallas det när lagarna gäller lika för alla och ingen får dömas utan en rättvis rättegång?	What is it called when laws apply equally to everyone and no one can be convicted without a fair trial?	Yasaların herkese eşit uygulanmasına ve kimsenin adil yargılama olmadan mahkûm edilememesine ne denir?	a	Rättssäkerhet	The rule of law	Hukuki güvenlik	a: Rättssäkerhet | b: Censur | c: Segregation | d: Monarki	a: The rule of law | b: Censorship | c: Segregation | d: Monarchy	a: Hukuki güvenlik | b: Sansür | c: Ayrışma | d: Monarşi	Rättssäkerhet betyder att lagarna gäller för alla och att ingen får dömas utan en rättvis rättegång. Censur, segregation och monarki betyder andra saker.	The rule of law means that laws apply to everyone and that no one can be convicted without a fair trial. Censorship, segregation, and monarchy mean other things.	Hukuki güvenlik, yasaların herkes için geçerli olması ve kimsenin adil yargılama olmadan mahkûm edilememesi demektir. Sansür, ayrışma ve monarşi başka şeylerdir.	pending_native_review	pending_reviewer_notes
q015	tr	2	Ch. 02 · Sweden's democratic system	Sveriges demokratiska system	Hot mot demokratin	11	Hur kan ett lågt valdeltagande påverka demokratin?	How can a low voter turnout affect democracy?	Düşük seçmen katılımı demokrasiyi nasıl etkileyebilir?	a	Människor kan få mindre möjlighet att påverka politiska beslut	People may have fewer opportunities to influence political decisions	İnsanların siyasi kararları etkileme olanağı azalabilir	a: Människor kan få mindre möjlighet att påverka politiska beslut | b: Alla väljare får två röster var i nästa val | c: Domstolarna tar över riksdagens uppgifter | d: Samhället blir automatiskt mer integrerat	a: People may have fewer opportunities to influence political decisions | b: All voters get two votes each in the next election | c: The courts take over the Riksdag's tasks | d: Society automatically becomes more integrated	a: İnsanların siyasi kararları etkileme olanağı azalabilir | b: Tüm seçmenler sonraki seçimde ikişer oy alır | c: Mahkemeler Riksdag’ın görevlerini devralır | d: Toplum kendiliğinden daha bütünleşmiş olur	Ett lågt valdeltagande kan göra det svårare för människor att påverka politiska beslut i sin vardag. Det kan också öka skillnaderna mellan grupper i samhället; de andra alternativen beskriver följder som inte följer av lågt valdeltagande.	Low voter turnout can leave people with fewer opportunities to influence political decisions in everyday life. It can also widen differences between groups in society; the other options describe effects that do not follow from low voter turnout.	Düşük seçmen katılımı, insanların günlük yaşamlarında siyasi kararları etkilemesini zorlaştırabilir. Toplumdaki gruplar arasındaki farkları da artırabilir. Diğer seçenekler düşük katılımın sonucu değildir.	pending_native_review	pending_reviewer_notes
q016	tr	3	Ch. 03 · How Sweden is governed	Så här styrs Sverige	Staten	12	Hur väljer medborgarna ledamöter till riksdagen i Sveriges parlamentariska representativa demokrati?	How do citizens choose members of the Riksdag in Sweden's parliamentary representative democracy?	Vatandaşlar İsveç’in parlamenter temsili demokrasisinde Riksdag üyelerini nasıl seçer?	a	Genom att rösta i allmänna val	By voting in general elections	Genel seçimlerde oy vererek	a: Genom att rösta i allmänna val | b: Domstolarna väljer alla riksdagsledamöter | c: Kungen bestämmer ensam över riksdagen | d: Myndigheter röstar fram regeringen	a: By voting in general elections | b: The courts elect all members of the Riksdag | c: The king alone decides over the Riksdag | d: Government agencies vote the government into office	a: Genel seçimlerde oy vererek | b: Mahkemeler tüm Riksdag üyelerini seçer | c: Kral Riksdag hakkında tek başına karar verir | d: Kamu kurumları hükümeti oylayarak seçer	Sverige är en parlamentarisk representativ demokrati: medborgarna väljer riksdagsledamöter genom att rösta i allmänna val. Riksdagen fattar sedan beslut om lagar och statens budget, så varken domstolarna, kungen eller myndigheter väljer ledamöterna.	Sweden is a parliamentary representative democracy: citizens elect members of the Riksdag by voting in general elections. The Riksdag then decides on laws and the state budget, so the courts, the king, and government agencies do not choose its members.	İsveç parlamenter temsili bir demokrasidir: vatandaşlar Riksdag üyelerini genel seçimlerde oy vererek seçer. Riksdag daha sonra yasalar ve devlet bütçesi hakkında karar verir; bu yüzden mahkemeler, kral veya kamu kurumları üyeleri seçmez.	pending_native_review	pending_reviewer_notes
q017	tr	3	Ch. 03 · How Sweden is governed	Så här styrs Sverige	Staten	12	Hur många ledamöter har riksdagen?	How many members does the Riksdag have?	Riksdag’ın kaç üyesi vardır?	c	349	349	349	a: 21 | b: 290 | c: 349 | d: 1 600	a: 21 | b: 290 | c: 349 | d: 1,600	a: 21 | b: 290 | c: 349 | d: 1600	Riksdagen har 349 ledamöter, och de väljs vart fjärde år. Talen 21, 290 och 1 600 anger inte antalet ledamöter i riksdagen.	The Riksdag has 349 members, and they are elected every four years. The numbers 21, 290, and 1,600 do not give the number of Riksdag members.	Riksdag’ın 349 üyesi vardır ve üyeler dört yılda bir seçilir. 21, 290 ve 1600 sayıları Riksdag üye sayısı değildir.	pending_native_review	pending_reviewer_notes
q018	tr	3	Ch. 03 · How Sweden is governed	Så här styrs Sverige	Staten	12	Vem väljer statsministern?	Who chooses the prime minister?	Başbakanı kim seçer?	a	Riksdagen	The Riksdag	Riksdag	a: Riksdagen | b: Kungen ensam | c: Polismyndigheten | d: Regionfullmäktige	a: The Riksdag | b: The king alone | c: The Swedish Police Authority | d: The regional council	a: Riksdag | b: Sadece kral | c: İsveç Polis Kurumu | d: Bölge meclisi	Riksdagen väljer statsministern, som får i uppdrag att bilda regering. Statsministern väljer därefter ministrarna; varken kungen, Polismyndigheten eller regionfullmäktige väljer statsminister.	The Riksdag chooses the prime minister, who is then tasked with forming a government. The prime minister chooses the ministers; neither the king, the Swedish Police Authority, nor regional councils choose the prime minister.	Riksdag başbakanı seçer ve başbakana hükümeti kurma görevi verilir. Başbakan daha sonra bakanları seçer; kral, Polis Kurumu veya bölge meclisi başbakanı seçmez.	pending_native_review	pending_reviewer_notes
q019	tr	4	Ch. 04 · Political elections and parties	Politiska val och partier	Val och röstning	14	Hur gammal måste man ha fyllt för att ha rösträtt?	How old must a person be to have the right to vote?	Oy hakkına sahip olmak için kaç yaşını doldurmak gerekir?	b	18 år	18 years old	18 yaş	a: 16 år | b: 18 år | c: 20 år | d: 25 år	a: 16 years old | b: 18 years old | c: 20 years old | d: 25 years old	a: 16 yaş | b: 18 yaş | c: 20 yaş | d: 25 yaş	Man måste ha fyllt 18 år för att ha rösträtt. Därför är 16, 20 och 25 år fel här; i riksdagsval krävs också svenskt medborgarskap.	A person must have turned 18 to have the right to vote. That is why 16, 20, and 25 are wrong here; voting in a Riksdag election also requires Swedish citizenship.	Oy hakkına sahip olmak için 18 yaşını doldurmuş olmak gerekir. Bu nedenle 16, 20 ve 25 burada yanlıştır; Riksdag seçimlerinde İsveç vatandaşı olmak da gerekir.	pending_native_review	pending_reviewer_notes
