id	locale	chapter_id	chapter_label	source_chapter	source_section	source_page	question_sv	question_en	question_target	correct_option_id	correct_option_sv	correct_option_en	correct_option_target	options_sv	options_en	options_target	explanation_sv	explanation_en	explanation_target	native_review_status	reviewer_notes
q131	uk	13	Ch. 13 · Traditions and holidays	Traditioner och högtider	Påsk	45	Vad är vanligt på påskafton i Sverige?	What is common on Easter Saturday in Sweden?	Що звично робити у Великодню суботу у Швеції?	a	Att äta ägg, lamm, lax och sill och att barn får godis i påskägg	Eating eggs, lamb, salmon, and herring, and children getting candy in Easter eggs	Їсти яйця, ягнятину, лосось і оселедець, а дітям отримувати цукерки у великодніх яйцях	a: Att äta ägg, lamm, lax och sill och att barn får godis i påskägg | b: Att tända adventsljus och öppna adventskalendrar | c: Att tända ljus på gravar för att minnas dem som har dött | d: Att ordna demonstrationer och tal om sociala frågor	a: Eating eggs, lamb, salmon, and herring, and children getting candy in Easter eggs | b: Lighting Advent candles and opening Advent calendars | c: Lighting candles on graves to remember people who have died | d: Holding demonstrations and speeches about social issues	a: Їсти яйця, ягнятину, лосось і оселедець, а дітям отримувати цукерки у великодніх яйцях | b: Запалювати адвентські свічки та відкривати адвент-календарі | c: Запалювати свічки на могилах, щоб згадати померлих | d: Організовувати демонстрації та промови про соціальні питання	På påskafton är det vanligt att äta ägg, lamm, lax och sill, och barn får ofta godis i påskägg. Adventsljus, gravljus och demonstrationer hör i stället till advent, Alla helgons dag och första maj.	On Easter Saturday, it is common to eat eggs, lamb, salmon, and herring, and children often receive candy in Easter eggs. Advent candles, grave candles, and demonstrations instead belong to Advent, All Saints’ Day, and May Day.	У Великодню суботу звично їсти яйця, ягнятину, лосось і оселедець, а діти часто отримують цукерки у великодніх яйцях. Адвентські свічки, свічки на могилах і демонстрації належать відповідно до Адвенту, Дня всіх святих і Першого травня.	pending_native_review	pending_reviewer_notes
q132	uk	13	Ch. 13 · Traditions and holidays	Traditioner och högtider	Advent	47	Vad gör barn ofta med en adventskalender hemma?	What do children often do with an Advent calendar at home?	Що діти часто роблять удома з адвент-календарем?	a	Öppnar en lucka varje dag fram till julafton	Open one door each day until Christmas Eve	Щодня відкривають одне віконце до Святвечора	a: Öppnar en lucka varje dag fram till julafton | b: Tänder stora brasor på kvällen | c: Bär ljuskrona i ett luciatåg | d: Går till julotta tidigt på morgonen	a: Open one door each day until Christmas Eve | b: Light large bonfires in the evening | c: Wear a crown of lights in a Lucia procession | d: Go to julotta early in the morning	a: Щодня відкривають одне віконце до Святвечора | b: Увечері запалюють великі вогнища | c: Носять корону зі світла у процесії Люсії | d: Йдуть на Julotta рано вранці	Under advent har många en adventskalender hemma, och barn öppnar en lucka varje dag fram till julafton. Brasor, ljuskrona i luciatåg och julotta hör till valborg, lucia och jul, inte adventskalendern.	During Advent, many people have an Advent calendar at home, and children open one door each day until Christmas Eve. Bonfires, a crown of lights in a Lucia procession, and julotta belong to Walpurgis Night, Lucia, and Christmas, not the Advent calendar.	Під час Адвенту багато людей мають удома адвент-календар, і діти щодня відкривають одне віконце до Святвечора. Вогнища, корона зі світла у процесії Люсії та Julotta належать до Вальпургієвої ночі, Люсії та Різдва, а не до адвент-календаря.	pending_native_review	pending_reviewer_notes
q133	uk	13	Ch. 13 · Traditions and holidays	Traditioner och högtider	Sveriges nationaldag	46	Vilket år blev Sveriges nationaldag en helgdag genom riksdagsbeslut?	In which year did Sweden’s National Day become a public holiday through a Riksdag decision?	У якому році Національний день Швеції став державним святом за рішенням Риксдагу?	a	2005	2005	2005	a: 2005 | b: 1523 | c: 1809 | d: 1995	a: 2005 | b: 1523 | c: 1809 | d: 1995	a: 2005 | b: 1523 | c: 1809 | d: 1995	Sveriges nationaldag den 6 juni gjordes till helgdag genom ett riksdagsbeslut 2005. Åren 1523 och 1809 nämns som historiska skäl till datumet, medan 1995 hör till Sveriges EU-medlemskap.	Sweden’s National Day on 6 June became a public holiday through a Riksdag decision in 2005. The years 1523 and 1809 are mentioned as historical reasons for the date, while 1995 belongs to Sweden’s EU membership.	Національний день Швеції 6 червня став державним святом за рішенням Риксдагу у 2005 році. 1523 і 1809 роки згадуються як історичні причини цієї дати, тоді як 1995 рік пов’язаний із членством Швеції в ЄС.	pending_native_review	pending_reviewer_notes
q134	uk	13	Ch. 13 · Traditions and holidays	Traditioner och högtider	Alla helgons dag	46	När firas Alla helgons dag i Sverige?	When is All Saints’ Day observed in Sweden?	Коли у Швеції відзначають День усіх святих?	a	På en lördag i slutet av oktober eller början av november	On a Saturday at the end of October or the beginning of November	У суботу наприкінці жовтня або на початку листопада	a: På en lördag i slutet av oktober eller början av november | b: På en fredag mellan 19 och 25 juni | c: På den 30 april varje år | d: På de fyra söndagarna före juldagen	a: On a Saturday at the end of October or the beginning of November | b: On a Friday between 19 and 25 June | c: On 30 April every year | d: On the four Sundays before Christmas Day	a: У суботу наприкінці жовтня або на початку листопада | b: У п’ятницю між 19 і 25 червня | c: 30 квітня щороку | d: У чотири неділі перед Різдвом	Alla helgons dag firas på en lördag i slutet av oktober eller i början av november. Midsommarafton, valborgsmässoafton och advent har andra tidpunkter under året, därför är de alternativen fel.	All Saints’ Day is observed on a Saturday at the end of October or at the beginning of November. Midsummer Eve, Walpurgis Night, and Advent occur at other times of the year, so those options are incorrect.	День усіх святих відзначають у суботу наприкінці жовтня або на початку листопада. Переддень Мідсоммара, Вальпургієва ніч і Адвент припадають на інші пори року, тому ці варіанти неправильні.	pending_native_review	pending_reviewer_notes
q135	uk	13	Ch. 13 · Traditions and holidays	Traditioner och högtider	Advent	47	Vad är vanligt i många hem under advent?	What is common in many homes during Advent?	Що є звичним у багатьох домівках під час Адвенту?	a	En adventsstjärna i fönstret och en adventsljusstake med fyra ljus	An Advent star in the window and an Advent candleholder with four candles	Адвентська зірка у вікні та адвентський свічник із чотирма свічками	a: En adventsstjärna i fönstret och en adventsljusstake med fyra ljus | b: En midsommarstång i vardagsrummet och sill på bordet | c: Fyrverkerier varje söndag fram till julafton | d: Demonstrationer med tal om sociala och politiska frågor	a: An Advent star in the window and an Advent candleholder with four candles | b: A midsummer pole in the living room and herring on the table | c: Fireworks every Sunday until Christmas Eve | d: Demonstrations with speeches about social and political issues	a: Адвентська зірка у вікні та адвентський свічник із чотирма свічками | b: Мідсоммарський стовп у вітальні та оселедець на столі | c: Феєрверки щонеділі до Святвечора | d: Демонстрації з промовами про соціальні та політичні питання	Under advent har många en lysande adventsstjärna i fönstret och en adventsljusstake med fyra ljus på bordet. Ett ljus tänds varje söndag fram till jul, medan midsommarstång, fyrverkerier och demonstrationer hör till andra högtider.	During Advent, many homes have a lit Advent star in the window and an Advent candleholder with four candles on the table. One candle is lit each Sunday until Christmas, while midsummer poles, fireworks, and demonstrations belong to other holidays.	Під час Адвенту в багатьох домівках є світла адвентська зірка у вікні та адвентський свічник із чотирма свічками на столі. Щонеділі до Різдва запалюють одну свічку, тоді як мідсоммарський стовп, феєрверки та демонстрації належать до інших свят.	pending_native_review	pending_reviewer_notes
q136	uk	13	Ch. 13 · Traditions and holidays	Traditioner och högtider	Alla helgons dag	46	Vad gör många på Alla helgons dag i Sverige?	What do many people do on All Saints’ Day in Sweden?	Що багато людей роблять у Швеції на День усіх святих?	a	Går till kyrkogården och tänder ljus på gravar	Go to cemeteries and light candles on graves	Йдуть на кладовища та запалюють свічки на могилах	a: Går till kyrkogården och tänder ljus på gravar | b: Dansar runt midsommarstången och binder blomsterkransar | c: Tänder stora brasor för att välkomna våren | d: Öppnar en lucka i adventskalendern varje dag	a: Go to cemeteries and light candles on graves | b: Dance around a midsummer pole and make flower wreaths | c: Light large bonfires to welcome spring | d: Open one Advent calendar door each day	a: Йдуть на кладовища та запалюють свічки на могилах | b: Танцюють навколо мідсоммарського стовпа й плетуть квіткові вінки | c: Запалюють великі вогнища, щоб привітати весну | d: Щодня відкривають одне віконце адвент-календаря	På Alla helgons dag går många till kyrkogården och tänder ljus på släktingars och vänners gravar för att minnas och hedra dem som har dött. Dans runt midsommarstången, brasor och adventskalendrar hör till midsommar, valborg och advent.	On All Saints’ Day, many people go to cemeteries and light candles on relatives’ and friends’ graves to remember and honor those who have died. Dancing around a midsummer pole, bonfires, and Advent calendars belong to Midsummer, Walpurgis Night, and Advent.	На День усіх святих багато людей ідуть на кладовища та запалюють свічки на могилах родичів і друзів, щоб згадати й ушанувати померлих. Танці навколо мідсоммарського стовпа, вогнища та адвент-календарі належать до Мідсоммара, Вальпургієвої ночі та Адвенту.	pending_native_review	pending_reviewer_notes
q137	uk	13	Ch. 13 · Traditions and holidays	Traditioner och högtider	Nya traditioner	47	Vad kan hända med traditioner när människor flyttar till andra länder?	What can happen to traditions when people move to other countries?	Що може статися з традиціями, коли люди переїжджають до інших країн?	a	De kan tas med och anpassas till nya platser och människor	They can be brought along and adapted to new places and people	Їх можна взяти з собою та пристосувати до нових місць і людей	a: De kan tas med och anpassas till nya platser och människor | b: De måste alltid försvinna helt | c: De blir automatiskt svenska lagar | d: De får bara firas på Sveriges nationaldag	a: They can be brought along and adapted to new places and people | b: They must always disappear completely | c: They automatically become Swedish laws | d: They may only be celebrated on Sweden's National Day	a: Їх можна взяти з собою та пристосувати до нових місць і людей | b: Вони завжди мають повністю зникнути | c: Вони автоматично стають шведськими законами | d: Їх можна святкувати лише на Національний день Швеції	När människor flyttar till andra länder kan de ta med sig traditioner och anpassa dem till de platser och människor de möter. Id al-fitr, Nouruz och Newroz är exempel på traditioner som har kommit till Sverige med invandrare; därför är alternativen om att traditioner måste försvinna, bli lagar eller bara firas på nationaldagen fel.	When people move to other countries, they can bring traditions with them and adapt them to the places and people they meet. Eid al-Fitr, Nouruz, and Newroz are examples of traditions that have come to Sweden with immigrants, so the options saying traditions must disappear, become laws, or only be celebrated on National Day are incorrect.	Коли люди переїжджають до інших країн, вони можуть привезти традиції з собою та пристосувати їх до нових місць і людей, яких зустрічають. Ід аль-Фітр, Nouruz і Newroz — приклади традицій, що прийшли до Швеції з іммігрантами; тому варіанти про обов’язкове зникнення, перетворення на закони або святкування лише на Національний день неправильні.	pending_native_review	pending_reviewer_notes
q138	uk	13	Ch. 13 · Traditions and holidays	Traditioner och högtider	Jul	47	Vad gör många med en julgran vid jul i Sverige?	What do many people do with a Christmas tree at Christmas in Sweden?	Що багато людей роблять із ялинкою на Різдво у Швеції?	a	Tar in en julgran i hemmet och dekorerar den med ljusslingor, kulor och glitter	Bring a Christmas tree into the home and decorate it with strings of lights, baubles, and tinsel	Приносять ялинку в дім і прикрашають її гірляндами, кульками та мішурою	a: Tar in en julgran i hemmet och dekorerar den med ljusslingor, kulor och glitter | b: Planterar en julgran på kyrkogården och tänder gravljus | c: Dansar runt en julgran utomhus för att välkomna sommaren | d: Tänder en julgran som vårbrasa på valborgsmässoafton	a: Bring a Christmas tree into the home and decorate it with strings of lights, baubles, and tinsel | b: Plant a Christmas tree at the cemetery and light grave candles | c: Dance around a Christmas tree outdoors to welcome summer | d: Light a Christmas tree as a spring bonfire on Walpurgis Night	a: Приносять ялинку в дім і прикрашають її гірляндами, кульками та мішурою | b: Садять дерево на кладовищі та запалюють свічки на могилах | c: Танцюють надворі навколо дерева, щоб привітати літо | d: Підпалюють дерево як весняне вогнище на Вальпургієву ніч	Vid jul tar många in en julgran i hemmet och dekorerar den med ljusslingor, kulor och glitter. Julgranen hör till julfirandet, medan gravljus, midsommardans och valborgsbrasor hör till andra högtider.	At Christmas, many people bring a Christmas tree into the home and decorate it with strings of lights, baubles, and tinsel. The Christmas tree belongs to Christmas celebrations, while grave candles, Midsummer dancing, and Walpurgis bonfires belong to other holidays.	На Різдво багато людей приносять ялинку в дім і прикрашають її гірляндами, кульками та мішурою. Різдвяна ялинка належить до святкування Різдва, тоді як свічки на могилах, танці Мідсоммара і вальпургієві вогнища належать до інших свят.	pending_native_review	pending_reviewer_notes
q139	uk	13	Ch. 13 · Traditions and holidays	Traditioner och högtider	Jul	47	Vad firar julen traditionellt inom kristendomen?	What does Christmas traditionally celebrate in Christianity?	Що традиційно святкує Різдво у християнстві?	a	Jesu födelse	Jesus' birth	Народження Ісуса	a: Jesu födelse | b: Vårens ankomst | c: Arbetarnas dag | d: Det nya årets ankomst	a: Jesus' birth | b: The arrival of spring | c: Workers' Day | d: The arrival of the new year	a: Народження Ісуса | b: Прихід весни | c: День працівників | d: Прихід нового року	Julen är traditionellt en kristen högtid för att fira Jesu födelse. I Sverige är julen också en stor familjehögtid, medan vårens ankomst, arbetarnas dag och det nya årets ankomst hör till valborg, första maj och nyår.	Christmas is traditionally a Christian holiday celebrating Jesus' birth. In Sweden, Christmas is also a major family holiday, while the arrival of spring, Workers' Day, and the arrival of the new year belong to Walpurgis Night, May Day, and New Year.	Різдво традиційно є християнським святом народження Ісуса. У Швеції це також велике сімейне свято, тоді як прихід весни, День працівників і прихід нового року належать до Вальпургієвої ночі, Першого травня та Нового року.	pending_native_review	pending_reviewer_notes
q140	uk	13	Ch. 13 · Traditions and holidays	Traditioner och högtider	Jul	47	Hur firar många jul i Sverige även när julen inte har religiös betydelse för dem?	How do many people in Sweden celebrate Christmas even when it has no religious meaning for them?	Як багато людей у Швеції святкують Різдво, навіть коли воно не має для них релігійного значення?	a	Många firar jul som en familjehögtid även när julen inte har religiös betydelse för dem	Many people celebrate Christmas as a family holiday even when it has no religious meaning for them	Багато людей святкують Різдво як сімейне свято, навіть коли воно не має для них релігійного значення	a: Många firar jul som en familjehögtid även när julen inte har religiös betydelse för dem | b: Jul firas alltid med demonstrationer om sociala frågor | c: Jul är främst en högtid för att välkomna våren med brasor | d: Jul firas på samma sätt som nyårsafton med fyrverkerier vid midnatt	a: Many people celebrate Christmas as a family holiday even when it has no religious meaning for them | b: Christmas is always celebrated with demonstrations about social issues | c: Christmas is mainly a holiday for welcoming spring with bonfires | d: Christmas is celebrated the same way as New Year's Eve with midnight fireworks	a: Багато людей святкують Різдво як сімейне свято, навіть коли воно не має для них релігійного значення | b: Різдво завжди святкують демонстраціями про соціальні питання | c: Різдво переважно є святом зустрічі весни з вогнищами | d: Різдво святкують так само, як новорічну ніч, феєрверками опівночі	Julen har kristna rötter och är också en stor familjehögtid i Sverige. Många firar jul som en familjehögtid även när julen inte har religiös betydelse för dem, medan demonstrationer, vårbrasor och nyårsfyrverkerier hör till andra högtider.	Christmas has Christian roots and is also a major family holiday in Sweden. Many people celebrate Christmas as a family holiday even when it has no religious meaning for them, while demonstrations, spring bonfires, and New Year fireworks belong to other holidays.	Різдво має християнське коріння і також є великим сімейним святом у Швеції. Багато людей святкують Різдво як сімейне свято, навіть коли воно не має для них релігійного значення, тоді як демонстрації, весняні вогнища та новорічні феєрверки належать до інших свят.	pending_native_review	pending_reviewer_notes
q141	uk	13	Ch. 13 · Traditions and holidays	Traditioner och högtider	Lucia	47	Vad brukar man bjuda på den 13 december i samband med lucia?	What is commonly served on 13 December in connection with Lucia?	Що зазвичай подають 13 грудня у зв’язку з Люсією?	a	Särskilda lussebullar med saffran	Special saffron Lucia buns	Спеціальні шафранові булочки Люсії	a: Särskilda lussebullar med saffran | b: Sill, färskpotatis och jordgubbar | c: Ägg, lamm, lax och sill | d: Godis i påskägg	a: Special saffron Lucia buns | b: Herring, new potatoes, and strawberries | c: Eggs, lamb, salmon, and herring | d: Candy in Easter eggs	a: Спеціальні шафранові булочки Люсії | b: Оселедець, молода картопля та полуниці | c: Яйця, ягнятина, лосось та оселедець | d: Цукерки у великодніх яйцях	På luciadagen den 13 december brukar man bjuda på särskilda lussebullar med saffran. Sill, färskpotatis och jordgubbar hör till midsommar, medan ägg, lamm, lax, sill och godis i påskägg hör till påsk.	On Lucia Day, 13 December, special saffron Lucia buns are commonly served. Herring, new potatoes, and strawberries belong to Midsummer, while eggs, lamb, salmon, herring, and candy in Easter eggs belong to Easter.	У день Люсії, 13 грудня, зазвичай подають спеціальні шафранові булочки Люсії. Оселедець, молода картопля та полуниці належать до Мідсоммара, а яйця, ягнятина, лосось, оселедець і цукерки у великодніх яйцях — до Великодня.	pending_native_review	pending_reviewer_notes
q142	uk	1	Ch. 01 · The country of Sweden	Landet Sverige	Skogar, sjöar och öar	6	Hur många öar har Sverige?	How many islands does Sweden have?	Скільки островів має Швеція?	a	Cirka 250 000	About 250,000	Близько 250 000	a: Cirka 250 000 | b: Cirka 25 000 | c: Cirka 2 500 | d: Cirka 250	a: About 250,000 | b: About 25,000 | c: About 2,500 | d: About 250	a: Близько 250 000 | b: Близько 25 000 | c: Близько 2500 | d: Близько 250	Sverige har cirka 250 000 öar, fler än något annat land i världen. Därför är cirka 250 000 rätt, medan 25 000, 2 500 och 250 är för låga tal.	Sweden has about 250,000 islands, more than any other country in the world. That makes about 250,000 correct, while 25,000, 2,500, and 250 are too low.	Швеція має близько 250 000 островів, більше ніж будь-яка інша країна світу. Тому близько 250 000 — правильна відповідь, а 25 000, 2500 і 250 — занадто малі числа.	pending_native_review	pending_reviewer_notes
