id	locale	chapter_id	chapter_label	source_chapter	source_section	source_page	question_sv	question_en	question_target	correct_option_id	correct_option_sv	correct_option_en	correct_option_target	options_sv	options_en	options_target	explanation_sv	explanation_en	explanation_target	native_review_status	reviewer_notes
q098	uk	13	Ch. 13 · Traditions and holidays	Traditioner och högtider	Sveriges nationaldag	46	Vad brukar hända på Sveriges nationaldag den 6 juni?	What usually happens on Sweden’s National Day, 6 June?	Що зазвичай відбувається на Національний день Швеції 6 червня?	a	Flaggan hissas, tal hålls och många kommuner välkomnar nya medborgare	Flags are raised, speeches are held, and many municipalities welcome new citizens	Підіймають прапори, виголошують промови, і багато муніципалітетів вітають нових громадян	a: Flaggan hissas, tal hålls och många kommuner välkomnar nya medborgare | b: Arbetarrörelsen arrangerar demonstrationer | c: Det nya året firas på natten med fyrverkerier | d: Luciafirandet sprider ljus när året är som mörkast	a: Flags are raised, speeches are held, and many municipalities welcome new citizens | b: The labour movement arranges demonstrations | c: The new year is celebrated at night with fireworks | d: The Lucia celebration spreads light at the darkest time of year	a: Підіймають прапори, виголошують промови, і багато муніципалітетів вітають нових громадян | b: Робітничий рух організовує демонстрації | c: Новий рік святкують уночі феєрверками | d: Святкування Люсії поширює світло в найтемнішу пору року	Den 6 juni är Sveriges nationaldag, och dagen blev helgdag genom ett riksdagsbeslut 2005. På nationaldagen hissas flaggan, tal hålls och många kommuner ordnar ceremonier för att välkomna nya medborgare.	6 June is Sweden’s National Day, and it became a public holiday through a Riksdag decision in 2005. On National Day, flags are raised, speeches are held, and many municipalities arrange ceremonies to welcome new citizens.	6 червня — Національний день Швеції, який став державним святом за рішенням Риксдагу у 2005 році. У Національний день підіймають прапори, виголошують промови, і багато муніципалітетів організовують церемонії для привітання нових громадян.	pending_native_review	pending_reviewer_notes
q099	uk	13	Ch. 13 · Traditions and holidays	Traditioner och högtider	Midsommar	46	När firas midsommarafton i Sverige?	When is Midsummer Eve celebrated in Sweden?	Коли у Швеції святкують переддень Мідсоммара?	a	På en fredag mellan 19 och 25 juni	On a Friday between 19 and 25 June	У п’ятницю між 19 і 25 червня	a: På en fredag mellan 19 och 25 juni | b: På nyårsafton den 31 december | c: På Valborgsmässoafton den 30 april | d: På Luciadagen den 13 december	a: On a Friday between 19 and 25 June | b: On New Year’s Eve, 31 December | c: On Walpurgis Night, 30 April | d: On Lucia Day, 13 December	a: У п’ятницю між 19 і 25 червня | b: У новорічну ніч, 31 грудня | c: У Вальпургієву ніч, 30 квітня | d: На День Люсії, 13 грудня	Midsommarafton firas alltid på en fredag mellan 19 juni och 25 juni. Firandet välkomnar sommaren och ljuset och har äldre rötter från tiden före kristendomen, med utomhusfester, blomsterkransar, dans och lek runt midsommarstången samt mat som sill, färskpotatis och jordgubbar.	Midsummer Eve is always celebrated on a Friday between 19 and 25 June. The celebration welcomes summer and light and has older roots from before Christianity, with outdoor parties, flower wreaths, dancing and playing around a midsummer pole, and food such as herring, new potatoes, and strawberries.	Переддень Мідсоммара завжди святкують у п’ятницю між 19 і 25 червня. Свято вітає літо й світло та має давні корені з дохристиянських часів: вечірки надворі, квіткові вінки, танці й ігри навколо мідсоммарського стовпа, а також їжа, як-от оселедець, молода картопля та полуниця.	pending_native_review	pending_reviewer_notes
q100	uk	13	Ch. 13 · Traditions and holidays	Traditioner och högtider	Lucia	47	Vad handlar luciafirandet mycket om i Sverige?	What is the Lucia celebration largely about in Sweden?	Про що значною мірою йдеться у святкуванні Люсії у Швеції?	a	Att sprida ljus när året är som mörkast	Spreading light when the year is at its darkest	Поширення світла, коли рік є найтемнішим	a: Att sprida ljus när året är som mörkast | b: Att välkomna våren med stora brasor | c: Att fira nationaldagen med tal | d: Att ordna demonstrationer på arbetarnas dag	a: Spreading light when the year is at its darkest | b: Welcoming spring with large bonfires | c: Celebrating National Day with speeches | d: Holding May Day demonstrations	a: Поширення світла, коли рік є найтемнішим | b: Зустріч весни великими вогнищами | c: Святкування Національного дня промовами | d: Проведення демонстрацій у день працівників	Luciafirandet handlar mycket om att sprida ljus när det är som mörkast på året. Firandet hör till den 13 december och kan innehålla luciatåg där en person är Lucia, bär ljuskrona och sjunger särskilda sånger tillsammans med andra deltagare.	The Lucia celebration is largely about spreading light when the year is at its darkest. The celebration is linked to 13 December and can include Lucia processions where one person is Lucia, wears a crown of lights, and sings special songs with other participants.	Святкування Люсії значною мірою пов’язане з поширенням світла в найтемнішу пору року. Свято пов’язане з 13 грудня і може включати процесії Люсії, де одна людина є Люсією, носить корону зі світлами та співає особливі пісні з іншими учасниками.	pending_native_review	pending_reviewer_notes
q101	uk	13	Ch. 13 · Traditions and holidays	Traditioner och högtider	Påsk	45	Vilken högtid firas någon gång i mars eller april och hör ihop med långfredagen och påskdagen?	Which holiday is celebrated sometime in March or April and is connected with Good Friday and Easter Sunday?	Яке свято відзначають колись у березні або квітні, і воно пов’язане зі Страсною п’ятницею та Великодньою неділею?	a	Påsk	Easter	Великдень	a: Påsk | b: Advent | c: Första maj | d: Alla helgons dag	a: Easter | b: Advent | c: May Day | d: All Saints’ Day	a: Великдень | b: Адвент | c: Перше травня | d: День усіх святих	Påsk firas någon gång i mars eller april och hör ihop med långfredagen och påskdagen. Långfredagen uppmärksammar Jesu död och påskdagen hans uppståndelse, medan advent, första maj och Alla helgons dag hör till andra delar av året.	Easter is celebrated sometime in March or April and is connected with Good Friday and Easter Sunday. Good Friday commemorates Jesus' death, and Easter Sunday celebrates his resurrection, while Advent, May Day, and All Saints' Day belong to other parts of the year.	Великдень відзначають колись у березні або квітні, і він пов’язаний зі Страсною п’ятницею та Великодньою неділею. Страсна п’ятниця вшановує смерть Ісуса, а Великодня неділя — його воскресіння, тоді як Адвент, Перше травня та День усіх святих належать до інших частин року.	pending_native_review	pending_reviewer_notes
q102	uk	13	Ch. 13 · Traditions and holidays	Traditioner och högtider	Valborgsmässoafton	46	Vad är typiskt för valborgsmässoafton den 30 april i Sverige?	What is typical of Walpurgis Night, 30 April, in Sweden?	Що є типовим для Вальпургієвої ночі 30 квітня у Швеції?	a	Brasor, vårsånger och ibland ett tal till våren	Bonfires, spring songs, and sometimes a speech welcoming spring	Вогнища, весняні пісні й іноді промова для вітання весни	a: Brasor, vårsånger och ibland ett tal till våren | b: Fyrverkerier vid midnatt för att fira det nya året | c: Demonstrationer och tal om sociala och politiska frågor | d: Luciatåg med ljuskrona och särskilda sånger	a: Bonfires, spring songs, and sometimes a speech welcoming spring | b: Fireworks at midnight to celebrate the new year | c: Demonstrations and speeches about social and political issues | d: Lucia processions with a crown of lights and special songs	a: Вогнища, весняні пісні й іноді промова для вітання весни | b: Феєрверки опівночі для святкування нового року | c: Демонстрації та промови про соціальні й політичні питання | d: Процесії Люсії з короною зі світлами та особливими піснями	På valborgsmässoafton den 30 april välkomnar många våren med stora brasor på kvällen. Vid brasan sjungs ofta traditionella vårsånger, och ibland håller någon ett tal till våren; fyrverkerier, första maj-demonstrationer och luciatåg hör till andra högtider.	On Walpurgis Night, 30 April, many people welcome spring with large evening bonfires. Traditional spring songs are often sung by the bonfire, and sometimes someone gives a speech welcoming spring; fireworks, May Day demonstrations, and Lucia processions belong to other holidays.	У Вальпургієву ніч 30 квітня багато людей вітають весну великими вечірніми вогнищами. Біля вогнища часто співають традиційні весняні пісні, а іноді хтось виголошує промову для вітання весни; феєрверки, першотравневі демонстрації та процесії Люсії належать до інших свят.	pending_native_review	pending_reviewer_notes
q103	uk	13	Ch. 13 · Traditions and holidays	Traditioner och högtider	Första maj	46	Vad uppmärksammas på första maj i Sverige?	What is marked on May Day in Sweden?	Що відзначають першого травня у Швеції?	a	Arbetarnas dag med demonstrationer och tal	International Workers' Day with demonstrations and speeches	День працівників із демонстраціями та промовами	a: Arbetarnas dag med demonstrationer och tal | b: Det nya året med fester och fyrverkerier | c: Våren med brasor och vårsånger | d: Lucia med ljuskrona och lussebullar	a: International Workers' Day with demonstrations and speeches | b: The new year with parties and fireworks | c: Spring with bonfires and spring songs | d: Lucia with a crown of lights and saffron buns	a: День працівників із демонстраціями та промовами | b: Новий рік із вечірками та феєрверками | c: Весна з вогнищами та весняними піснями | d: Люсія з короною зі світлами та шафрановими булочками	Första maj är arbetarnas dag internationellt och är en helgdag i Sverige. Dagen uppmärksammas av arbetarrörelsen med demonstrationer runt om i landet, och personer från fackförbund, politiska partier och andra grupper håller tal om sociala och politiska frågor.	May Day is International Workers’ Day and a public holiday in Sweden. The labour movement marks the day with demonstrations around the country, and people from trade unions, political parties, and other groups give speeches about social and political issues.	Перше травня — це Міжнародний день працівників і державне свято у Швеції. Робітничий рух відзначає цей день демонстраціями по всій країні, а люди з профспілок, політичних партій та інших груп виголошують промови про соціальні й політичні питання.	pending_native_review	pending_reviewer_notes
q104	uk	13	Ch. 13 · Traditions and holidays	Traditioner och högtider	Alla helgons dag	46	Vad är vanligt att göra på Alla helgons dag i Sverige?	How is All Saints’ Day commonly observed in Sweden?	Що зазвичай роблять у День усіх святих у Швеції?	a	Tända ljus på gravar för att minnas och hedra dem som har dött	Light candles on graves to remember and honour people who have died	Запалювати свічки на могилах, щоб пам’ятати й вшанувати померлих	a: Tända ljus på gravar för att minnas och hedra dem som har dött | b: Öppna en adventskalender varje dag fram till julafton | c: Fira det nya året på natten med fyrverkerier | d: Välkomna våren med stora brasor	a: Light candles on graves to remember and honour people who have died | b: Open an Advent calendar every day until Christmas Eve | c: Celebrate the new year at night with fireworks | d: Welcome spring with large bonfires	a: Запалювати свічки на могилах, щоб пам’ятати й вшанувати померлих | b: Відкривати адвент-календар щодня до Святвечора | c: Святкувати новий рік уночі феєрверками | d: Вітати весну великими вогнищами	Alla helgons dag är en kristen helgdag då många går till kyrkogården och tänder ljus på släktingars och vänners gravar. Ljusen används för att minnas och hedra dem som har dött; adventskalender, nyårsfyrverkerier och valborgsbrasor hör till andra högtider.	All Saints’ Day is a Christian holiday when many people go to the cemetery and light candles on relatives’ and friends’ graves. The candles are used to remember and honour people who have died; Advent calendars, New Year fireworks, and Walpurgis bonfires belong to other holidays.	День усіх святих — це християнське свято, коли багато людей ідуть на цвинтар і запалюють свічки на могилах родичів і друзів. Свічки використовують, щоб пам’ятати й вшанувати померлих; адвент-календар, новорічні феєрверки та вальпургієві вогнища належать до інших свят.	pending_native_review	pending_reviewer_notes
q105	uk	13	Ch. 13 · Traditions and holidays	Traditioner och högtider	Advent	47	När infaller advent i Sverige?	When does Advent occur in Sweden?	Коли у Швеції припадає Адвент?	a	De fyra söndagarna före juldagen den 25 december	The four Sundays before Christmas Day, 25 December	Чотири неділі перед Різдвом, 25 грудня	a: De fyra söndagarna före juldagen den 25 december | b: En lördag i slutet av oktober eller början av november | c: På valborgsmässoafton den 30 april | d: På luciadagen den 13 december	a: The four Sundays before Christmas Day, 25 December | b: A Saturday at the end of October or beginning of November | c: On Walpurgis Night, 30 April | d: On Lucia Day, 13 December	a: Чотири неділі перед Різдвом, 25 грудня | b: Субота наприкінці жовтня або на початку листопада | c: У Вальпургієву ніч, 30 квітня | d: На День Люсії, 13 грудня	Advent infaller de fyra söndagarna före juldagen den 25 december och var traditionellt en förberedelseperiod inför julen. Alternativen om Alla helgons dag, valborgsmässoafton och luciadagen beskriver andra högtider.	Advent occurs on the four Sundays before Christmas Day, 25 December, and was traditionally a period of preparation for Christmas. The options about All Saints’ Day, Walpurgis Night, and Lucia Day describe other holidays.	Адвент припадає на чотири неділі перед Різдвом, 25 грудня, і традиційно був періодом підготовки до Різдва. Варіанти про День усіх святих, Вальпургієву ніч і День Люсії описують інші свята.	pending_native_review	pending_reviewer_notes
q106	uk	13	Ch. 13 · Traditions and holidays	Traditioner och högtider	Jul	47	Vad är vanligt att familjer gör på julafton den 24 december i Sverige?	What do families commonly do on Christmas Eve, 24 December, in Sweden?	Що сім’ї зазвичай роблять у Святвечір, 24 грудня, у Швеції?	a	Att samlas, äta särskild julmat och ge varandra julklappar	To gather, eat special Christmas food, and give each other Christmas presents	Збиратися разом, їсти особливу різдвяну їжу та дарувати одне одному різдвяні подарунки	a: Att samlas, äta särskild julmat och ge varandra julklappar | b: Tända stora brasor och sjunga vårsånger | c: Delta i demonstrationer om sociala och politiska frågor | d: Fira det nya året med fyrverkerier vid midnatt	a: To gather, eat special Christmas food, and give each other Christmas presents | b: Light large bonfires and sing spring songs | c: Take part in demonstrations about social and political issues | d: Celebrate the new year with fireworks at midnight	a: Збиратися разом, їсти особливу різдвяну їжу та дарувати одне одному різдвяні подарунки | b: Запалювати великі вогнища та співати весняні пісні | c: Брати участь у демонстраціях про соціальні та політичні питання | d: Святкувати новий рік феєрверками опівночі	Julen är traditionellt en kristen högtid för att fira Jesu födelse och är också en stor familjehögtid i Sverige. På julafton samlas familjer ofta för att umgås, äta särskild julmat och ge julklappar; de andra alternativen hör till valborg, första maj och nyår.	Christmas is traditionally a Christian holiday celebrating the birth of Jesus, and it is also a major family holiday in Sweden. On Christmas Eve, families often gather to spend time together, eat special Christmas food, and give presents; the other options belong to Walpurgis Night, May Day, and New Year.	Різдво традиційно є християнським святом народження Ісуса, а у Швеції також великим сімейним святом. У Святвечір сім’ї часто збираються разом, їдять особливу різдвяну їжу та дарують подарунки; інші варіанти належать до Вальпургієвої ночі, Першого травня та Нового року.	pending_native_review	pending_reviewer_notes
q107	uk	13	Ch. 13 · Traditions and holidays	Traditioner och högtider	Nya traditioner	47	Vilka högtider är exempel på traditioner som har kommit till Sverige med invandrare?	Which holidays are examples of traditions that have come to Sweden with immigrants?	Які свята є прикладами традицій, що прийшли до Швеції з іммігрантами?	a	Id al-fitr samt Nouruz och Newroz	Eid al-Fitr and Nouruz/Newroz	Ід аль-Фітр, а також Nouruz і Newroz	a: Id al-fitr samt Nouruz och Newroz | b: Midsommar och Lucia | c: Sveriges nationaldag och första maj | d: Valborgsmässoafton och alla helgons dag	a: Eid al-Fitr and Nouruz/Newroz | b: Midsummer and Lucia | c: Sweden’s National Day and May Day | d: Walpurgis Night and All Saints’ Day	a: Ід аль-Фітр, а також Nouruz і Newroz | b: Мідсоммар і Люсія | c: Національний день Швеції та Перше травня | d: Вальпургієва ніч і День усіх святих	Människor som flyttar till andra länder kan ta med sig traditioner och anpassa dem till nya platser. Exempel är Id al-fitr, som avslutar fastemånaden ramadan, och de persiska och kurdiska nyårstraditionerna Nouruz och Newroz vid vårdagjämningen.	People who move to other countries can bring traditions with them and adapt them to new places. Examples include Eid al-Fitr, which ends the fasting month of Ramadan, and the Persian and Kurdish New Year traditions Nouruz and Newroz at the spring equinox.	Люди, які переїжджають до інших країн, можуть приносити із собою традиції та пристосовувати їх до нових місць. Прикладами є Ід аль-Фітр, що завершує місяць посту Рамадан, а також перські та курдські новорічні традиції Nouruz і Newroz під час весняного рівнодення.	pending_native_review	pending_reviewer_notes
q108	uk	12	Ch. 12 · A secular state and a multi-religious country	En sekulär stat och ett mångreligiöst land	Hinduism och buddhism	43	Vad finns på olika platser i Sverige för buddhister och hinduer?	What exists in different places in Sweden for Buddhists and Hindus?	Що існує в різних місцях Швеції для буддистів та індусів?	a	Buddhistiska och hinduiska församlingar och tempel	Buddhist and Hindu congregations and temples	Буддистські та індуїстські громади й храми	a: Buddhistiska och hinduiska församlingar och tempel | b: Statliga myndigheter som väljer religion | c: Kommunala domstolar för religiösa frågor | d: Endast Svenska kyrkans församlingar	a: Buddhist and Hindu congregations and temples | b: Government agencies that choose religion | c: Municipal courts for religious questions | d: Only Church of Sweden congregations	a: Буддистські та індуїстські громади й храми | b: Державні органи, які обирають релігію | c: Муніципальні суди з релігійних питань | d: Лише парафії Церкви Швеції	Det finns både buddhistiska och hinduiska församlingar och tempel på olika platser i Sverige. Där genomförs böner, ritualer och religiösa fester; myndigheter, domstolar och Svenska kyrkan har inte den rollen.	There are both Buddhist and Hindu congregations and temples in different places in Sweden. Prayers, rituals, and religious festivals take place there; agencies, courts, and the Church of Sweden do not have that role.	У різних місцях Швеції є як буддистські, так і індуїстські громади та храми. Там проводять молитви, ритуали й релігійні свята; органи влади, суди та Церква Швеції не мають такої ролі.	pending_native_review	pending_reviewer_notes
