id	locale	chapter_id	chapter_label	source_chapter	source_section	source_page	question_sv	question_en	question_target	correct_option_id	correct_option_sv	correct_option_en	correct_option_target	options_sv	options_en	options_target	explanation_sv	explanation_en	explanation_target	native_review_status	reviewer_notes
q052	uk	7	Ch. 07 · Human rights	Mänskliga rättigheter	FN:s förklaring om de mänskliga rättigheterna	22	Vilket påstående stämmer om FN:s förklaring om de mänskliga rättigheterna?	Which statement is correct about the UN Universal Declaration of Human Rights?	Яке твердження правильне щодо Загальної декларації прав людини ООН?	a	Den presenterades 1948 och innehåller 30 artiklar	It was presented in 1948 and contains 30 articles	Її представили у 1948 році, і вона містить 30 статей	a: Den presenterades 1948 och innehåller 30 artiklar | b: Den presenterades 1918 och gäller bara Europa | c: Den säger att bara medborgare har rättigheter | d: Den handlar bara om semester från arbetet	a: It was presented in 1948 and contains 30 articles | b: It was presented in 1918 and applies only to Europe | c: It says that only citizens have rights | d: It is only about vacation from work	a: Її представили у 1948 році, і вона містить 30 статей | b: Її представили у 1918 році, і вона стосується лише Європи | c: Вона говорить, що права мають лише громадяни | d: Вона лише про відпустку з роботи	FN presenterade förklaringen om de mänskliga rättigheterna 1948, och den innehåller 30 artiklar. Förklaringen utgår från att alla människor är födda fria och lika i värde och rättigheter samt har rätt till ett liv fritt från våld.	The UN presented the Universal Declaration of Human Rights in 1948, and it contains 30 articles. The declaration is based on all people being born free and equal in value and rights and having the right to a life free from violence.	ООН представила Загальну декларацію прав людини у 1948 році, і вона містить 30 статей. Декларація виходить із того, що всі люди народжуються вільними й рівними у гідності та правах і мають право на життя без насильства.	pending_native_review	pending_reviewer_notes
q053	uk	7	Ch. 07 · Human rights	Mänskliga rättigheter	Jämställdhet mellan könen	23	Vad innebär målet med Sveriges jämställdhetspolitik?	What does the goal of Sweden’s gender equality policy mean?	Що означає мета політики гендерної рівності Швеції?	a	Att kvinnor och män ska ha samma rättigheter och skyldigheter och lika mycket makt att påverka samhället och sina egna liv	That women and men should have the same rights and duties and equal power to influence society and their own lives	Щоб жінки й чоловіки мали однакові права й обов’язки та рівну владу впливати на суспільство і власне життя	a: Att kvinnor och män ska ha samma rättigheter och skyldigheter och lika mycket makt att påverka samhället och sina egna liv | b: Att jämställdhet bara handlar om hur många kvinnor som finns i politiken | c: Att kvinnor och män ska ha olika rättigheter i arbetslivet | d: Att föräldraledighet bara ska tas av kvinnor	a: That women and men should have the same rights and duties and equal power to influence society and their own lives | b: That gender equality is only about how many women are in politics | c: That women and men should have different rights in working life | d: That parental leave should only be taken by women	a: Щоб жінки й чоловіки мали однакові права й обов’язки та рівну владу впливати на суспільство і власне життя | b: Що гендерна рівність стосується лише кількості жінок у політиці | c: Щоб жінки й чоловіки мали різні права у трудовому житті | d: Щоб батьківську відпустку брали лише жінки	Sveriges jämställdhetspolitik innebär att kvinnor och män ska ha samma rättigheter och skyldigheter och lika mycket makt att påverka samhället och sina egna liv. Exempel som lika lön, utbildning och delad föräldraledighet visar att de smalare eller motsatta alternativen är fel.	Sweden’s gender equality policy means women and men should have the same rights and duties and equal power to influence society and their own lives. Examples such as equal pay, education, and shared parental leave show that the narrower or opposite alternatives are incorrect.	Політика гендерної рівності Швеції означає, що жінки й чоловіки повинні мати однакові права й обов’язки та рівну владу впливати на суспільство і власне життя. Приклади рівної оплати, освіти й спільної батьківської відпустки показують, що вужчі або протилежні варіанти неправильні.	pending_native_review	pending_reviewer_notes
q054	uk	7	Ch. 07 · Human rights	Mänskliga rättigheter	Könsrelaterat våld och förtryck	23	Vad gäller för våld i nära relationer och hedersrelaterat våld och förtryck i Sverige?	What applies to violence in close relationships and honour-related violence and oppression in Sweden?	Що стосується насильства в близьких стосунках та насильства й утиску, пов’язаних із честю, у Швеції?	a	Det är brottsligt enligt svensk lag	They are crimes under Swedish law	Це є злочином за шведським законом	a: Det är brottsligt enligt svensk lag | b: Det är alltid en privat familjefråga och inte ett brott | c: Hedersrelaterat våld kan bara drabba vuxna kvinnor | d: Barnäktenskap är tillåtet om familjen samtycker	a: They are crimes under Swedish law | b: They are always private family matters and not crimes | c: Honour-related violence can affect only adult women | d: Child marriage is allowed if the family agrees	a: Це є злочином за шведським законом | b: Це завжди приватна сімейна справа, а не злочин | c: Насильство, пов’язане з честю, може стосуватися лише дорослих жінок | d: Дитячий шлюб дозволений, якщо сім’я погоджується	Rätt svar är att våld i nära relationer och hedersrelaterat våld och förtryck är brottsligt enligt svensk lag. Sexuellt våld, hård kontroll, tvångsäktenskap och barnäktenskap är exempel på sådant våld eller förtryck, vilket gör de andra alternativen fel.	The correct answer is that violence in close relationships and honour-related violence and oppression are crimes under Swedish law. Sexual violence, strict control, forced marriage, and child marriage are examples of this violence or oppression, which makes the other alternatives incorrect.	Правильна відповідь: насильство в близьких стосунках, а також насильство й утиск, пов’язані з честю, є злочинами за шведським законом. Сексуальне насильство, жорсткий контроль, примусовий шлюб і дитячий шлюб є прикладами такого насильства або утиску, тому інші варіанти неправильні.	pending_native_review	pending_reviewer_notes
q055	uk	7	Ch. 07 · Human rights	Mänskliga rättigheter	Sexköpslagen	24	Vad gäller för att köpa sex i Sverige?	What applies to buying sex in Sweden?	Що стосується купівлі сексу у Швеції?	a	Det är olagligt att köpa sex, men personen som säljer straffas inte	It is illegal to buy sex, but the person who sells it is not punished	Купувати секс незаконно, але особа, яка його продає, не карається	a: Det är olagligt att köpa sex, men personen som säljer straffas inte | b: Det är alltid lagligt att köpa sex | c: Både köpare och säljare straffas alltid lika | d: Lagen gäller bara företag	a: It is illegal to buy sex, but the person who sells it is not punished | b: It is always legal to buy sex | c: Buyer and seller are always punished equally | d: The law only applies to companies	a: Купувати секс незаконно, але особа, яка його продає, не карається | b: Купувати секс завжди законно | c: Покупець і продавець завжди караються однаково | d: Закон стосується лише компаній	Att köpa sex är olagligt i Sverige. Personen som köper sex kan straffas, men personen som säljer sex straffas inte; straffet riktas mot köparen för att markera att sexuellt utnyttjande mot betalning inte är acceptabelt.	Buying sex is illegal in Sweden. The person who buys sex can be punished, but the person who sells sex is not punished; punishment is directed at the buyer to show that sexual exploitation for payment is not acceptable.	Купувати секс у Швеції незаконно. Людину, яка купує секс, можуть покарати, але людина, яка продає секс, не карається; покарання спрямоване на покупця, щоб показати, що сексуальна експлуатація за оплату є неприйнятною.	pending_native_review	pending_reviewer_notes
q056	uk	7	Ch. 07 · Human rights	Mänskliga rättigheter	Barns rättigheter	24	Sedan vilket år är barnkonventionen lag i Sverige?	Since what year has the Convention on the Rights of the Child been law in Sweden?	З якого року Конвенція про права дитини є законом у Швеції?	c	2020	2020	2020	a: 1979 | b: 2000 | c: 2020 | d: 2024	a: 1979 | b: 2000 | c: 2020 | d: 2024	a: 1979 | b: 2000 | c: 2020 | d: 2024	Barnkonventionen ska skydda alla barns mänskliga rättigheter. I Sverige har barnkonventionen varit lag sedan 2020, därför är 2020 rätt år.	The Convention on the Rights of the Child protects every child’s human rights. In Sweden, the convention has been law since 2020, so 2020 is the correct year.	Конвенція про права дитини захищає права людини всіх дітей. У Швеції ця конвенція є законом з 2020 року, тому 2020 — правильний рік.	pending_native_review	pending_reviewer_notes
q057	uk	7	Ch. 07 · Human rights	Mänskliga rättigheter	Barns rättigheter	25	Vad beslutade Sverige som första land i världen 1979?	What did Sweden decide as the first country in the world in 1979?	Що Швеція вирішила як перша країна у світі у 1979 році?	a	Att det är förbjudet att slå barn	That hitting children is prohibited	Що бити дітей заборонено	a: Att det är förbjudet att slå barn | b: Att barnkonventionen blev svensk lag | c: Att förbud mot våld bara gäller i skolan | d: Att barn inte omfattas av svensk lag	a: That hitting children is prohibited | b: That the Convention on the Rights of the Child became Swedish law | c: That bans on violence apply only at school | d: That children are not covered by Swedish law	a: Що бити дітей заборонено | b: Що Конвенція про права дитини стала шведським законом | c: Що заборона насильства діє лише в школі | d: Що діти не охоплені шведським законом	Allt våld mot barn är förbjudet både enligt barnkonventionen och svensk lag. År 1979 blev Sverige först i världen med att förbjuda att slå barn; barnkonventionen blev svensk lag först 2020, och förbudet gäller inte bara i skolan.	All violence against children is prohibited under both the Convention on the Rights of the Child and Swedish law. In 1979, Sweden became the first country in the world to prohibit hitting children; the convention became Swedish law only in 2020, and the ban is not limited to schools.	Будь-яке насильство щодо дітей заборонене як Конвенцією про права дитини, так і шведським законом. У 1979 році Швеція стала першою країною у світі, яка заборонила бити дітей; конвенція стала шведським законом лише у 2020 році, а заборона не обмежується школою.	pending_native_review	pending_reviewer_notes
q058	uk	7	Ch. 07 · Human rights	Mänskliga rättigheter	Nationella minoriteter och urfolk	25	Vilka är Sveriges fem nationella minoriteter?	Which groups are Sweden's five national minorities?	Які п’ять національних меншин Швеції?	a	Judar, romer, samer, sverigefinnar och tornedalingar	Jews, Roma, Sami, Sweden Finns, and Tornedalians	Євреї, роми, саами, шведські фіни та торнедальці	a: Judar, romer, samer, sverigefinnar och tornedalingar | b: Danskar, norrmän, islänningar, tyskar och fransmän | c: Studenter, pensionärer, företagare, lärare och läkare | d: Stockholmare, göteborgare, malmöbor, uppsalabor och umeåbor	a: Jews, Roma, Sami, Sweden Finns, and Tornedalians | b: Danes, Norwegians, Icelanders, Germans, and French | c: Students, pensioners, entrepreneurs, teachers, and doctors | d: People from Stockholm, Gothenburg, Malmö, Uppsala, and Umeå	a: Євреї, роми, саами, шведські фіни та торнедальці | b: Данці, норвежці, ісландці, німці та французи | c: Студенти, пенсіонери, підприємці, вчителі та лікарі | d: Люди зі Стокгольма, Гетеборга, Мальме, Уппсали та Умео	Sverige erkände år 2000 judar, romer, samer, sverigefinnar och tornedalingar som nationella minoriteter. De nationella minoriteterna har särskilt skydd och rätt att använda sina minoritetsspråk i kontakter med myndigheter, förskola och äldreomsorg.	In 2000, Sweden recognized Jews, Roma, Sami, Sweden Finns, and Tornedalians as national minorities. National minorities have special protection and the right to use their minority languages in contacts with authorities, preschool, and elderly care.	У 2000 році Швеція визнала євреїв, ромів, саамів, шведських фінів і торнедальців національними меншинами. Національні меншини мають особливий захист і право використовувати свої мови меншин у контактах з органами влади, дошкільною освітою та доглядом за літніми людьми.	pending_native_review	pending_reviewer_notes
q059	uk	7	Ch. 07 · Human rights	Mänskliga rättigheter	Nationella minoriteter och urfolk	25	Vilken uppgift har Sametinget?	What is one task of the Sami Parliament?	Яке одне із завдань Саамського парламенту?	a	Att representera den samiska befolkningen i frågor om språk, kultur och identitet	To represent the Sami population on questions of language, culture, and identity	Представляти саамське населення у питаннях мови, культури та ідентичності	a: Att representera den samiska befolkningen i frågor om språk, kultur och identitet | b: Att besluta statens budget | c: Att döma brottmål i domstol | d: Att samordna EU:s fyra friheter	a: To represent the Sami population on questions of language, culture, and identity | b: To decide the state budget | c: To judge criminal cases in court | d: To coordinate the EU’s four freedoms	a: Представляти саамське населення у питаннях мови, культури та ідентичності | b: Вирішувати державний бюджет | c: Судити кримінальні справи в суді | d: Координувати чотири свободи ЄС	Samerna är ett erkänt urfolk i Sverige och har ett eget folkvalt parlament, Sametinget. Sametinget representerar den samiska befolkningen i frågor om språk, kultur och identitet och är ett rådgivande organ med vissa myndighetsuppgifter.	The Sami are a recognized Indigenous people in Sweden and have their own elected parliament, the Sami Parliament. The Sami Parliament represents the Sami population on questions of language, culture, and identity and is an advisory body with some public-authority tasks.	Саами є визнаним корінним народом у Швеції та мають власний виборний парламент — Саамський парламент. Він представляє саамське населення у питаннях мови, культури та ідентичності й є дорадчим органом з деякими завданнями державної установи.	pending_native_review	pending_reviewer_notes
q060	uk	7	Ch. 07 · Human rights	Mänskliga rättigheter	Hbtqi-personer	26	Vad gäller för äktenskap mellan personer av samma kön i Sverige?	What applies to marriage between people of the same sex in Sweden?	Що стосується шлюбу між людьми однієї статі у Швеції?	a	Det är tillåtet att gifta sig med en person av samma kön	It is permitted to marry a person of the same sex	Дозволено одружуватися з людиною тієї самої статі	a: Det är tillåtet att gifta sig med en person av samma kön | b: Det är förbjudet att gifta sig med en person av samma kön | c: Det är bara tillåtet att leva tillsammans, inte att gifta sig | d: Det är tillåtet bara om en myndighet ger dispens	a: It is permitted to marry a person of the same sex | b: It is prohibited to marry a person of the same sex | c: It is only permitted to live together, not to marry | d: It is permitted only if an agency grants an exemption	a: Дозволено одружуватися з людиною тієї самої статі | b: Заборонено одружуватися з людиною тієї самої статі | c: Дозволено лише жити разом, але не одружуватися | d: Дозволено лише якщо орган влади надасть виняток	Rätt svar är att det är tillåtet att gifta sig med en person av samma kön. Rätten att leva med vem man vill är skyddad i lag, och diskriminering på grund av sexuell läggning, könsidentitet och könsuttryck är förbjuden enligt diskrimineringslagen.	The correct answer is that it is permitted to marry a person of the same sex. The right to live with whomever one wants is protected by law, and discrimination based on sexual orientation, gender identity, and gender expression is prohibited under the Discrimination Act.	Правильна відповідь: дозволено одружуватися з людиною тієї самої статі. Право жити з тим, з ким людина хоче, захищене законом, а дискримінація за сексуальною орієнтацією, гендерною ідентичністю та гендерним самовираженням заборонена Законом про дискримінацію.	pending_native_review	pending_reviewer_notes
q061	uk	7	Ch. 07 · Human rights	Mänskliga rättigheter	Arbetet mot diskriminering	26	Vad är en uppgift för Diskrimineringsombudsmannen (DO)?	What is one role of the Equality Ombudsman (DO)?	Яке одне із завдань Омбудсмана з питань дискримінації (DO)?	a	Att arbeta för allas lika rättigheter och se till att diskrimineringslagen följs	To work for equal rights for everyone and make sure the Discrimination Act is followed	Працювати заради рівних прав для всіх і стежити, щоб Закон про дискримінацію виконувався	a: Att arbeta för allas lika rättigheter och se till att diskrimineringslagen följs | b: Att se till att skulder blir betalda och besluta om skuldsanering | c: Att försvara Sverige militärt | d: Att samordna regeringssamarbete mellan de nordiska länderna	a: To work for equal rights for everyone and make sure the Discrimination Act is followed | b: To make sure debts are paid and decide on debt restructuring | c: To defend Sweden militarily | d: To coordinate government cooperation between the Nordic countries	a: Працювати заради рівних прав для всіх і стежити, щоб Закон про дискримінацію виконувався | b: Стежити, щоб борги були сплачені, і вирішувати питання реструктуризації боргів | c: Захищати Швецію військовим шляхом | d: Координувати урядову співпрацю між північними країнами	Diskrimineringsombudsmannen (DO) är en statlig myndighet som arbetar för allas lika rättigheter och möjligheter. DO ska se till att diskrimineringslagen följs; skulder, militärt försvar och nordiskt regeringssamarbete hör till andra aktörer.	The Equality Ombudsman (DO) is a government agency that works for equal rights and opportunities for everyone. DO makes sure the Discrimination Act is followed; debts, military defence, and Nordic government cooperation belong to other actors.	Омбудсман з питань дискримінації (DO) — це державний орган, який працює заради рівних прав і можливостей для всіх. DO стежить, щоб Закон про дискримінацію виконувався; борги, військова оборона та урядова співпраця північних країн належать до інших суб’єктів.	pending_native_review	pending_reviewer_notes
