id	locale	chapter_id	chapter_label	source_chapter	source_section	source_page	question_sv	question_en	question_target	correct_option_id	correct_option_sv	correct_option_en	correct_option_target	options_sv	options_en	options_target	explanation_sv	explanation_en	explanation_target	native_review_status	reviewer_notes
q001	uk	1	Ch. 01 · The country of Sweden	Landet Sverige	Geografi, klimat och natur	5	Var ligger Sverige?	Where is Sweden located?	Де розташована Швеція?	a	I Norden i norra Europa	In the Nordic region in northern Europe	У Північній Європі, у скандинавському регіоні	a: I Norden i norra Europa | b: I södra Europa | c: I västra Asien | d: I Nordamerika	a: In the Nordic region in northern Europe | b: In southern Europe | c: In western Asia | d: In North America	a: У Північній Європі, у скандинавському регіоні | b: У Південній Європі | c: У Західній Азії | d: У Північній Америці	Sverige ligger i Norden i norra Europa. Norden består av Danmark, Finland, Island, Norge och Sverige och är en del av norra Europa.	Sweden is in the Nordic region in northern Europe. The Nordic region includes Denmark, Finland, Iceland, Norway, and Sweden and is part of northern Europe.	Швеція розташована в Північній Європі, у скандинавському регіоні. До нього належать Данія, Фінляндія, Ісландія, Норвегія та Швеція.	pending_native_review	pending_reviewer_notes
q002	uk	1	Ch. 01 · The country of Sweden	Landet Sverige	Geografi, klimat och natur	5	Sveriges nordligaste del ligger norr om polcirkeln.	Sweden's northernmost part lies north of the Arctic Circle.	Найпівнічніша частина Швеції розташована на північ від Полярного кола.	true	Sant	True	Правда	true: Sant | false: Falskt	true: True | false: False	true: Правда | false: Неправда	Sveriges nordligaste del ligger norr om polcirkeln, i det arktiska området. Den norra delen av landet sträcker sig alltså in i området norr om polcirkeln.	Sweden's northernmost part lies north of the Arctic Circle, in the Arctic area. The northern part of the country therefore extends into the area north of the Arctic Circle.	Найпівнічніша частина Швеції лежить на північ від Полярного кола, в арктичній зоні. Отже, північ країни простягається в територію за Полярним колом.	pending_native_review	pending_reviewer_notes
q003	uk	1	Ch. 01 · The country of Sweden	Landet Sverige	Geografi, klimat och natur	5	Ungefär hur långt sträcker sig Sverige från Treriksröset till Smygehuk?	Approximately how far does Sweden stretch from Treriksröset to Smygehuk?	Приблизно на яку відстань простягається Швеція від Treriksröset до Smygehuk?	b	Cirka 1 600 kilometer	About 1,600 kilometres	Близько 1600 кілометрів	a: Cirka 160 kilometer | b: Cirka 1 600 kilometer | c: Cirka 16 000 kilometer | d: Cirka 60 kilometer	a: About 160 kilometres | b: About 1,600 kilometres | c: About 16,000 kilometres | d: About 60 kilometres	a: Близько 160 кілометрів | b: Близько 1600 кілометрів | c: Близько 16 000 кілометрів | d: Близько 60 кілометрів	Sverige är ett avlångt land som sträcker sig cirka 1 600 kilometer från Treriksröset i norr till Smygehuk i söder. Avstånden 160 och 60 kilometer är för korta, och 16 000 kilometer är för långt.	Sweden is an elongated country that stretches about 1,600 kilometres from Treriksröset in the north to Smygehuk in the south. The distances 160 and 60 kilometres are too short, and 16,000 kilometres is too long.	Швеція — витягнута країна, що простягається приблизно на 1600 кілометрів від Treriksröset на півночі до Smygehuk на півдні. 160 і 60 кілометрів — замало, а 16 000 кілометрів — забагато.	pending_native_review	pending_reviewer_notes
q004	uk	1	Ch. 01 · The country of Sweden	Landet Sverige	Geografi, klimat och natur	5	Vad heter havet vid Sveriges östra kust?	What is the sea along Sweden's eastern coast called?	Як називається море біля східного узбережжя Швеції?	c	Östersjön	The Baltic Sea	Балтійське море	a: Nordsjön | b: Medelhavet | c: Östersjön | d: Atlanten	a: The North Sea | b: The Mediterranean Sea | c: The Baltic Sea | d: The Atlantic Ocean	a: Північне море | b: Середземне море | c: Балтійське море | d: Атлантичний океан	Havet vid Sveriges östra kust heter Östersjön. Nordsjön, Medelhavet och Atlanten är inte namnet på havet vid Sveriges östra kust.	The sea along Sweden's eastern coast is the Baltic Sea. The North Sea, the Mediterranean Sea, and the Atlantic Ocean are not the sea along Sweden's eastern coast.	Море біля східного узбережжя Швеції називається Балтійським морем. Північне море, Середземне море й Атлантичний океан не є морем біля східного узбережжя Швеції.	pending_native_review	pending_reviewer_notes
q005	uk	1	Ch. 01 · The country of Sweden	Landet Sverige	Geografi, klimat och natur	5	Vilka öar är Sveriges två största?	Which islands are Sweden's two largest?	Які острови є двома найбільшими у Швеції?	a	Gotland och Öland	Gotland and Öland	Готланд і Еланд	a: Gotland och Öland | b: Hisingen och Orust | c: Värmdö och Tjörn | d: Malmö och Göteborg	a: Gotland and Öland | b: Hisingen and Orust | c: Värmdö and Tjörn | d: Malmö and Gothenburg	a: Готланд і Еланд | b: Hisingen і Orust | c: Värmdö і Tjörn | d: Мальме і Гетеборг	Sveriges två största öar är Gotland och Öland. Hisingen, Orust, Värmdö och Tjörn är också svenska öar men är inte de två största, och Malmö och Göteborg är städer.	Sweden's two largest islands are Gotland and Öland. Hisingen, Orust, Värmdö, and Tjörn are also Swedish islands but are not the two largest, and Malmö and Gothenburg are cities.	Два найбільші острови Швеції — Gotland і Öland. Hisingen, Orust, Värmdö і Tjörn також є шведськими островами, але не двома найбільшими, а Malmö і Göteborg — це міста.	pending_native_review	pending_reviewer_notes
q006	uk	1	Ch. 01 · The country of Sweden	Landet Sverige	Geografi, klimat och natur	5	Golfströmmen och den Nordatlantiska strömmen bidrar till Sveriges milda klimat.	The Gulf Stream and the North Atlantic Current help make Sweden's climate mild.	Гольфстрім і Північно-Атлантична течія сприяють м’якому клімату Швеції.	true	Sant	True	Правда	true: Sant | false: Falskt	true: True | false: False	true: Правда | false: Неправда	Sverige har ett milt klimat jämfört med många andra områden på samma breddgrad. Golfströmmen och den Nordatlantiska strömmen transporterar varmt vatten mot Europa, vilket värmer luften som vindarna för in över Sverige.	Sweden has a mild climate compared with many other areas at the same latitude. The Gulf Stream and the North Atlantic Current carry warm water toward Europe, warming the air that winds bring over Sweden.	Швеція має м’який клімат порівняно з багатьма іншими територіями на тій самій широті. Гольфстрім і Північно-Атлантична течія несуть теплу воду до Європи, зігріваючи повітря, яке вітри приносять до Швеції.	pending_native_review	pending_reviewer_notes
q007	uk	1	Ch. 01 · The country of Sweden	Landet Sverige	Fjäll	6	Vad heter Sveriges högsta berg?	What is the name of Sweden's highest mountain?	Як називається найвища гора Швеції?	a	Kebnekaise	Kebnekaise	Kebnekaise	a: Kebnekaise | b: Smygehuk | c: Treriksröset | d: Mälaren	a: Kebnekaise | b: Smygehuk | c: Treriksröset | d: Mälaren	a: Kebnekaise | b: Smygehuk | c: Treriksröset | d: Mälaren	Sveriges högsta berg heter Kebnekaise och är cirka 2 000 meter högt. Det ligger i fjällen, den del av bergskedjan Skanderna som går längs gränsen mot Norge.	Sweden's highest mountain is Kebnekaise, at about 2,000 metres. It is in the mountain region called fjällen, part of the Scandinavian Mountains along the border with Norway.	Найвища гора Швеції — Kebnekaise, її висота близько 2000 метрів. Вона розташована в гірському регіоні fjällen, частині Скандинавських гір уздовж кордону з Норвегією. (Treriksröset; Smygehuk)	pending_native_review	pending_reviewer_notes
q008	uk	1	Ch. 01 · The country of Sweden	Landet Sverige	Skogar, sjöar och öar	6	Vilka är Sveriges tre största sjöar?	What are Sweden's three largest lakes?	Які три озера є найбільшими у Швеції?	a	Vänern, Vättern och Mälaren	Vänern, Vättern, and Mälaren	Vänern, Vättern і Mälaren	a: Vänern, Vättern och Mälaren | b: Östersjön, Kattegatt och Skagerrak | c: Gotland, Öland och Orust | d: Stockholm, Göteborg och Malmö	a: Vänern, Vättern, and Mälaren | b: The Baltic Sea, Kattegat, and Skagerrak | c: Gotland, Öland, and Orust | d: Stockholm, Gothenburg, and Malmö	a: Vänern, Vättern і Mälaren | b: Балтійське море, Kattegat і Skagerrak | c: Gotland, Öland і Orust | d: Стокгольм, Гетеборг і Мальме	Sverige har många sjöar spridda över hela landet, och de tre största är Vänern, Vättern och Mälaren. De andra alternativen räknar upp havsområden, öar eller städer i stället för sjöar.	Sweden has many lakes throughout the country, and the three largest are Vänern, Vättern, and Mälaren. The other choices list sea areas, islands, or cities instead of lakes.	У Швеції багато озер по всій країні, а три найбільші — Vänern, Vättern і Mälaren. Інші варіанти перелічують морські райони, острови або міста, а не озера.	pending_native_review	pending_reviewer_notes
q009	uk	1	Ch. 01 · The country of Sweden	Landet Sverige	Befolkning	7	Ungefär hur många människor bor i Sverige?	Approximately how many people live in Sweden?	Приблизно скільки людей живе у Швеції?	a	Nästan 11 miljoner	Almost 11 million	Майже 11 мільйонів	a: Nästan 11 miljoner | b: Nästan 1 miljon | c: Cirka 50 miljoner | d: Cirka 100 miljoner	a: Almost 11 million | b: Almost 1 million | c: About 50 million | d: About 100 million	a: Майже 11 мільйонів | b: Майже 1 мільйон | c: Близько 50 мільйонів | d: Близько 100 мільйонів	Det bor nästan 11 miljoner människor i Sverige. Befolkningen är inte jämnt fördelad: de flesta bor i den södra delen av landet och längs kusterna.	Almost 11 million people live in Sweden. The population is not evenly distributed: most people live in the southern part of the country and along the coasts.	У Швеції живе майже 11 мільйонів людей. Населення розподілене нерівномірно: більшість живе в південній частині країни та вздовж узбереж.	pending_native_review	pending_reviewer_notes
q010	uk	1	Ch. 01 · The country of Sweden	Landet Sverige	Naturresurser	7	Vilka naturresurser är viktiga i Sverige?	Which natural resources are important in Sweden?	Які природні ресурси важливі у Швеції?	a	Järnmalm och andra mineraler, skog, jordbruksmark och vatten	Iron ore and other minerals, forest, agricultural land, and water	Залізна руда та інші мінерали, ліси, сільськогосподарські землі й вода	a: Järnmalm och andra mineraler, skog, jordbruksmark och vatten | b: Olja, naturgas, ökenmark och tropiskt regn | c: Kol, diamantgruvor, vulkanjord och palmer | d: Risfält, bomullsplantager, korallrev och tidvatten	a: Iron ore and other minerals, forest, agricultural land, and water | b: Oil, natural gas, desert land, and tropical rain | c: Coal, diamond mines, volcanic soil, and palm trees | d: Rice fields, cotton plantations, coral reefs, and tides	a: Залізна руда та інші мінерали, ліси, сільськогосподарські землі й вода | b: Нафта, природний газ, пустельні землі й тропічні дощі | c: Вугілля, алмазні шахти, вулканічний ґрунт і пальми | d: Рисові поля, бавовняні плантації, коралові рифи й припливи	Sverige är rikt på flera viktiga naturresurser: järnmalm och andra mineraler, skog, jordbruksmark och vatten. Olja, naturgas, ökenmark, tropiskt regn och liknande beskriver inte Sveriges viktiga naturresurser.	Sweden is rich in several important natural resources: iron ore and other minerals, forests, agricultural land, and water. Oil, natural gas, desert land, tropical rain, and similar items do not describe Sweden's important natural resources.	Швеція багата на кілька важливих природних ресурсів: залізну руду та інші мінерали, ліси, сільськогосподарські землі й воду. Нафта, природний газ, пустельні землі, тропічні дощі та подібні речі не описують важливі природні ресурси Швеції.	pending_native_review	pending_reviewer_notes
q011	uk	2	Ch. 02 · Sweden's democratic system	Sveriges demokratiska system	Demokrati betyder folkstyre	10	Vad betyder demokrati?	What does democracy mean?	Що означає демократія?	a	Folkstyre	Rule by the people	Народовладдя	a: Folkstyre | b: Militärstyre | c: Envälde | d: Företagsstyre	a: Rule by the people | b: Military rule | c: Autocracy | d: Rule by companies	a: Народовладдя | b: Військове правління | c: Самодержавство | d: Правління компаній	Demokrati betyder folkstyre: makten utgår från folket och medborgarna kan påverka beslut. Människor ska kunna välja mellan flera politiska alternativ, och de som får makten ska kunna bytas ut. Militärstyre, envälde och företagsstyre lägger makten någon annanstans.	Democracy means rule by the people: power comes from the people, and citizens can influence decisions. People should be able to choose between several political alternatives, and those who gain power can be replaced. Military rule, autocracy, and rule by companies place power somewhere else.	Демократія означає народовладдя: влада походить від народу, а громадяни можуть впливати на рішення. Люди мають мати змогу обирати між кількома політичними варіантами, а тих, хто отримує владу, має бути можливо замінити.	pending_native_review	pending_reviewer_notes
q012	uk	2	Ch. 02 · Sweden's democratic system	Sveriges demokratiska system	Demokrati betyder folkstyre	10	Vilket av följande ingår i fria val i en demokrati?	Which of the following is part of free elections in a democracy?	Що з наведеного є частиною вільних виборів у демократії?	a	Alla som har rätt att rösta har en röst var	Everyone who is eligible to vote has one vote	Кожен, хто має право голосу, має по одному голосу	a: Alla som har rätt att rösta har en röst var | b: Bara ett parti får ställa upp | c: Väljare måste visa offentligt hur de röstar | d: Regeringen bestämmer hur alla röster ska användas	a: Everyone who is eligible to vote has one vote | b: Only one party may stand for election | c: Voters must publicly show how they vote | d: The government decides how all votes must be used	a: Кожен, хто має право голосу, має по одному голосу | b: Лише одна партія може брати участь у виборах | c: Виборці мають публічно показувати, як голосують | d: Уряд вирішує, як використовувати всі голоси	Fria val innebär att alla som har rätt att rösta har en röst var. Väljare ska kunna uttrycka sina åsikter utan hot eller tvång, det ska finnas flera partier och valet ska vara hemligt.	Free elections mean that everyone who is eligible to vote has one vote. Voters should be able to express their views without threats or coercion, there should be several parties, and the vote should be secret.	Вільні вибори означають, що кожен, хто має право голосу, має по одному голосу. Виборці повинні мати змогу висловлювати свої погляди без погроз чи примусу, має бути кілька партій, а голосування має бути таємним.	pending_native_review	pending_reviewer_notes
q013	uk	2	Ch. 02 · Sweden's democratic system	Sveriges demokratiska system	En stark demokrati	10	Hur kan människor påverka samhället och delta i demokratin?	How can people influence society and participate in democracy?	Який спосіб дає змогу впливати на суспільство й брати в ньому участь?	a	Kontakta politiker, demonstrera eller skriva på en namninsamling	Contact politicians, join a demonstration, or sign a petition	Звернутися до політиків, демонструвати або підписати петицію	a: Kontakta politiker, demonstrera eller skriva på en namninsamling | b: Förbjuda andra från att rösta i politiska val | c: Tvinga journalister att skriva vissa åsikter | d: Stoppa människor från att prata om politik	a: Contact politicians, join a demonstration, or sign a petition | b: Ban others from voting in political elections | c: Force journalists to write certain opinions | d: Stop people from talking about politics	a: Звернутися до політиків, демонструвати або підписати петицію | b: Забороняти іншим голосувати на політичних виборах | c: Змушувати журналістів писати певні думки | d: Зупиняти людей від розмов про політику	Det finns flera demokratiska sätt att påverka och delta i samhället, till exempel att kontakta politiker, demonstrera och starta eller skriva på en namninsamling. De andra alternativen skulle hindra människor från att rösta, uttrycka åsikter eller delta i demokratin.	People can influence and participate in society in several democratic ways, including contacting politicians, joining a demonstration, and starting or signing a petition. The other options would stop people from voting, expressing opinions, or taking part in democracy.	Є кілька демократичних способів впливати на суспільство й брати в ньому участь, наприклад звертатися до політиків, демонструвати, починати або підписувати петицію. Інші варіанти заважали б людям голосувати, висловлювати думки або брати участь у демократії.	pending_native_review	pending_reviewer_notes
q014	uk	2	Ch. 02 · Sweden's democratic system	Sveriges demokratiska system	Demokrati betyder folkstyre	10	Vad kallas det när lagarna gäller lika för alla och ingen får dömas utan en rättvis rättegång?	What is it called when laws apply equally to everyone and no one can be convicted without a fair trial?	Як називається ситуація, коли закони однаково діють для всіх і нікого не можна засудити без справедливого суду?	a	Rättssäkerhet	The rule of law	Правова визначеність	a: Rättssäkerhet | b: Censur | c: Segregation | d: Monarki	a: The rule of law | b: Censorship | c: Segregation | d: Monarchy	a: Правова визначеність | b: Цензура | c: Сегрегація | d: Монархія	Rättssäkerhet betyder att lagarna gäller för alla och att ingen får dömas utan en rättvis rättegång. Censur, segregation och monarki betyder andra saker.	The rule of law means that laws apply to everyone and that no one can be convicted without a fair trial. Censorship, segregation, and monarchy mean other things.	Правова визначеність означає, що закони діють для всіх і нікого не можна засудити без справедливого суду. Цензура, сегрегація і монархія означають інше.	pending_native_review	pending_reviewer_notes
q015	uk	2	Ch. 02 · Sweden's democratic system	Sveriges demokratiska system	Hot mot demokratin	11	Hur kan ett lågt valdeltagande påverka demokratin?	How can a low voter turnout affect democracy?	Як низька явка виборців може вплинути на демократію?	a	Människor kan få mindre möjlighet att påverka politiska beslut	People may have fewer opportunities to influence political decisions	Люди можуть мати менше можливостей впливати на політичні рішення	a: Människor kan få mindre möjlighet att påverka politiska beslut | b: Alla väljare får två röster var i nästa val | c: Domstolarna tar över riksdagens uppgifter | d: Samhället blir automatiskt mer integrerat	a: People may have fewer opportunities to influence political decisions | b: All voters get two votes each in the next election | c: The courts take over the Riksdag's tasks | d: Society automatically becomes more integrated	a: Люди можуть мати менше можливостей впливати на політичні рішення | b: Усі виборці отримують по два голоси на наступних виборах | c: Суди перебирають завдання Риксдагу | d: Суспільство автоматично стає більш інтегрованим	Ett lågt valdeltagande kan göra det svårare för människor att påverka politiska beslut i sin vardag. Det kan också öka skillnaderna mellan grupper i samhället; de andra alternativen beskriver följder som inte följer av lågt valdeltagande.	Low voter turnout can leave people with fewer opportunities to influence political decisions in everyday life. It can also widen differences between groups in society; the other options describe effects that do not follow from low voter turnout.	Низька явка може ускладнити людям вплив на політичні рішення у повсякденному житті. Вона також може збільшувати відмінності між групами в суспільстві. Інші варіанти не є наслідками низької явки.	pending_native_review	pending_reviewer_notes
