id	locale	chapter_id	chapter_label	source_chapter	source_section	source_page	question_sv	question_en	question_target	correct_option_id	correct_option_sv	correct_option_en	correct_option_target	options_sv	options_en	options_target	explanation_sv	explanation_en	explanation_target	native_review_status	reviewer_notes
q001	zh-Hant	1	Ch. 01 · The country of Sweden	Landet Sverige	Geografi, klimat och natur	5	Var ligger Sverige?	Where is Sweden located?	瑞典位於哪裡？	a	I Norden i norra Europa	In the Nordic region in northern Europe	位於北歐的北歐地區	a: I Norden i norra Europa | b: I södra Europa | c: I västra Asien | d: I Nordamerika	a: In the Nordic region in northern Europe | b: In southern Europe | c: In western Asia | d: In North America	a: 位於北歐的北歐地區 | b: 位於南歐 | c: 位於西亞 | d: 位於北美洲	Sverige ligger i Norden i norra Europa. Norden består av Danmark, Finland, Island, Norge och Sverige och är en del av norra Europa.	Sweden is in the Nordic region in northern Europe. The Nordic region includes Denmark, Finland, Iceland, Norway, and Sweden and is part of northern Europe.	瑞典位於北歐的北歐地區。北歐包括丹麥、芬蘭、冰島、挪威和瑞典，是北歐的一部分。	pending_native_review	pending_reviewer_notes
q002	zh-Hant	1	Ch. 01 · The country of Sweden	Landet Sverige	Geografi, klimat och natur	5	Sveriges nordligaste del ligger norr om polcirkeln.	Sweden's northernmost part lies north of the Arctic Circle.	瑞典最北端位於北極圈以北。	true	Sant	True	正確	true: Sant | false: Falskt	true: True | false: False	true: 正確 | false: 錯誤	Sveriges nordligaste del ligger norr om polcirkeln, i det arktiska området. Den norra delen av landet sträcker sig alltså in i området norr om polcirkeln.	Sweden's northernmost part lies north of the Arctic Circle, in the Arctic area. The northern part of the country therefore extends into the area north of the Arctic Circle.	瑞典最北端在北極圈以北，屬於北極地區。也就是說，瑞典北部延伸到北極圈以北的區域。	pending_native_review	pending_reviewer_notes
q003	zh-Hant	1	Ch. 01 · The country of Sweden	Landet Sverige	Geografi, klimat och natur	5	Ungefär hur långt sträcker sig Sverige från Treriksröset till Smygehuk?	Approximately how far does Sweden stretch from Treriksröset to Smygehuk?	從 Treriksröset 到 Smygehuk，瑞典南北大約有多長？	b	Cirka 1 600 kilometer	About 1,600 kilometres	約 1,600 公里	a: Cirka 160 kilometer | b: Cirka 1 600 kilometer | c: Cirka 16 000 kilometer | d: Cirka 60 kilometer	a: About 160 kilometres | b: About 1,600 kilometres | c: About 16,000 kilometres | d: About 60 kilometres	a: 約 160 公里 | b: 約 1,600 公里 | c: 約 16,000 公里 | d: 約 60 公里	Sverige är ett avlångt land som sträcker sig cirka 1 600 kilometer från Treriksröset i norr till Smygehuk i söder. Avstånden 160 och 60 kilometer är för korta, och 16 000 kilometer är för långt.	Sweden is an elongated country that stretches about 1,600 kilometres from Treriksröset in the north to Smygehuk in the south. The distances 160 and 60 kilometres are too short, and 16,000 kilometres is too long.	瑞典是狹長的國家，從北部的 Treriksröset 到南部的 Smygehuk 約 1,600 公里。160 和 60 公里太短，16,000 公里則太長。	pending_native_review	pending_reviewer_notes
q004	zh-Hant	1	Ch. 01 · The country of Sweden	Landet Sverige	Geografi, klimat och natur	5	Vad heter havet vid Sveriges östra kust?	What is the sea along Sweden's eastern coast called?	瑞典東海岸沿岸的海叫什麼？	c	Östersjön	The Baltic Sea	波羅的海	a: Nordsjön | b: Medelhavet | c: Östersjön | d: Atlanten	a: The North Sea | b: The Mediterranean Sea | c: The Baltic Sea | d: The Atlantic Ocean	a: 北海 | b: 地中海 | c: 波羅的海 | d: 大西洋	Havet vid Sveriges östra kust heter Östersjön. Nordsjön, Medelhavet och Atlanten är inte namnet på havet vid Sveriges östra kust.	The sea along Sweden's eastern coast is the Baltic Sea. The North Sea, the Mediterranean Sea, and the Atlantic Ocean are not the sea along Sweden's eastern coast.	瑞典東海岸沿岸的海是波羅的海。北海、地中海和大西洋都不是瑞典東海岸沿岸的海名。	pending_native_review	pending_reviewer_notes
q005	zh-Hant	1	Ch. 01 · The country of Sweden	Landet Sverige	Geografi, klimat och natur	5	Vilka öar är Sveriges två största?	Which islands are Sweden's two largest?	瑞典最大的兩座島是哪兩座？	a	Gotland och Öland	Gotland and Öland	Gotland 和 Öland	a: Gotland och Öland | b: Hisingen och Orust | c: Värmdö och Tjörn | d: Malmö och Göteborg	a: Gotland and Öland | b: Hisingen and Orust | c: Värmdö and Tjörn | d: Malmö and Gothenburg	a: Gotland 和 Öland | b: Hisingen 和 Orust | c: Värmdö 和 Tjörn | d: Malmö 和 Göteborg	Sveriges två största öar är Gotland och Öland. Hisingen, Orust, Värmdö och Tjörn är också svenska öar men är inte de två största, och Malmö och Göteborg är städer.	Sweden's two largest islands are Gotland and Öland. Hisingen, Orust, Värmdö, and Tjörn are also Swedish islands but are not the two largest, and Malmö and Gothenburg are cities.	瑞典最大的兩座島是 Gotland 和 Öland。Hisingen、Orust、Värmdö 和 Tjörn 也是瑞典島嶼，但不是最大的兩座；Malmö 和 Göteborg 是城市。	pending_native_review	pending_reviewer_notes
q006	zh-Hant	1	Ch. 01 · The country of Sweden	Landet Sverige	Geografi, klimat och natur	5	Golfströmmen och den Nordatlantiska strömmen bidrar till Sveriges milda klimat.	The Gulf Stream and the North Atlantic Current help make Sweden's climate mild.	墨西哥灣流和北大西洋洋流有助於讓瑞典氣候溫和。	true	Sant	True	正確	true: Sant | false: Falskt	true: True | false: False	true: 正確 | false: 錯誤	Sverige har ett milt klimat jämfört med många andra områden på samma breddgrad. Golfströmmen och den Nordatlantiska strömmen transporterar varmt vatten mot Europa, vilket värmer luften som vindarna för in över Sverige.	Sweden has a mild climate compared with many other areas at the same latitude. The Gulf Stream and the North Atlantic Current carry warm water toward Europe, warming the air that winds bring over Sweden.	與許多同緯度地區相比，瑞典氣候較溫和。墨西哥灣流和北大西洋洋流把暖水帶向歐洲，讓吹向瑞典的空氣變暖。	pending_native_review	pending_reviewer_notes
q007	zh-Hant	1	Ch. 01 · The country of Sweden	Landet Sverige	Fjäll	6	Vad heter Sveriges högsta berg?	What is the name of Sweden's highest mountain?	瑞典最高的山叫什麼？	a	Kebnekaise	Kebnekaise	Kebnekaise	a: Kebnekaise | b: Smygehuk | c: Treriksröset | d: Mälaren	a: Kebnekaise | b: Smygehuk | c: Treriksröset | d: Mälaren	a: Kebnekaise | b: Smygehuk | c: Treriksröset | d: Mälaren	Sveriges högsta berg heter Kebnekaise och är cirka 2 000 meter högt. Det ligger i fjällen, den del av bergskedjan Skanderna som går längs gränsen mot Norge.	Sweden's highest mountain is Kebnekaise, at about 2,000 metres. It is in the mountain region called fjällen, part of the Scandinavian Mountains along the border with Norway.	瑞典最高的山是 Kebnekaise，高約 2,000 公尺。它位於山區 fjällen，也就是沿挪威邊界延伸的斯堪地那維亞山脈的一部分。 (Treriksröset; Smygehuk)	pending_native_review	pending_reviewer_notes
q008	zh-Hant	1	Ch. 01 · The country of Sweden	Landet Sverige	Skogar, sjöar och öar	6	Vilka är Sveriges tre största sjöar?	What are Sweden's three largest lakes?	瑞典最大的三座湖是哪三座？	a	Vänern, Vättern och Mälaren	Vänern, Vättern, and Mälaren	Vänern、Vättern 和 Mälaren	a: Vänern, Vättern och Mälaren | b: Östersjön, Kattegatt och Skagerrak | c: Gotland, Öland och Orust | d: Stockholm, Göteborg och Malmö	a: Vänern, Vättern, and Mälaren | b: The Baltic Sea, Kattegat, and Skagerrak | c: Gotland, Öland, and Orust | d: Stockholm, Gothenburg, and Malmö	a: Vänern、Vättern 和 Mälaren | b: 波羅的海、Kattegat 和 Skagerrak | c: Gotland、Öland 和 Orust | d: Stockholm、Göteborg 和 Malmö	Sverige har många sjöar spridda över hela landet, och de tre största är Vänern, Vättern och Mälaren. De andra alternativen räknar upp havsområden, öar eller städer i stället för sjöar.	Sweden has many lakes throughout the country, and the three largest are Vänern, Vättern, and Mälaren. The other choices list sea areas, islands, or cities instead of lakes.	瑞典全國有許多湖泊，最大的三座是 Vänern、Vättern 和 Mälaren。其他選項列出的是海域、島嶼或城市，而不是湖泊。	pending_native_review	pending_reviewer_notes
q009	zh-Hant	1	Ch. 01 · The country of Sweden	Landet Sverige	Befolkning	7	Ungefär hur många människor bor i Sverige?	Approximately how many people live in Sweden?	瑞典大約有多少人口？	a	Nästan 11 miljoner	Almost 11 million	將近 1,100 萬	a: Nästan 11 miljoner | b: Nästan 1 miljon | c: Cirka 50 miljoner | d: Cirka 100 miljoner	a: Almost 11 million | b: Almost 1 million | c: About 50 million | d: About 100 million	a: 將近 1,100 萬 | b: 將近 100 萬 | c: 約 5,000 萬 | d: 約 1 億	Det bor nästan 11 miljoner människor i Sverige. Befolkningen är inte jämnt fördelad: de flesta bor i den södra delen av landet och längs kusterna.	Almost 11 million people live in Sweden. The population is not evenly distributed: most people live in the southern part of the country and along the coasts.	瑞典有將近 1,100 萬人口。人口分布並不平均：多數人住在南部和沿海地區。	pending_native_review	pending_reviewer_notes
q010	zh-Hant	1	Ch. 01 · The country of Sweden	Landet Sverige	Naturresurser	7	Vilka naturresurser är viktiga i Sverige?	Which natural resources are important in Sweden?	哪些自然資源對瑞典很重要？	a	Järnmalm och andra mineraler, skog, jordbruksmark och vatten	Iron ore and other minerals, forest, agricultural land, and water	鐵礦和其他礦物、森林、農地和水	a: Järnmalm och andra mineraler, skog, jordbruksmark och vatten | b: Olja, naturgas, ökenmark och tropiskt regn | c: Kol, diamantgruvor, vulkanjord och palmer | d: Risfält, bomullsplantager, korallrev och tidvatten	a: Iron ore and other minerals, forest, agricultural land, and water | b: Oil, natural gas, desert land, and tropical rain | c: Coal, diamond mines, volcanic soil, and palm trees | d: Rice fields, cotton plantations, coral reefs, and tides	a: 鐵礦和其他礦物、森林、農地和水 | b: 石油、天然氣、沙漠土地和熱帶雨水 | c: 煤、鑽石礦、火山土和棕櫚樹 | d: 稻田、棉花種植園、珊瑚礁和潮汐	Sverige är rikt på flera viktiga naturresurser: järnmalm och andra mineraler, skog, jordbruksmark och vatten. Olja, naturgas, ökenmark, tropiskt regn och liknande beskriver inte Sveriges viktiga naturresurser.	Sweden is rich in several important natural resources: iron ore and other minerals, forests, agricultural land, and water. Oil, natural gas, desert land, tropical rain, and similar items do not describe Sweden's important natural resources.	瑞典擁有多種重要自然資源：鐵礦和其他礦物、森林、農地和水。石油、天然氣、沙漠土地、熱帶雨水等並不能描述瑞典的重要自然資源。	pending_native_review	pending_reviewer_notes
q011	zh-Hant	2	Ch. 02 · Sweden's democratic system	Sveriges demokratiska system	Demokrati betyder folkstyre	10	Vad betyder demokrati?	What does democracy mean?	民主是什麼意思？	a	Folkstyre	Rule by the people	人民治理	a: Folkstyre | b: Militärstyre | c: Envälde | d: Företagsstyre	a: Rule by the people | b: Military rule | c: Autocracy | d: Rule by companies	a: 人民治理 | b: 軍事統治 | c: 專制統治 | d: 公司治理	Demokrati betyder folkstyre: makten utgår från folket och medborgarna kan påverka beslut. Människor ska kunna välja mellan flera politiska alternativ, och de som får makten ska kunna bytas ut. Militärstyre, envälde och företagsstyre lägger makten någon annanstans.	Democracy means rule by the people: power comes from the people, and citizens can influence decisions. People should be able to choose between several political alternatives, and those who gain power can be replaced. Military rule, autocracy, and rule by companies place power somewhere else.	民主是人民治理：權力來自人民，公民可以影響決定。人們應能在多個政治選項之間選擇，掌權者也應能被更換。	pending_native_review	pending_reviewer_notes
q012	zh-Hant	2	Ch. 02 · Sweden's democratic system	Sveriges demokratiska system	Demokrati betyder folkstyre	10	Vilket av följande ingår i fria val i en demokrati?	Which of the following is part of free elections in a democracy?	以下哪一項屬於民主中的自由選舉？	a	Alla som har rätt att rösta har en röst var	Everyone who is eligible to vote has one vote	每個有投票權的人各有一票	a: Alla som har rätt att rösta har en röst var | b: Bara ett parti får ställa upp | c: Väljare måste visa offentligt hur de röstar | d: Regeringen bestämmer hur alla röster ska användas	a: Everyone who is eligible to vote has one vote | b: Only one party may stand for election | c: Voters must publicly show how they vote | d: The government decides how all votes must be used	a: 每個有投票權的人各有一票 | b: 只有一個政黨可以參選 | c: 選民必須公開展示如何投票 | d: 政府決定所有選票如何使用	Fria val innebär att alla som har rätt att rösta har en röst var. Väljare ska kunna uttrycka sina åsikter utan hot eller tvång, det ska finnas flera partier och valet ska vara hemligt.	Free elections mean that everyone who is eligible to vote has one vote. Voters should be able to express their views without threats or coercion, there should be several parties, and the vote should be secret.	自由選舉表示每個有投票權的人各有一票。選民應能在沒有威脅或強迫的情況下表達意見，應有多個政黨，而且投票應是秘密的。	pending_native_review	pending_reviewer_notes
q013	zh-Hant	2	Ch. 02 · Sweden's democratic system	Sveriges demokratiska system	En stark demokrati	10	Hur kan människor påverka samhället och delta i demokratin?	How can people influence society and participate in democracy?	哪一種方式可以影響並參與社會？	a	Kontakta politiker, demonstrera eller skriva på en namninsamling	Contact politicians, join a demonstration, or sign a petition	聯絡政治人物、示威或簽署請願書	a: Kontakta politiker, demonstrera eller skriva på en namninsamling | b: Förbjuda andra från att rösta i politiska val | c: Tvinga journalister att skriva vissa åsikter | d: Stoppa människor från att prata om politik	a: Contact politicians, join a demonstration, or sign a petition | b: Ban others from voting in political elections | c: Force journalists to write certain opinions | d: Stop people from talking about politics	a: 聯絡政治人物、示威或簽署請願書 | b: 禁止他人在政治選舉中投票 | c: 強迫記者寫某些意見 | d: 阻止人們談論政治	Det finns flera demokratiska sätt att påverka och delta i samhället, till exempel att kontakta politiker, demonstrera och starta eller skriva på en namninsamling. De andra alternativen skulle hindra människor från att rösta, uttrycka åsikter eller delta i demokratin.	People can influence and participate in society in several democratic ways, including contacting politicians, joining a demonstration, and starting or signing a petition. The other options would stop people from voting, expressing opinions, or taking part in democracy.	影響並參與社會有多種民主方式，例如聯絡政治人物、示威，以及發起或簽署請願書。其他選項會阻礙人們投票、表達意見或參與民主。	pending_native_review	pending_reviewer_notes
q014	zh-Hant	2	Ch. 02 · Sweden's democratic system	Sveriges demokratiska system	Demokrati betyder folkstyre	10	Vad kallas det när lagarna gäller lika för alla och ingen får dömas utan en rättvis rättegång?	What is it called when laws apply equally to everyone and no one can be convicted without a fair trial?	法律平等適用於所有人，而且任何人未經公平審判不得被定罪，這叫什麼？	a	Rättssäkerhet	The rule of law	法律確定性	a: Rättssäkerhet | b: Censur | c: Segregation | d: Monarki	a: The rule of law | b: Censorship | c: Segregation | d: Monarchy	a: 法律確定性 | b: 審查制度 | c: 隔離 | d: 君主制	Rättssäkerhet betyder att lagarna gäller för alla och att ingen får dömas utan en rättvis rättegång. Censur, segregation och monarki betyder andra saker.	The rule of law means that laws apply to everyone and that no one can be convicted without a fair trial. Censorship, segregation, and monarchy mean other things.	法律確定性表示法律適用於所有人，任何人不得在沒有公平審判的情況下被定罪。審查制度、隔離和君主制是其他概念。	pending_native_review	pending_reviewer_notes
q015	zh-Hant	2	Ch. 02 · Sweden's democratic system	Sveriges demokratiska system	Hot mot demokratin	11	Hur kan ett lågt valdeltagande påverka demokratin?	How can a low voter turnout affect democracy?	低投票率會如何影響民主？	a	Människor kan få mindre möjlighet att påverka politiska beslut	People may have fewer opportunities to influence political decisions	人們影響政治決定的機會可能變少	a: Människor kan få mindre möjlighet att påverka politiska beslut | b: Alla väljare får två röster var i nästa val | c: Domstolarna tar över riksdagens uppgifter | d: Samhället blir automatiskt mer integrerat	a: People may have fewer opportunities to influence political decisions | b: All voters get two votes each in the next election | c: The courts take over the Riksdag's tasks | d: Society automatically becomes more integrated	a: 人們影響政治決定的機會可能變少 | b: 所有選民在下次選舉各有兩票 | c: 法院接管議會的任務 | d: 社會自動變得更融合	Ett lågt valdeltagande kan göra det svårare för människor att påverka politiska beslut i sin vardag. Det kan också öka skillnaderna mellan grupper i samhället; de andra alternativen beskriver följder som inte följer av lågt valdeltagande.	Low voter turnout can leave people with fewer opportunities to influence political decisions in everyday life. It can also widen differences between groups in society; the other options describe effects that do not follow from low voter turnout.	低投票率會使人們更難在日常生活中影響政治決定，也可能加大社會群體之間的差異。其他選項不是低投票率的結果。	pending_native_review	pending_reviewer_notes
q016	zh-Hant	3	Ch. 03 · How Sweden is governed	Så här styrs Sverige	Staten	12	Hur väljer medborgarna ledamöter till riksdagen i Sveriges parlamentariska representativa demokrati?	How do citizens choose members of the Riksdag in Sweden's parliamentary representative democracy?	在瑞典的議會代表民主中，公民如何選出國會議員？	a	Genom att rösta i allmänna val	By voting in general elections	透過普選投票	a: Genom att rösta i allmänna val | b: Domstolarna väljer alla riksdagsledamöter | c: Kungen bestämmer ensam över riksdagen | d: Myndigheter röstar fram regeringen	a: By voting in general elections | b: The courts elect all members of the Riksdag | c: The king alone decides over the Riksdag | d: Government agencies vote the government into office	a: 透過普選投票 | b: 法院選出所有國會議員 | c: 國王單獨決定國會 | d: 政府機關投票選出政府	Sverige är en parlamentarisk representativ demokrati: medborgarna väljer riksdagsledamöter genom att rösta i allmänna val. Riksdagen fattar sedan beslut om lagar och statens budget, så varken domstolarna, kungen eller myndigheter väljer ledamöterna.	Sweden is a parliamentary representative democracy: citizens elect members of the Riksdag by voting in general elections. The Riksdag then decides on laws and the state budget, so the courts, the king, and government agencies do not choose its members.	瑞典是議會代表民主：公民透過普選投票選出國會議員。之後國會決定法律和國家預算，因此法院、國王或政府機關並不選出議員。 (Riksdag)	pending_native_review	pending_reviewer_notes
q017	zh-Hant	3	Ch. 03 · How Sweden is governed	Så här styrs Sverige	Staten	12	Hur många ledamöter har riksdagen?	How many members does the Riksdag have?	瑞典國會有多少名議員？	c	349	349	349	a: 21 | b: 290 | c: 349 | d: 1 600	a: 21 | b: 290 | c: 349 | d: 1,600	a: 21 | b: 290 | c: 349 | d: 1,600	Riksdagen har 349 ledamöter, och de väljs vart fjärde år. Talen 21, 290 och 1 600 anger inte antalet ledamöter i riksdagen.	The Riksdag has 349 members, and they are elected every four years. The numbers 21, 290, and 1,600 do not give the number of Riksdag members.	瑞典國會有 349 名議員，他們每四年選出一次。21、290 和 1,600 不是國會議員的人數。 (Riksdag)	pending_native_review	pending_reviewer_notes
q018	zh-Hant	3	Ch. 03 · How Sweden is governed	Så här styrs Sverige	Staten	12	Vem väljer statsministern?	Who chooses the prime minister?	誰選出首相？	a	Riksdagen	The Riksdag	國會	a: Riksdagen | b: Kungen ensam | c: Polismyndigheten | d: Regionfullmäktige	a: The Riksdag | b: The king alone | c: The Swedish Police Authority | d: The regional council	a: 國會 | b: 只有國王 | c: 瑞典警察局 | d: 地區議會	Riksdagen väljer statsministern, som får i uppdrag att bilda regering. Statsministern väljer därefter ministrarna; varken kungen, Polismyndigheten eller regionfullmäktige väljer statsminister.	The Riksdag chooses the prime minister, who is then tasked with forming a government. The prime minister chooses the ministers; neither the king, the Swedish Police Authority, nor regional councils choose the prime minister.	國會選出首相，首相隨後負責組成政府。首相再選擇各部長；國王、警察局或地區議會都不選首相。 (Riksdag)	pending_native_review	pending_reviewer_notes
q019	zh-Hant	4	Ch. 04 · Political elections and parties	Politiska val och partier	Val och röstning	14	Hur gammal måste man ha fyllt för att ha rösträtt?	How old must a person be to have the right to vote?	要有投票權，必須年滿多少歲？	b	18 år	18 years old	18 歲	a: 16 år | b: 18 år | c: 20 år | d: 25 år	a: 16 years old | b: 18 years old | c: 20 years old | d: 25 years old	a: 16 歲 | b: 18 歲 | c: 20 歲 | d: 25 歲	Man måste ha fyllt 18 år för att ha rösträtt. Därför är 16, 20 och 25 år fel här; i riksdagsval krävs också svenskt medborgarskap.	A person must have turned 18 to have the right to vote. That is why 16, 20, and 25 are wrong here; voting in a Riksdag election also requires Swedish citizenship.	要有投票權，必須已年滿 18 歲。因此 16、20 和 25 歲在這裡是錯的；在瑞典國會選舉中還需要瑞典公民身份。	pending_native_review	pending_reviewer_notes
q020	zh-Hant	4	Ch. 04 · Political elections and parties	Politiska val och partier	Folkomröstningar	14	Vad betyder det att folkomröstningar i Sverige är rådgivande?	What does it mean that referendums in Sweden are advisory?	瑞典的公投是諮詢性的，這是什麼意思？	a	Politikerna behöver inte följa resultatet	Politicians do not have to follow the result	政治人物不一定必須遵循結果	a: Politikerna behöver inte följa resultatet | b: Politikerna måste alltid följa resultatet | c: Folkomröstningar får bara hållas på nationell nivå | d: De ersätter ordinarie val till riksdagen	a: Politicians do not have to follow the result | b: Politicians must always follow the result | c: Referendums may only be held nationally | d: They replace regular Riksdag elections	a: 政治人物不一定必須遵循結果 | b: 政治人物必須永遠遵循結果 | c: 公投只能在全國層級舉行 | d: 它們取代正常的國會選舉	Folkomröstningar kan hållas om en särskild fråga nationellt, i en region eller i en kommun. De är rådgivande, så politikerna behöver inte följa resultatet.	Referendums can be held on a specific issue nationally, in a region, or in a municipality. They are advisory, so politicians do not have to follow the result.	公投可以就某個特定問題在全國、地區或市鎮舉行。它們是諮詢性的，所以政治人物不一定必須遵循結果。	pending_native_review	pending_reviewer_notes
