id	locale	chapter_id	chapter_label	source_chapter	source_section	source_page	question_sv	question_en	question_target	correct_option_id	correct_option_sv	correct_option_en	correct_option_target	options_sv	options_en	options_target	explanation_sv	explanation_en	explanation_target	native_review_status	reviewer_notes
q051	zh-Hant	7	Ch. 07 · Human rights	Mänskliga rättigheter	Mänskliga rättigheter gäller alla	22	Varför bildades Förenta nationerna efter andra världskriget?	Why was the United Nations created after the Second World War?	第二次世界大戰後為什麼成立聯合國？	a	För att förhindra krig och skydda människors rättigheter	To prevent war and protect human rights	為了防止戰爭並保護人權	a: För att förhindra krig och skydda människors rättigheter | b: För att bestämma svenska kommunalskatter | c: För att ersätta EU | d: För att kontrollera alla tidningar	a: To prevent war and protect human rights | b: To decide Swedish municipal taxes | c: To replace the EU | d: To control all newspapers	a: 為了防止戰爭並保護人權 | b: 為了決定瑞典市政稅 | c: 為了取代歐盟 | d: 為了控制所有報紙	Efter andra världskriget 1945 skapade 51 länder Förenta nationerna för att förhindra framtida krig och skydda varje människas rättigheter. Ett av FN:s första uppdrag var att komma överens om rättigheter som alla människor har.	After the Second World War in 1945, 51 countries created the United Nations to prevent future wars and protect every person’s rights. One of the UN’s first tasks was to agree on rights that all people have.	1945 年第二次世界大戰後，51 個國家成立聯合國，目的是防止未來的戰爭並保護每個人的權利。聯合國最早的任務之一，是就所有人都擁有的權利達成共識。	pending_native_review	pending_reviewer_notes
q052	zh-Hant	7	Ch. 07 · Human rights	Mänskliga rättigheter	FN:s förklaring om de mänskliga rättigheterna	22	Vilket påstående stämmer om FN:s förklaring om de mänskliga rättigheterna?	Which statement is correct about the UN Universal Declaration of Human Rights?	關於聯合國《世界人權宣言》，哪一個說法正確？	a	Den presenterades 1948 och innehåller 30 artiklar	It was presented in 1948 and contains 30 articles	它於 1948 年提出，包含 30 條	a: Den presenterades 1948 och innehåller 30 artiklar | b: Den presenterades 1918 och gäller bara Europa | c: Den säger att bara medborgare har rättigheter | d: Den handlar bara om semester från arbetet	a: It was presented in 1948 and contains 30 articles | b: It was presented in 1918 and applies only to Europe | c: It says that only citizens have rights | d: It is only about vacation from work	a: 它於 1948 年提出，包含 30 條 | b: 它於 1918 年提出，只適用於歐洲 | c: 它說只有公民有權利 | d: 它只關於工作休假	FN presenterade förklaringen om de mänskliga rättigheterna 1948, och den innehåller 30 artiklar. Förklaringen utgår från att alla människor är födda fria och lika i värde och rättigheter samt har rätt till ett liv fritt från våld.	The UN presented the Universal Declaration of Human Rights in 1948, and it contains 30 articles. The declaration is based on all people being born free and equal in value and rights and having the right to a life free from violence.	聯合國於 1948 年提出《世界人權宣言》，其中包含 30 條。宣言的出發點是所有人生而自由，在價值和權利上一律平等，並有權過免於暴力的生活。	pending_native_review	pending_reviewer_notes
q053	zh-Hant	7	Ch. 07 · Human rights	Mänskliga rättigheter	Jämställdhet mellan könen	23	Vad innebär målet med Sveriges jämställdhetspolitik?	What does the goal of Sweden’s gender equality policy mean?	瑞典性別平等政策的目標是什麼意思？	a	Att kvinnor och män ska ha samma rättigheter och skyldigheter och lika mycket makt att påverka samhället och sina egna liv	That women and men should have the same rights and duties and equal power to influence society and their own lives	女性和男性應有相同權利與義務，並有同等權力影響社會和自己的生活	a: Att kvinnor och män ska ha samma rättigheter och skyldigheter och lika mycket makt att påverka samhället och sina egna liv | b: Att jämställdhet bara handlar om hur många kvinnor som finns i politiken | c: Att kvinnor och män ska ha olika rättigheter i arbetslivet | d: Att föräldraledighet bara ska tas av kvinnor	a: That women and men should have the same rights and duties and equal power to influence society and their own lives | b: That gender equality is only about how many women are in politics | c: That women and men should have different rights in working life | d: That parental leave should only be taken by women	a: 女性和男性應有相同權利與義務，並有同等權力影響社會和自己的生活 | b: 性別平等只關於政治中有多少女性 | c: 女性和男性在工作生活中應有不同權利 | d: 育嬰假只應由女性休	Sveriges jämställdhetspolitik innebär att kvinnor och män ska ha samma rättigheter och skyldigheter och lika mycket makt att påverka samhället och sina egna liv. Exempel som lika lön, utbildning och delad föräldraledighet visar att de smalare eller motsatta alternativen är fel.	Sweden’s gender equality policy means women and men should have the same rights and duties and equal power to influence society and their own lives. Examples such as equal pay, education, and shared parental leave show that the narrower or opposite alternatives are incorrect.	瑞典的性別平等政策表示女性和男性應有相同權利與義務，並有同等權力影響社會和自己的生活。同工同酬、教育和共享育嬰假等例子顯示，較狹窄或相反的選項是錯的。	pending_native_review	pending_reviewer_notes
q054	zh-Hant	7	Ch. 07 · Human rights	Mänskliga rättigheter	Könsrelaterat våld och förtryck	23	Vad gäller för våld i nära relationer och hedersrelaterat våld och förtryck i Sverige?	What applies to violence in close relationships and honour-related violence and oppression in Sweden?	在瑞典，親密關係中的暴力以及榮譽相關暴力和壓迫適用什麼規則？	a	Det är brottsligt enligt svensk lag	They are crimes under Swedish law	這依照瑞典法律是犯罪	a: Det är brottsligt enligt svensk lag | b: Det är alltid en privat familjefråga och inte ett brott | c: Hedersrelaterat våld kan bara drabba vuxna kvinnor | d: Barnäktenskap är tillåtet om familjen samtycker	a: They are crimes under Swedish law | b: They are always private family matters and not crimes | c: Honour-related violence can affect only adult women | d: Child marriage is allowed if the family agrees	a: 這依照瑞典法律是犯罪 | b: 這永遠是私人家庭問題，不是犯罪 | c: 榮譽相關暴力只會影響成年女性 | d: 如果家庭同意，童婚是允許的	Rätt svar är att våld i nära relationer och hedersrelaterat våld och förtryck är brottsligt enligt svensk lag. Sexuellt våld, hård kontroll, tvångsäktenskap och barnäktenskap är exempel på sådant våld eller förtryck, vilket gör de andra alternativen fel.	The correct answer is that violence in close relationships and honour-related violence and oppression are crimes under Swedish law. Sexual violence, strict control, forced marriage, and child marriage are examples of this violence or oppression, which makes the other alternatives incorrect.	正確答案是，親密關係中的暴力以及榮譽相關暴力和壓迫，依照瑞典法律都是犯罪。性暴力、嚴格控制、強迫婚姻和童婚都是這類暴力或壓迫的例子，因此其他選項是錯的。	pending_native_review	pending_reviewer_notes
q055	zh-Hant	7	Ch. 07 · Human rights	Mänskliga rättigheter	Sexköpslagen	24	Vad gäller för att köpa sex i Sverige?	What applies to buying sex in Sweden?	在瑞典購買性服務適用什麼規則？	a	Det är olagligt att köpa sex, men personen som säljer straffas inte	It is illegal to buy sex, but the person who sells it is not punished	購買性服務是違法的，但出售者不受處罰	a: Det är olagligt att köpa sex, men personen som säljer straffas inte | b: Det är alltid lagligt att köpa sex | c: Både köpare och säljare straffas alltid lika | d: Lagen gäller bara företag	a: It is illegal to buy sex, but the person who sells it is not punished | b: It is always legal to buy sex | c: Buyer and seller are always punished equally | d: The law only applies to companies	a: 購買性服務是違法的，但出售者不受處罰 | b: 購買性服務永遠合法 | c: 買方和賣方總是受到同樣處罰 | d: 法律只適用於公司	Att köpa sex är olagligt i Sverige. Personen som köper sex kan straffas, men personen som säljer sex straffas inte; straffet riktas mot köparen för att markera att sexuellt utnyttjande mot betalning inte är acceptabelt.	Buying sex is illegal in Sweden. The person who buys sex can be punished, but the person who sells sex is not punished; punishment is directed at the buyer to show that sexual exploitation for payment is not acceptable.	在瑞典購買性服務是違法的。購買者可能受到處罰，但出售性服務的人不受處罰；處罰針對買方，是為了表明以付款換取性的剝削不可接受。	pending_native_review	pending_reviewer_notes
q056	zh-Hant	7	Ch. 07 · Human rights	Mänskliga rättigheter	Barns rättigheter	24	Sedan vilket år är barnkonventionen lag i Sverige?	Since what year has the Convention on the Rights of the Child been law in Sweden?	《兒童權利公約》從哪一年起成為瑞典法律？	c	2020	2020	2020 年	a: 1979 | b: 2000 | c: 2020 | d: 2024	a: 1979 | b: 2000 | c: 2020 | d: 2024	a: 1979 年 | b: 2000 年 | c: 2020 年 | d: 2024 年	Barnkonventionen ska skydda alla barns mänskliga rättigheter. I Sverige har barnkonventionen varit lag sedan 2020, därför är 2020 rätt år.	The Convention on the Rights of the Child protects every child’s human rights. In Sweden, the convention has been law since 2020, so 2020 is the correct year.	《兒童權利公約》保護所有兒童的人權。在瑞典，《兒童權利公約》自 2020 年起成為法律，因此 2020 年是正確年份。	pending_native_review	pending_reviewer_notes
q057	zh-Hant	7	Ch. 07 · Human rights	Mänskliga rättigheter	Barns rättigheter	25	Vad beslutade Sverige som första land i världen 1979?	What did Sweden decide as the first country in the world in 1979?	瑞典作為世界上第一個國家在 1979 年決定了什麼？	a	Att det är förbjudet att slå barn	That hitting children is prohibited	禁止打孩子	a: Att det är förbjudet att slå barn | b: Att barnkonventionen blev svensk lag | c: Att förbud mot våld bara gäller i skolan | d: Att barn inte omfattas av svensk lag	a: That hitting children is prohibited | b: That the Convention on the Rights of the Child became Swedish law | c: That bans on violence apply only at school | d: That children are not covered by Swedish law	a: 禁止打孩子 | b: 《兒童權利公約》成為瑞典法律 | c: 暴力禁令只適用於學校 | d: 兒童不受瑞典法律保護	Allt våld mot barn är förbjudet både enligt barnkonventionen och svensk lag. År 1979 blev Sverige först i världen med att förbjuda att slå barn; barnkonventionen blev svensk lag först 2020, och förbudet gäller inte bara i skolan.	All violence against children is prohibited under both the Convention on the Rights of the Child and Swedish law. In 1979, Sweden became the first country in the world to prohibit hitting children; the convention became Swedish law only in 2020, and the ban is not limited to schools.	依照《兒童權利公約》和瑞典法律，所有針對兒童的暴力都被禁止。1979 年，瑞典成為世界上第一個禁止打孩子的國家；《兒童權利公約》直到 2020 年才成為瑞典法律，而且禁令不只限於學校。	pending_native_review	pending_reviewer_notes
q058	zh-Hant	7	Ch. 07 · Human rights	Mänskliga rättigheter	Nationella minoriteter och urfolk	25	Vilka är Sveriges fem nationella minoriteter?	Which groups are Sweden's five national minorities?	瑞典的五個國家少數民族是哪幾個？	a	Judar, romer, samer, sverigefinnar och tornedalingar	Jews, Roma, Sami, Sweden Finns, and Tornedalians	猶太人、羅姆人、薩米人、瑞典芬蘭人和托爾訥谷人	a: Judar, romer, samer, sverigefinnar och tornedalingar | b: Danskar, norrmän, islänningar, tyskar och fransmän | c: Studenter, pensionärer, företagare, lärare och läkare | d: Stockholmare, göteborgare, malmöbor, uppsalabor och umeåbor	a: Jews, Roma, Sami, Sweden Finns, and Tornedalians | b: Danes, Norwegians, Icelanders, Germans, and French | c: Students, pensioners, entrepreneurs, teachers, and doctors | d: People from Stockholm, Gothenburg, Malmö, Uppsala, and Umeå	a: 猶太人、羅姆人、薩米人、瑞典芬蘭人和托爾訥谷人 | b: 丹麥人、挪威人、冰島人、德國人和法國人 | c: 學生、退休者、企業家、教師和醫生 | d: 斯德哥爾摩人、哥德堡人、馬爾默人、烏普薩拉人和于默奧人	Sverige erkände år 2000 judar, romer, samer, sverigefinnar och tornedalingar som nationella minoriteter. De nationella minoriteterna har särskilt skydd och rätt att använda sina minoritetsspråk i kontakter med myndigheter, förskola och äldreomsorg.	In 2000, Sweden recognized Jews, Roma, Sami, Sweden Finns, and Tornedalians as national minorities. National minorities have special protection and the right to use their minority languages in contacts with authorities, preschool, and elderly care.	瑞典在 2000 年承認猶太人、羅姆人、薩米人、瑞典芬蘭人和托爾訥谷人為國家少數民族。國家少數民族享有特別保護，並有權在與機關、幼兒園和老人照護接觸時使用自己的少數民族語言。	pending_native_review	pending_reviewer_notes
q059	zh-Hant	7	Ch. 07 · Human rights	Mänskliga rättigheter	Nationella minoriteter och urfolk	25	Vilken uppgift har Sametinget?	What is one task of the Sami Parliament?	薩米議會的一項任務是什麼？	a	Att representera den samiska befolkningen i frågor om språk, kultur och identitet	To represent the Sami population on questions of language, culture, and identity	在語言、文化和身份議題上代表薩米人口	a: Att representera den samiska befolkningen i frågor om språk, kultur och identitet | b: Att besluta statens budget | c: Att döma brottmål i domstol | d: Att samordna EU:s fyra friheter	a: To represent the Sami population on questions of language, culture, and identity | b: To decide the state budget | c: To judge criminal cases in court | d: To coordinate the EU’s four freedoms	a: 在語言、文化和身份議題上代表薩米人口 | b: 決定國家預算 | c: 在法院審理刑事案件 | d: 協調歐盟四大自由	Samerna är ett erkänt urfolk i Sverige och har ett eget folkvalt parlament, Sametinget. Sametinget representerar den samiska befolkningen i frågor om språk, kultur och identitet och är ett rådgivande organ med vissa myndighetsuppgifter.	The Sami are a recognized Indigenous people in Sweden and have their own elected parliament, the Sami Parliament. The Sami Parliament represents the Sami population on questions of language, culture, and identity and is an advisory body with some public-authority tasks.	薩米人是瑞典承認的原住民族，並有自己的民選議會，即薩米議會。薩米議會在語言、文化和身份議題上代表薩米人口，並且是具有某些行政任務的諮詢機構。	pending_native_review	pending_reviewer_notes
q060	zh-Hant	7	Ch. 07 · Human rights	Mänskliga rättigheter	Hbtqi-personer	26	Vad gäller för äktenskap mellan personer av samma kön i Sverige?	What applies to marriage between people of the same sex in Sweden?	在瑞典，同性之間的婚姻適用什麼規則？	a	Det är tillåtet att gifta sig med en person av samma kön	It is permitted to marry a person of the same sex	允許與同性的人結婚	a: Det är tillåtet att gifta sig med en person av samma kön | b: Det är förbjudet att gifta sig med en person av samma kön | c: Det är bara tillåtet att leva tillsammans, inte att gifta sig | d: Det är tillåtet bara om en myndighet ger dispens	a: It is permitted to marry a person of the same sex | b: It is prohibited to marry a person of the same sex | c: It is only permitted to live together, not to marry | d: It is permitted only if an agency grants an exemption	a: 允許與同性的人結婚 | b: 禁止與同性的人結婚 | c: 只允許共同生活，不允許結婚 | d: 只有在機關給予豁免時才允許	Rätt svar är att det är tillåtet att gifta sig med en person av samma kön. Rätten att leva med vem man vill är skyddad i lag, och diskriminering på grund av sexuell läggning, könsidentitet och könsuttryck är förbjuden enligt diskrimineringslagen.	The correct answer is that it is permitted to marry a person of the same sex. The right to live with whomever one wants is protected by law, and discrimination based on sexual orientation, gender identity, and gender expression is prohibited under the Discrimination Act.	正確答案是，允許與同性的人結婚。與自己想要的人共同生活的權利受到法律保護，基於性傾向、性別認同和性別表達的歧視依照《反歧視法》被禁止。	pending_native_review	pending_reviewer_notes
q061	zh-Hant	7	Ch. 07 · Human rights	Mänskliga rättigheter	Arbetet mot diskriminering	26	Vad är en uppgift för Diskrimineringsombudsmannen (DO)?	What is one role of the Equality Ombudsman (DO)?	歧視監察員（DO）的一項任務是什麼？	a	Att arbeta för allas lika rättigheter och se till att diskrimineringslagen följs	To work for equal rights for everyone and make sure the Discrimination Act is followed	為所有人的平等權利工作，並確保《反歧視法》得到遵守	a: Att arbeta för allas lika rättigheter och se till att diskrimineringslagen följs | b: Att se till att skulder blir betalda och besluta om skuldsanering | c: Att försvara Sverige militärt | d: Att samordna regeringssamarbete mellan de nordiska länderna	a: To work for equal rights for everyone and make sure the Discrimination Act is followed | b: To make sure debts are paid and decide on debt restructuring | c: To defend Sweden militarily | d: To coordinate government cooperation between the Nordic countries	a: 為所有人的平等權利工作，並確保《反歧視法》得到遵守 | b: 確保債務被支付並決定債務重整 | c: 用軍事力量保衛瑞典 | d: 協調北歐國家之間的政府合作	Diskrimineringsombudsmannen (DO) är en statlig myndighet som arbetar för allas lika rättigheter och möjligheter. DO ska se till att diskrimineringslagen följs; skulder, militärt försvar och nordiskt regeringssamarbete hör till andra aktörer.	The Equality Ombudsman (DO) is a government agency that works for equal rights and opportunities for everyone. DO makes sure the Discrimination Act is followed; debts, military defence, and Nordic government cooperation belong to other actors.	歧視監察員（DO）是為所有人的平等權利和機會而工作的國家機關。DO 要確保《反歧視法》得到遵守；債務、軍事防衛和北歐政府合作屬於其他機關或角色。	pending_native_review	pending_reviewer_notes
q062	zh-Hant	8	Ch. 08 · Labour market and personal finance	Arbetsmarknad och privatekonomi	Så fungerar arbetsmarknaden	27	Vad menas med offentlig sektor i Sverige?	What is the public sector in Sweden?	瑞典的公共部門包含哪些服務和活動？	a	Tjänster och verksamheter som staten, regionerna och kommunerna ansvarar för och finansierar med skatter	Services and activities that the state, regions, and municipalities are responsible for and fund through taxes	國家、區域和市鎮負責並以稅收資助的服務和活動	a: Tjänster och verksamheter som staten, regionerna och kommunerna ansvarar för och finansierar med skatter | b: Alla privatägda företag | c: Endast banker och försäkringsbolag | d: Bara ideella föreningar	a: Services and activities that the state, regions, and municipalities are responsible for and fund through taxes | b: All privately owned companies | c: Only banks and insurance companies | d: Only non-profit associations	a: 國家、區域和市鎮負責並以稅收資助的服務和活動 | b: 所有私人擁有的公司 | c: 只有銀行和保險公司 | d: 只有非營利協會	Offentlig sektor är verksamheter som staten, regionerna och kommunerna ansvarar för och finansierar med skatter. Dit hör till exempel sjukvårdspersonal, lärare, barnskötare, polis och brandman; privata företag, banker och ideella föreningar är därför fel svar.	The public sector consists of services and activities that the state, regions, and municipalities are responsible for and fund through taxes. Examples include health-care staff, teachers, childcare workers, police, and firefighters; private companies, banks, and non-profit associations are therefore wrong answers.	瑞典的公共部門包含國家、區域和市鎮負責並以稅收資助的服務和活動。醫療人員、教師、幼兒照護人員、警察和消防員都屬於這一類；私人公司、銀行和非營利協會不是正確答案。	pending_native_review	pending_reviewer_notes
q063	zh-Hant	8	Ch. 08 · Labour market and personal finance	Arbetsmarknad och privatekonomi	Så fungerar arbetsmarknaden	27	Hur stor del av arbetskraften jobbar i privat sektor i Sverige?	What share of the workforce works in Sweden's private sector?	在瑞典，勞動力中有多大比例在私人部門工作？	c	Cirka 70 procent	About 70 percent	約 70%	a: Cirka 30 procent | b: Cirka 50 procent | c: Cirka 70 procent | d: Cirka 95 procent	a: About 30 percent | b: About 50 percent | c: About 70 percent | d: About 95 percent	a: 約 30% | b: 約 50% | c: 約 70% | d: 約 95%	Rätt svar är cirka 70 procent. Den privata sektorn består av företag som ägs privat, till exempel butiker, restauranger, fabriker, byggföretag och andra företag, medan cirka 30 procent av dem som arbetar finns i offentlig sektor.	The correct answer is about 70 percent. The private sector consists of privately owned companies, such as shops, restaurants, factories, construction companies, and other businesses, while about 30 percent of people who work are in the public sector.	正確答案是約 70%。私人部門由私人擁有的公司組成，例如商店、餐館、工廠、建築公司和其他企業；而工作人口中約 30% 在公共部門。	pending_native_review	pending_reviewer_notes
q064	zh-Hant	8	Ch. 08 · Labour market and personal finance	Arbetsmarknad och privatekonomi	Arbetsmarknadens parter	28	Vad gör fackförbund på arbetsmarknaden?	What do trade unions do in the labour market?	工會在勞動市場上做什麼？	a	De företräder arbetstagare, förhandlar om löner och kan hjälpa medlemmar	They represent employees, negotiate wages, and can help members	它們代表勞工、協商工資並可以幫助會員	a: De företräder arbetstagare, förhandlar om löner och kan hjälpa medlemmar | b: De bestämmer vilka som får rösta i riksdagsval | c: De utser alla domare | d: De driver Sveriges ambassader	a: They represent employees, negotiate wages, and can help members | b: They decide who may vote in Riksdag elections | c: They appoint all judges | d: They run Sweden’s embassies	a: 它們代表勞工、協商工資並可以幫助會員 | b: 它們決定誰可以在議會選舉中投票 | c: 它們任命所有法官 | d: 它們營運瑞典的大使館	Fackförbund är de anställdas organisationer på arbetsmarknaden. De arbetar för bättre villkor, förhandlar med arbetsgivare om löner och kan hjälpa en medlem som får problem på arbetet; de ansvarar inte för val, domare eller ambassader.	Trade unions are employees’ organizations in the labour market. They work for better conditions, negotiate wages with employers, and can help a member who has problems at work; they do not handle elections, judges, or embassies.	工會是勞動市場上雇員的組織。它們為更好的條件工作，與雇主協商工資，並可以幫助在工作中遇到問題的會員；它們不負責選舉、法官或大使館。	pending_native_review	pending_reviewer_notes
