id	locale	chapter_id	chapter_label	source_chapter	source_section	source_page	question_sv	question_en	question_target	correct_option_id	correct_option_sv	correct_option_en	correct_option_target	options_sv	options_en	options_target	explanation_sv	explanation_en	explanation_target	native_review_status	reviewer_notes
q051	zh-Hans	7	Ch. 07 · Human rights	Mänskliga rättigheter	Mänskliga rättigheter gäller alla	22	Varför bildades Förenta nationerna efter andra världskriget?	Why was the United Nations created after the Second World War?	第二次世界大战后为什么成立联合国？	a	För att förhindra krig och skydda människors rättigheter	To prevent war and protect human rights	为了防止战争并保护人权	a: För att förhindra krig och skydda människors rättigheter | b: För att bestämma svenska kommunalskatter | c: För att ersätta EU | d: För att kontrollera alla tidningar	a: To prevent war and protect human rights | b: To decide Swedish municipal taxes | c: To replace the EU | d: To control all newspapers	a: 为了防止战争并保护人权 | b: 为了决定瑞典市政税 | c: 为了取代欧盟 | d: 为了控制所有报纸	Efter andra världskriget 1945 skapade 51 länder Förenta nationerna för att förhindra framtida krig och skydda varje människas rättigheter. Ett av FN:s första uppdrag var att komma överens om rättigheter som alla människor har.	After the Second World War in 1945, 51 countries created the United Nations to prevent future wars and protect every person’s rights. One of the UN’s first tasks was to agree on rights that all people have.	1945 年第二次世界大战后，51 个国家成立联合国，目的是防止未来的战争并保护每个人的权利。联合国最早的任务之一，是就所有人都拥有的权利达成共识。	pending_native_review	pending_reviewer_notes
q052	zh-Hans	7	Ch. 07 · Human rights	Mänskliga rättigheter	FN:s förklaring om de mänskliga rättigheterna	22	Vilket påstående stämmer om FN:s förklaring om de mänskliga rättigheterna?	Which statement is correct about the UN Universal Declaration of Human Rights?	关于联合国《世界人权宣言》，哪一个说法正确？	a	Den presenterades 1948 och innehåller 30 artiklar	It was presented in 1948 and contains 30 articles	它于 1948 年提出，包含 30 条	a: Den presenterades 1948 och innehåller 30 artiklar | b: Den presenterades 1918 och gäller bara Europa | c: Den säger att bara medborgare har rättigheter | d: Den handlar bara om semester från arbetet	a: It was presented in 1948 and contains 30 articles | b: It was presented in 1918 and applies only to Europe | c: It says that only citizens have rights | d: It is only about vacation from work	a: 它于 1948 年提出，包含 30 条 | b: 它于 1918 年提出，只适用于欧洲 | c: 它说只有公民有权利 | d: 它只关于工作休假	FN presenterade förklaringen om de mänskliga rättigheterna 1948, och den innehåller 30 artiklar. Förklaringen utgår från att alla människor är födda fria och lika i värde och rättigheter samt har rätt till ett liv fritt från våld.	The UN presented the Universal Declaration of Human Rights in 1948, and it contains 30 articles. The declaration is based on all people being born free and equal in value and rights and having the right to a life free from violence.	联合国于 1948 年提出《世界人权宣言》，其中包含 30 条。宣言的出发点是所有人生而自由，在价值和权利上一律平等，并有权过免于暴力的生活。	pending_native_review	pending_reviewer_notes
q053	zh-Hans	7	Ch. 07 · Human rights	Mänskliga rättigheter	Jämställdhet mellan könen	23	Vad innebär målet med Sveriges jämställdhetspolitik?	What does the goal of Sweden’s gender equality policy mean?	瑞典性别平等政策的目标是什么意思？	a	Att kvinnor och män ska ha samma rättigheter och skyldigheter och lika mycket makt att påverka samhället och sina egna liv	That women and men should have the same rights and duties and equal power to influence society and their own lives	女性和男性应有相同权利与义务，并有同等权力影响社会和自己的生活	a: Att kvinnor och män ska ha samma rättigheter och skyldigheter och lika mycket makt att påverka samhället och sina egna liv | b: Att jämställdhet bara handlar om hur många kvinnor som finns i politiken | c: Att kvinnor och män ska ha olika rättigheter i arbetslivet | d: Att föräldraledighet bara ska tas av kvinnor	a: That women and men should have the same rights and duties and equal power to influence society and their own lives | b: That gender equality is only about how many women are in politics | c: That women and men should have different rights in working life | d: That parental leave should only be taken by women	a: 女性和男性应有相同权利与义务，并有同等权力影响社会和自己的生活 | b: 性别平等只关于政治中有多少女性 | c: 女性和男性在工作生活中应有不同权利 | d: 育儿假只应由女性休	Sveriges jämställdhetspolitik innebär att kvinnor och män ska ha samma rättigheter och skyldigheter och lika mycket makt att påverka samhället och sina egna liv. Exempel som lika lön, utbildning och delad föräldraledighet visar att de smalare eller motsatta alternativen är fel.	Sweden’s gender equality policy means women and men should have the same rights and duties and equal power to influence society and their own lives. Examples such as equal pay, education, and shared parental leave show that the narrower or opposite alternatives are incorrect.	瑞典的性别平等政策表示女性和男性应有相同权利与义务，并有同等权力影响社会和自己的生活。同工同酬、教育和共享育儿假等例子显示，较狭窄或相反的选项是错的。	pending_native_review	pending_reviewer_notes
q054	zh-Hans	7	Ch. 07 · Human rights	Mänskliga rättigheter	Könsrelaterat våld och förtryck	23	Vad gäller för våld i nära relationer och hedersrelaterat våld och förtryck i Sverige?	What applies to violence in close relationships and honour-related violence and oppression in Sweden?	在瑞典，亲密关系中的暴力以及荣誉相关暴力和压迫适用什么规则？	a	Det är brottsligt enligt svensk lag	They are crimes under Swedish law	这依照瑞典法律是犯罪	a: Det är brottsligt enligt svensk lag | b: Det är alltid en privat familjefråga och inte ett brott | c: Hedersrelaterat våld kan bara drabba vuxna kvinnor | d: Barnäktenskap är tillåtet om familjen samtycker	a: They are crimes under Swedish law | b: They are always private family matters and not crimes | c: Honour-related violence can affect only adult women | d: Child marriage is allowed if the family agrees	a: 这依照瑞典法律是犯罪 | b: 这永远是私人家庭问题，不是犯罪 | c: 荣誉相关暴力只会影响成年女性 | d: 如果家庭同意，童婚是允许的	Rätt svar är att våld i nära relationer och hedersrelaterat våld och förtryck är brottsligt enligt svensk lag. Sexuellt våld, hård kontroll, tvångsäktenskap och barnäktenskap är exempel på sådant våld eller förtryck, vilket gör de andra alternativen fel.	The correct answer is that violence in close relationships and honour-related violence and oppression are crimes under Swedish law. Sexual violence, strict control, forced marriage, and child marriage are examples of this violence or oppression, which makes the other alternatives incorrect.	正确答案是，亲密关系中的暴力以及荣誉相关暴力和压迫，依照瑞典法律都是犯罪。性暴力、严格控制、强迫婚姻和童婚都是这类暴力或压迫的例子，因此其他选项是错的。	pending_native_review	pending_reviewer_notes
q055	zh-Hans	7	Ch. 07 · Human rights	Mänskliga rättigheter	Sexköpslagen	24	Vad gäller för att köpa sex i Sverige?	What applies to buying sex in Sweden?	在瑞典购买性服务适用什么规则？	a	Det är olagligt att köpa sex, men personen som säljer straffas inte	It is illegal to buy sex, but the person who sells it is not punished	购买性服务是违法的，但出售者不受处罚	a: Det är olagligt att köpa sex, men personen som säljer straffas inte | b: Det är alltid lagligt att köpa sex | c: Både köpare och säljare straffas alltid lika | d: Lagen gäller bara företag	a: It is illegal to buy sex, but the person who sells it is not punished | b: It is always legal to buy sex | c: Buyer and seller are always punished equally | d: The law only applies to companies	a: 购买性服务是违法的，但出售者不受处罚 | b: 购买性服务永远合法 | c: 买方和卖方总是受到同样处罚 | d: 法律只适用于公司	Att köpa sex är olagligt i Sverige. Personen som köper sex kan straffas, men personen som säljer sex straffas inte; straffet riktas mot köparen för att markera att sexuellt utnyttjande mot betalning inte är acceptabelt.	Buying sex is illegal in Sweden. The person who buys sex can be punished, but the person who sells sex is not punished; punishment is directed at the buyer to show that sexual exploitation for payment is not acceptable.	在瑞典购买性服务是违法的。购买者可能受到处罚，但出售性服务的人不受处罚；处罚针对买方，是为了表明以付款换取性的剥削不可接受。	pending_native_review	pending_reviewer_notes
q056	zh-Hans	7	Ch. 07 · Human rights	Mänskliga rättigheter	Barns rättigheter	24	Sedan vilket år är barnkonventionen lag i Sverige?	Since what year has the Convention on the Rights of the Child been law in Sweden?	《儿童权利公约》从哪一年起成为瑞典法律？	c	2020	2020	2020 年	a: 1979 | b: 2000 | c: 2020 | d: 2024	a: 1979 | b: 2000 | c: 2020 | d: 2024	a: 1979 年 | b: 2000 年 | c: 2020 年 | d: 2024 年	Barnkonventionen ska skydda alla barns mänskliga rättigheter. I Sverige har barnkonventionen varit lag sedan 2020, därför är 2020 rätt år.	The Convention on the Rights of the Child protects every child’s human rights. In Sweden, the convention has been law since 2020, so 2020 is the correct year.	《儿童权利公约》保护所有儿童的人权。在瑞典，《儿童权利公约》自 2020 年起成为法律，因此 2020 年是正确年份。	pending_native_review	pending_reviewer_notes
q057	zh-Hans	7	Ch. 07 · Human rights	Mänskliga rättigheter	Barns rättigheter	25	Vad beslutade Sverige som första land i världen 1979?	What did Sweden decide as the first country in the world in 1979?	瑞典作为世界上第一个国家在 1979 年决定了什么？	a	Att det är förbjudet att slå barn	That hitting children is prohibited	禁止打孩子	a: Att det är förbjudet att slå barn | b: Att barnkonventionen blev svensk lag | c: Att förbud mot våld bara gäller i skolan | d: Att barn inte omfattas av svensk lag	a: That hitting children is prohibited | b: That the Convention on the Rights of the Child became Swedish law | c: That bans on violence apply only at school | d: That children are not covered by Swedish law	a: 禁止打孩子 | b: 《儿童权利公约》成为瑞典法律 | c: 暴力禁令只适用于学校 | d: 儿童不受瑞典法律保护	Allt våld mot barn är förbjudet både enligt barnkonventionen och svensk lag. År 1979 blev Sverige först i världen med att förbjuda att slå barn; barnkonventionen blev svensk lag först 2020, och förbudet gäller inte bara i skolan.	All violence against children is prohibited under both the Convention on the Rights of the Child and Swedish law. In 1979, Sweden became the first country in the world to prohibit hitting children; the convention became Swedish law only in 2020, and the ban is not limited to schools.	依照《儿童权利公约》和瑞典法律，所有针对儿童的暴力都被禁止。1979 年，瑞典成为世界上第一个禁止打孩子的国家；《儿童权利公约》直到 2020 年才成为瑞典法律，而且禁令不只限于学校。	pending_native_review	pending_reviewer_notes
q058	zh-Hans	7	Ch. 07 · Human rights	Mänskliga rättigheter	Nationella minoriteter och urfolk	25	Vilka är Sveriges fem nationella minoriteter?	Which groups are Sweden's five national minorities?	瑞典的五个国家少数民族是哪几个？	a	Judar, romer, samer, sverigefinnar och tornedalingar	Jews, Roma, Sami, Sweden Finns, and Tornedalians	犹太人、罗姆人、萨米人、瑞典芬兰人和托尔讷谷人	a: Judar, romer, samer, sverigefinnar och tornedalingar | b: Danskar, norrmän, islänningar, tyskar och fransmän | c: Studenter, pensionärer, företagare, lärare och läkare | d: Stockholmare, göteborgare, malmöbor, uppsalabor och umeåbor	a: Jews, Roma, Sami, Sweden Finns, and Tornedalians | b: Danes, Norwegians, Icelanders, Germans, and French | c: Students, pensioners, entrepreneurs, teachers, and doctors | d: People from Stockholm, Gothenburg, Malmö, Uppsala, and Umeå	a: 犹太人、罗姆人、萨米人、瑞典芬兰人和托尔讷谷人 | b: 丹麦人、挪威人、冰岛人、德国人和法国人 | c: 学生、退休者、企业家、教师和医生 | d: 斯德哥尔摩人、哥德堡人、马尔默人、乌普萨拉人和于默奥人	Sverige erkände år 2000 judar, romer, samer, sverigefinnar och tornedalingar som nationella minoriteter. De nationella minoriteterna har särskilt skydd och rätt att använda sina minoritetsspråk i kontakter med myndigheter, förskola och äldreomsorg.	In 2000, Sweden recognized Jews, Roma, Sami, Sweden Finns, and Tornedalians as national minorities. National minorities have special protection and the right to use their minority languages in contacts with authorities, preschool, and elderly care.	瑞典在 2000 年承认犹太人、罗姆人、萨米人、瑞典芬兰人和托尔讷谷人为国家少数民族。国家少数民族享有特别保护，并有权在与机关、幼儿园和老人照护接触时使用自己的少数民族语言。	pending_native_review	pending_reviewer_notes
q059	zh-Hans	7	Ch. 07 · Human rights	Mänskliga rättigheter	Nationella minoriteter och urfolk	25	Vilken uppgift har Sametinget?	What is one task of the Sami Parliament?	萨米议会的一项任务是什么？	a	Att representera den samiska befolkningen i frågor om språk, kultur och identitet	To represent the Sami population on questions of language, culture, and identity	在语言、文化和身份议题上代表萨米人口	a: Att representera den samiska befolkningen i frågor om språk, kultur och identitet | b: Att besluta statens budget | c: Att döma brottmål i domstol | d: Att samordna EU:s fyra friheter	a: To represent the Sami population on questions of language, culture, and identity | b: To decide the state budget | c: To judge criminal cases in court | d: To coordinate the EU’s four freedoms	a: 在语言、文化和身份议题上代表萨米人口 | b: 决定国家预算 | c: 在法院审理刑事案件 | d: 协调欧盟四大自由	Samerna är ett erkänt urfolk i Sverige och har ett eget folkvalt parlament, Sametinget. Sametinget representerar den samiska befolkningen i frågor om språk, kultur och identitet och är ett rådgivande organ med vissa myndighetsuppgifter.	The Sami are a recognized Indigenous people in Sweden and have their own elected parliament, the Sami Parliament. The Sami Parliament represents the Sami population on questions of language, culture, and identity and is an advisory body with some public-authority tasks.	萨米人是瑞典承认的原住民族，并有自己的民选议会，即萨米议会。萨米议会在语言、文化和身份议题上代表萨米人口，并且是具有某些行政任务的咨询机构。	pending_native_review	pending_reviewer_notes
q060	zh-Hans	7	Ch. 07 · Human rights	Mänskliga rättigheter	Hbtqi-personer	26	Vad gäller för äktenskap mellan personer av samma kön i Sverige?	What applies to marriage between people of the same sex in Sweden?	在瑞典，同性之间的婚姻适用什么规则？	a	Det är tillåtet att gifta sig med en person av samma kön	It is permitted to marry a person of the same sex	允许与同性的人结婚	a: Det är tillåtet att gifta sig med en person av samma kön | b: Det är förbjudet att gifta sig med en person av samma kön | c: Det är bara tillåtet att leva tillsammans, inte att gifta sig | d: Det är tillåtet bara om en myndighet ger dispens	a: It is permitted to marry a person of the same sex | b: It is prohibited to marry a person of the same sex | c: It is only permitted to live together, not to marry | d: It is permitted only if an agency grants an exemption	a: 允许与同性的人结婚 | b: 禁止与同性的人结婚 | c: 只允许共同生活，不允许结婚 | d: 只有在机关给予豁免时才允许	Rätt svar är att det är tillåtet att gifta sig med en person av samma kön. Rätten att leva med vem man vill är skyddad i lag, och diskriminering på grund av sexuell läggning, könsidentitet och könsuttryck är förbjuden enligt diskrimineringslagen.	The correct answer is that it is permitted to marry a person of the same sex. The right to live with whomever one wants is protected by law, and discrimination based on sexual orientation, gender identity, and gender expression is prohibited under the Discrimination Act.	正确答案是，允许与同性的人结婚。与自己想要的人共同生活的权利受到法律保护，基于性倾向、性别认同和性别表达的歧视依照《反歧视法》被禁止。	pending_native_review	pending_reviewer_notes
q061	zh-Hans	7	Ch. 07 · Human rights	Mänskliga rättigheter	Arbetet mot diskriminering	26	Vad är en uppgift för Diskrimineringsombudsmannen (DO)?	What is one role of the Equality Ombudsman (DO)?	歧视监察员（DO）的一项职责是什么？	a	Att arbeta för allas lika rättigheter och se till att diskrimineringslagen följs	To work for equal rights for everyone and make sure the Discrimination Act is followed	为所有人的平等权利工作，并确保《反歧视法》得到遵守	a: Att arbeta för allas lika rättigheter och se till att diskrimineringslagen följs | b: Att se till att skulder blir betalda och besluta om skuldsanering | c: Att försvara Sverige militärt | d: Att samordna regeringssamarbete mellan de nordiska länderna	a: To work for equal rights for everyone and make sure the Discrimination Act is followed | b: To make sure debts are paid and decide on debt restructuring | c: To defend Sweden militarily | d: To coordinate government cooperation between the Nordic countries	a: 为所有人的平等权利工作，并确保《反歧视法》得到遵守 | b: 确保债务被偿还并决定债务重整 | c: 用军事力量保卫瑞典 | d: 协调北欧国家之间的政府合作	Diskrimineringsombudsmannen (DO) är en statlig myndighet som arbetar för allas lika rättigheter och möjligheter. DO ska se till att diskrimineringslagen följs; skulder, militärt försvar och nordiskt regeringssamarbete hör till andra aktörer.	The Equality Ombudsman (DO) is a government agency that works for equal rights and opportunities for everyone. DO makes sure the Discrimination Act is followed; debts, military defence, and Nordic government cooperation belong to other actors.	歧视监察员（DO）是为所有人的平等权利和机会而工作的国家机关。DO 要确保《反歧视法》得到遵守；债务、军事防卫和北欧政府合作属于其他机关或角色。	pending_native_review	pending_reviewer_notes
q062	zh-Hans	8	Ch. 08 · Labour market and personal finance	Arbetsmarknad och privatekonomi	Så fungerar arbetsmarknaden	27	Vad menas med offentlig sektor i Sverige?	What is the public sector in Sweden?	瑞典的公共部门包含哪些服务和活动？	a	Tjänster och verksamheter som staten, regionerna och kommunerna ansvarar för och finansierar med skatter	Services and activities that the state, regions, and municipalities are responsible for and fund through taxes	国家、地区和市镇负责并由税收资助的服务和活动	a: Tjänster och verksamheter som staten, regionerna och kommunerna ansvarar för och finansierar med skatter | b: Alla privatägda företag | c: Endast banker och försäkringsbolag | d: Bara ideella föreningar	a: Services and activities that the state, regions, and municipalities are responsible for and fund through taxes | b: All privately owned companies | c: Only banks and insurance companies | d: Only non-profit associations	a: 国家、地区和市镇负责并由税收资助的服务和活动 | b: 所有私人拥有的公司 | c: 只有银行和保险公司 | d: 只有非营利协会	Offentlig sektor är verksamheter som staten, regionerna och kommunerna ansvarar för och finansierar med skatter. Dit hör till exempel sjukvårdspersonal, lärare, barnskötare, polis och brandman; privata företag, banker och ideella föreningar är därför fel svar.	The public sector consists of services and activities that the state, regions, and municipalities are responsible for and fund through taxes. Examples include health-care staff, teachers, childcare workers, police, and firefighters; private companies, banks, and non-profit associations are therefore wrong answers.	瑞典的公共部门包含国家、地区和市镇负责并由税收资助的服务和活动。医疗人员、教师、幼儿照护人员、警察和消防员都属于这一类；私人公司、银行和非营利协会不是正确答案。	pending_native_review	pending_reviewer_notes
q063	zh-Hans	8	Ch. 08 · Labour market and personal finance	Arbetsmarknad och privatekonomi	Så fungerar arbetsmarknaden	27	Hur stor del av arbetskraften jobbar i privat sektor i Sverige?	What share of the workforce works in Sweden's private sector?	在瑞典，劳动力中有多大比例在私人部门工作？	c	Cirka 70 procent	About 70 percent	约 70%	a: Cirka 30 procent | b: Cirka 50 procent | c: Cirka 70 procent | d: Cirka 95 procent	a: About 30 percent | b: About 50 percent | c: About 70 percent | d: About 95 percent	a: 约 30% | b: 约 50% | c: 约 70% | d: 约 95%	Rätt svar är cirka 70 procent. Den privata sektorn består av företag som ägs privat, till exempel butiker, restauranger, fabriker, byggföretag och andra företag, medan cirka 30 procent av dem som arbetar finns i offentlig sektor.	The correct answer is about 70 percent. The private sector consists of privately owned companies, such as shops, restaurants, factories, construction companies, and other businesses, while about 30 percent of people who work are in the public sector.	正确答案是约 70%。私人部门由私人拥有的公司组成，例如商店、餐馆、工厂、建筑公司和其他企业；而工作人口中约 30% 在公共部门。	pending_native_review	pending_reviewer_notes
q064	zh-Hans	8	Ch. 08 · Labour market and personal finance	Arbetsmarknad och privatekonomi	Arbetsmarknadens parter	28	Vad gör fackförbund på arbetsmarknaden?	What do trade unions do in the labour market?	工会在劳动力市场上做什么？	a	De företräder arbetstagare, förhandlar om löner och kan hjälpa medlemmar	They represent employees, negotiate wages, and can help members	它们代表劳动者、协商工资并可以帮助会员	a: De företräder arbetstagare, förhandlar om löner och kan hjälpa medlemmar | b: De bestämmer vilka som får rösta i riksdagsval | c: De utser alla domare | d: De driver Sveriges ambassader	a: They represent employees, negotiate wages, and can help members | b: They decide who may vote in Riksdag elections | c: They appoint all judges | d: They run Sweden’s embassies	a: 它们代表劳动者、协商工资并可以帮助会员 | b: 它们决定谁可以在议会选举中投票 | c: 它们任命所有法官 | d: 它们运营瑞典的大使馆	Fackförbund är de anställdas organisationer på arbetsmarknaden. De arbetar för bättre villkor, förhandlar med arbetsgivare om löner och kan hjälpa en medlem som får problem på arbetet; de ansvarar inte för val, domare eller ambassader.	Trade unions are employees’ organizations in the labour market. They work for better conditions, negotiate wages with employers, and can help a member who has problems at work; they do not handle elections, judges, or embassies.	工会是劳动力市场上雇员的组织。它们为更好的条件工作，与雇主协商工资，并可以帮助在工作中遇到问题的会员；它们不负责选举、法官或大使馆。	pending_native_review	pending_reviewer_notes
