id	locale	chapter_id	chapter_label	source_chapter	source_section	source_page	question_sv	question_en	question_target	correct_option_id	correct_option_sv	correct_option_en	correct_option_target	options_sv	options_en	options_target	explanation_sv	explanation_en	explanation_target	native_review_status	reviewer_notes
q001	zh-Hans	1	Ch. 01 · The country of Sweden	Landet Sverige	Geografi, klimat och natur	5	Var ligger Sverige?	Where is Sweden located?	瑞典位于哪里？	a	I Norden i norra Europa	In the Nordic region in northern Europe	位于北欧的北欧地区	a: I Norden i norra Europa | b: I södra Europa | c: I västra Asien | d: I Nordamerika	a: In the Nordic region in northern Europe | b: In southern Europe | c: In western Asia | d: In North America	a: 位于北欧的北欧地区 | b: 位于南欧 | c: 位于西亚 | d: 位于北美洲	Sverige ligger i Norden i norra Europa. Norden består av Danmark, Finland, Island, Norge och Sverige och är en del av norra Europa.	Sweden is in the Nordic region in northern Europe. The Nordic region includes Denmark, Finland, Iceland, Norway, and Sweden and is part of northern Europe.	瑞典位于北欧的北欧地区。北欧地区包括丹麦、芬兰、冰岛、挪威和瑞典，属于北欧的一部分。	pending_native_review	pending_reviewer_notes
q002	zh-Hans	1	Ch. 01 · The country of Sweden	Landet Sverige	Geografi, klimat och natur	5	Sveriges nordligaste del ligger norr om polcirkeln.	Sweden's northernmost part lies north of the Arctic Circle.	瑞典最北端位于北极圈以北。	true	Sant	True	正确	true: Sant | false: Falskt	true: True | false: False	true: 正确 | false: 错误	Sveriges nordligaste del ligger norr om polcirkeln, i det arktiska området. Den norra delen av landet sträcker sig alltså in i området norr om polcirkeln.	Sweden's northernmost part lies north of the Arctic Circle, in the Arctic area. The northern part of the country therefore extends into the area north of the Arctic Circle.	瑞典最北端在北极圈以北，属于北极地区。也就是说，瑞典北部延伸到北极圈以北的区域。	pending_native_review	pending_reviewer_notes
q003	zh-Hans	1	Ch. 01 · The country of Sweden	Landet Sverige	Geografi, klimat och natur	5	Ungefär hur långt sträcker sig Sverige från Treriksröset till Smygehuk?	Approximately how far does Sweden stretch from Treriksröset to Smygehuk?	从 Treriksröset 到 Smygehuk，瑞典南北大约有多长？	b	Cirka 1 600 kilometer	About 1,600 kilometres	约 1,600 公里	a: Cirka 160 kilometer | b: Cirka 1 600 kilometer | c: Cirka 16 000 kilometer | d: Cirka 60 kilometer	a: About 160 kilometres | b: About 1,600 kilometres | c: About 16,000 kilometres | d: About 60 kilometres	a: 约 160 公里 | b: 约 1,600 公里 | c: 约 16,000 公里 | d: 约 60 公里	Sverige är ett avlångt land som sträcker sig cirka 1 600 kilometer från Treriksröset i norr till Smygehuk i söder. Avstånden 160 och 60 kilometer är för korta, och 16 000 kilometer är för långt.	Sweden is an elongated country that stretches about 1,600 kilometres from Treriksröset in the north to Smygehuk in the south. The distances 160 and 60 kilometres are too short, and 16,000 kilometres is too long.	瑞典是狭长的国家，从北部的 Treriksröset 到南部的 Smygehuk 约 1,600 公里。160 和 60 公里太短，16,000 公里则太长。	pending_native_review	pending_reviewer_notes
q004	zh-Hans	1	Ch. 01 · The country of Sweden	Landet Sverige	Geografi, klimat och natur	5	Vad heter havet vid Sveriges östra kust?	What is the sea along Sweden's eastern coast called?	瑞典东海岸沿岸的海叫什么？	c	Östersjön	The Baltic Sea	波罗的海	a: Nordsjön | b: Medelhavet | c: Östersjön | d: Atlanten	a: The North Sea | b: The Mediterranean Sea | c: The Baltic Sea | d: The Atlantic Ocean	a: 北海 | b: 地中海 | c: 波罗的海 | d: 大西洋	Havet vid Sveriges östra kust heter Östersjön. Nordsjön, Medelhavet och Atlanten är inte namnet på havet vid Sveriges östra kust.	The sea along Sweden's eastern coast is the Baltic Sea. The North Sea, the Mediterranean Sea, and the Atlantic Ocean are not the sea along Sweden's eastern coast.	瑞典东海岸沿岸的海是波罗的海。北海、地中海和大西洋都不是瑞典东海岸沿岸的海名。	pending_native_review	pending_reviewer_notes
q005	zh-Hans	1	Ch. 01 · The country of Sweden	Landet Sverige	Geografi, klimat och natur	5	Vilka öar är Sveriges två största?	Which islands are Sweden's two largest?	瑞典最大的两座岛是哪两座？	a	Gotland och Öland	Gotland and Öland	Gotland 和 Öland	a: Gotland och Öland | b: Hisingen och Orust | c: Värmdö och Tjörn | d: Malmö och Göteborg	a: Gotland and Öland | b: Hisingen and Orust | c: Värmdö and Tjörn | d: Malmö and Gothenburg	a: Gotland 和 Öland | b: Hisingen 和 Orust | c: Värmdö 和 Tjörn | d: Malmö 和 Göteborg	Sveriges två största öar är Gotland och Öland. Hisingen, Orust, Värmdö och Tjörn är också svenska öar men är inte de två största, och Malmö och Göteborg är städer.	Sweden's two largest islands are Gotland and Öland. Hisingen, Orust, Värmdö, and Tjörn are also Swedish islands but are not the two largest, and Malmö and Gothenburg are cities.	瑞典最大的两座岛是 Gotland 和 Öland。Hisingen、Orust、Värmdö 和 Tjörn 也是瑞典岛屿，但不是最大的两座；Malmö 和 Göteborg 是城市。	pending_native_review	pending_reviewer_notes
q006	zh-Hans	1	Ch. 01 · The country of Sweden	Landet Sverige	Geografi, klimat och natur	5	Golfströmmen och den Nordatlantiska strömmen bidrar till Sveriges milda klimat.	The Gulf Stream and the North Atlantic Current help make Sweden's climate mild.	墨西哥湾流和北大西洋洋流有助于让瑞典气候温和。	true	Sant	True	正确	true: Sant | false: Falskt	true: True | false: False	true: 正确 | false: 错误	Sverige har ett milt klimat jämfört med många andra områden på samma breddgrad. Golfströmmen och den Nordatlantiska strömmen transporterar varmt vatten mot Europa, vilket värmer luften som vindarna för in över Sverige.	Sweden has a mild climate compared with many other areas at the same latitude. The Gulf Stream and the North Atlantic Current carry warm water toward Europe, warming the air that winds bring over Sweden.	与许多同纬度地区相比，瑞典气候较温和。墨西哥湾流和北大西洋洋流把暖水带向欧洲，让吹向瑞典的空气变暖。	pending_native_review	pending_reviewer_notes
q007	zh-Hans	1	Ch. 01 · The country of Sweden	Landet Sverige	Fjäll	6	Vad heter Sveriges högsta berg?	What is the name of Sweden's highest mountain?	瑞典最高的山叫什么？	a	Kebnekaise	Kebnekaise	Kebnekaise	a: Kebnekaise | b: Smygehuk | c: Treriksröset | d: Mälaren	a: Kebnekaise | b: Smygehuk | c: Treriksröset | d: Mälaren	a: Kebnekaise | b: Smygehuk | c: Treriksröset | d: Mälaren	Sveriges högsta berg heter Kebnekaise och är cirka 2 000 meter högt. Det ligger i fjällen, den del av bergskedjan Skanderna som går längs gränsen mot Norge.	Sweden's highest mountain is Kebnekaise, at about 2,000 metres. It is in the mountain region called fjällen, part of the Scandinavian Mountains along the border with Norway.	瑞典最高的山是 Kebnekaise，高约 2,000 米。它位于山地地区 fjällen，也就是沿挪威边界延伸的斯堪的纳维亚山脉的一部分。 (Treriksröset; Smygehuk)	pending_native_review	pending_reviewer_notes
q008	zh-Hans	1	Ch. 01 · The country of Sweden	Landet Sverige	Skogar, sjöar och öar	6	Vilka är Sveriges tre största sjöar?	What are Sweden's three largest lakes?	瑞典最大的三座湖是哪三座？	a	Vänern, Vättern och Mälaren	Vänern, Vättern, and Mälaren	Vänern、Vättern 和 Mälaren	a: Vänern, Vättern och Mälaren | b: Östersjön, Kattegatt och Skagerrak | c: Gotland, Öland och Orust | d: Stockholm, Göteborg och Malmö	a: Vänern, Vättern, and Mälaren | b: The Baltic Sea, Kattegat, and Skagerrak | c: Gotland, Öland, and Orust | d: Stockholm, Gothenburg, and Malmö	a: Vänern、Vättern 和 Mälaren | b: 波罗的海、Kattegat 和 Skagerrak | c: Gotland、Öland 和 Orust | d: Stockholm、Göteborg 和 Malmö	Sverige har många sjöar spridda över hela landet, och de tre största är Vänern, Vättern och Mälaren. De andra alternativen räknar upp havsområden, öar eller städer i stället för sjöar.	Sweden has many lakes throughout the country, and the three largest are Vänern, Vättern, and Mälaren. The other choices list sea areas, islands, or cities instead of lakes.	瑞典全国有许多湖泊，最大的三座是 Vänern、Vättern 和 Mälaren。其他选项列出的是海域、岛屿或城市，而不是湖泊。	pending_native_review	pending_reviewer_notes
q009	zh-Hans	1	Ch. 01 · The country of Sweden	Landet Sverige	Befolkning	7	Ungefär hur många människor bor i Sverige?	Approximately how many people live in Sweden?	瑞典大约有多少人口？	a	Nästan 11 miljoner	Almost 11 million	将近 1100 万	a: Nästan 11 miljoner | b: Nästan 1 miljon | c: Cirka 50 miljoner | d: Cirka 100 miljoner	a: Almost 11 million | b: Almost 1 million | c: About 50 million | d: About 100 million	a: 将近 1100 万 | b: 将近 100 万 | c: 约 5000 万 | d: 约 1 亿	Det bor nästan 11 miljoner människor i Sverige. Befolkningen är inte jämnt fördelad: de flesta bor i den södra delen av landet och längs kusterna.	Almost 11 million people live in Sweden. The population is not evenly distributed: most people live in the southern part of the country and along the coasts.	瑞典有将近 1100 万人口。人口分布并不平均：多数人住在南部和沿海地区。	pending_native_review	pending_reviewer_notes
q010	zh-Hans	1	Ch. 01 · The country of Sweden	Landet Sverige	Naturresurser	7	Vilka naturresurser är viktiga i Sverige?	Which natural resources are important in Sweden?	哪些自然资源对瑞典很重要？	a	Järnmalm och andra mineraler, skog, jordbruksmark och vatten	Iron ore and other minerals, forest, agricultural land, and water	铁矿和其他矿物、森林、农业用地和水	a: Järnmalm och andra mineraler, skog, jordbruksmark och vatten | b: Olja, naturgas, ökenmark och tropiskt regn | c: Kol, diamantgruvor, vulkanjord och palmer | d: Risfält, bomullsplantager, korallrev och tidvatten	a: Iron ore and other minerals, forest, agricultural land, and water | b: Oil, natural gas, desert land, and tropical rain | c: Coal, diamond mines, volcanic soil, and palm trees | d: Rice fields, cotton plantations, coral reefs, and tides	a: 铁矿和其他矿物、森林、农业用地和水 | b: 石油、天然气、沙漠土地和热带雨水 | c: 煤、钻石矿、火山土和棕榈树 | d: 稻田、棉花种植园、珊瑚礁和潮汐	Sverige är rikt på flera viktiga naturresurser: järnmalm och andra mineraler, skog, jordbruksmark och vatten. Olja, naturgas, ökenmark, tropiskt regn och liknande beskriver inte Sveriges viktiga naturresurser.	Sweden is rich in several important natural resources: iron ore and other minerals, forests, agricultural land, and water. Oil, natural gas, desert land, tropical rain, and similar items do not describe Sweden's important natural resources.	瑞典拥有多种重要自然资源：铁矿和其他矿物、森林、农业用地和水。石油、天然气、沙漠土地、热带雨水等并不能描述瑞典的重要自然资源。	pending_native_review	pending_reviewer_notes
q011	zh-Hans	2	Ch. 02 · Sweden's democratic system	Sveriges demokratiska system	Demokrati betyder folkstyre	10	Vad betyder demokrati?	What does democracy mean?	民主是什么意思？	a	Folkstyre	Rule by the people	人民治理	a: Folkstyre | b: Militärstyre | c: Envälde | d: Företagsstyre	a: Rule by the people | b: Military rule | c: Autocracy | d: Rule by companies	a: 人民治理 | b: 军事统治 | c: 专制统治 | d: 公司治理	Demokrati betyder folkstyre: makten utgår från folket och medborgarna kan påverka beslut. Människor ska kunna välja mellan flera politiska alternativ, och de som får makten ska kunna bytas ut. Militärstyre, envälde och företagsstyre lägger makten någon annanstans.	Democracy means rule by the people: power comes from the people, and citizens can influence decisions. People should be able to choose between several political alternatives, and those who gain power can be replaced. Military rule, autocracy, and rule by companies place power somewhere else.	民主是人民治理：权力来自人民，公民可以影响决定。人们应能在多个政治选项之间选择，掌权者也应能被更换。	pending_native_review	pending_reviewer_notes
q012	zh-Hans	2	Ch. 02 · Sweden's democratic system	Sveriges demokratiska system	Demokrati betyder folkstyre	10	Vilket av följande ingår i fria val i en demokrati?	Which of the following is part of free elections in a democracy?	以下哪一项属于民主中的自由选举？	a	Alla som har rätt att rösta har en röst var	Everyone who is eligible to vote has one vote	每个有投票权的人各有一票	a: Alla som har rätt att rösta har en röst var | b: Bara ett parti får ställa upp | c: Väljare måste visa offentligt hur de röstar | d: Regeringen bestämmer hur alla röster ska användas	a: Everyone who is eligible to vote has one vote | b: Only one party may stand for election | c: Voters must publicly show how they vote | d: The government decides how all votes must be used	a: 每个有投票权的人各有一票 | b: 只有一个政党可以参选 | c: 选民必须公开展示如何投票 | d: 政府决定所有选票如何使用	Fria val innebär att alla som har rätt att rösta har en röst var. Väljare ska kunna uttrycka sina åsikter utan hot eller tvång, det ska finnas flera partier och valet ska vara hemligt.	Free elections mean that everyone who is eligible to vote has one vote. Voters should be able to express their views without threats or coercion, there should be several parties, and the vote should be secret.	自由选举表示每个有投票权的人各有一票。选民应能在没有威胁或强迫的情况下表达意见，应有多个政党，而且投票应是秘密的。	pending_native_review	pending_reviewer_notes
q013	zh-Hans	2	Ch. 02 · Sweden's democratic system	Sveriges demokratiska system	En stark demokrati	10	Hur kan människor påverka samhället och delta i demokratin?	How can people influence society and participate in democracy?	哪一种方式可以影响并参与社会？	a	Kontakta politiker, demonstrera eller skriva på en namninsamling	Contact politicians, join a demonstration, or sign a petition	联系政治人物、示威或签署请愿书	a: Kontakta politiker, demonstrera eller skriva på en namninsamling | b: Förbjuda andra från att rösta i politiska val | c: Tvinga journalister att skriva vissa åsikter | d: Stoppa människor från att prata om politik	a: Contact politicians, join a demonstration, or sign a petition | b: Ban others from voting in political elections | c: Force journalists to write certain opinions | d: Stop people from talking about politics	a: 联系政治人物、示威或签署请愿书 | b: 禁止他人在政治选举中投票 | c: 强迫记者写某些意见 | d: 阻止人们谈论政治	Det finns flera demokratiska sätt att påverka och delta i samhället, till exempel att kontakta politiker, demonstrera och starta eller skriva på en namninsamling. De andra alternativen skulle hindra människor från att rösta, uttrycka åsikter eller delta i demokratin.	People can influence and participate in society in several democratic ways, including contacting politicians, joining a demonstration, and starting or signing a petition. The other options would stop people from voting, expressing opinions, or taking part in democracy.	影响并参与社会有多种民主方式，例如联系政治人物、示威，以及发起或签署请愿书。其他选项会阻碍人们投票、表达意见或参与民主。	pending_native_review	pending_reviewer_notes
q014	zh-Hans	2	Ch. 02 · Sweden's democratic system	Sveriges demokratiska system	Demokrati betyder folkstyre	10	Vad kallas det när lagarna gäller lika för alla och ingen får dömas utan en rättvis rättegång?	What is it called when laws apply equally to everyone and no one can be convicted without a fair trial?	法律平等适用于所有人，而且任何人未经公平审判不得被定罪，这叫什么？	a	Rättssäkerhet	The rule of law	法律确定性	a: Rättssäkerhet | b: Censur | c: Segregation | d: Monarki	a: The rule of law | b: Censorship | c: Segregation | d: Monarchy	a: 法律确定性 | b: 审查制度 | c: 隔离 | d: 君主制	Rättssäkerhet betyder att lagarna gäller för alla och att ingen får dömas utan en rättvis rättegång. Censur, segregation och monarki betyder andra saker.	The rule of law means that laws apply to everyone and that no one can be convicted without a fair trial. Censorship, segregation, and monarchy mean other things.	法律确定性表示法律适用于所有人，任何人不得在没有公平审判的情况下被定罪。审查制度、隔离和君主制是其他概念。	pending_native_review	pending_reviewer_notes
q015	zh-Hans	2	Ch. 02 · Sweden's democratic system	Sveriges demokratiska system	Hot mot demokratin	11	Hur kan ett lågt valdeltagande påverka demokratin?	How can a low voter turnout affect democracy?	低投票率会如何影响民主？	a	Människor kan få mindre möjlighet att påverka politiska beslut	People may have fewer opportunities to influence political decisions	人们影响政治决定的机会可能变少	a: Människor kan få mindre möjlighet att påverka politiska beslut | b: Alla väljare får två röster var i nästa val | c: Domstolarna tar över riksdagens uppgifter | d: Samhället blir automatiskt mer integrerat	a: People may have fewer opportunities to influence political decisions | b: All voters get two votes each in the next election | c: The courts take over the Riksdag's tasks | d: Society automatically becomes more integrated	a: 人们影响政治决定的机会可能变少 | b: 所有选民在下次选举各有两票 | c: 法院接管议会的任务 | d: 社会自动变得更融合	Ett lågt valdeltagande kan göra det svårare för människor att påverka politiska beslut i sin vardag. Det kan också öka skillnaderna mellan grupper i samhället; de andra alternativen beskriver följder som inte följer av lågt valdeltagande.	Low voter turnout can leave people with fewer opportunities to influence political decisions in everyday life. It can also widen differences between groups in society; the other options describe effects that do not follow from low voter turnout.	低投票率会使人们更难在日常生活中影响政治决定，也可能加大社会群体之间的差异。其他选项不是低投票率的结果。	pending_native_review	pending_reviewer_notes
q016	zh-Hans	3	Ch. 03 · How Sweden is governed	Så här styrs Sverige	Staten	12	Hur väljer medborgarna ledamöter till riksdagen i Sveriges parlamentariska representativa demokrati?	How do citizens choose members of the Riksdag in Sweden's parliamentary representative democracy?	在瑞典的议会代表民主中，公民如何选出国会议员？	a	Genom att rösta i allmänna val	By voting in general elections	通过普选投票	a: Genom att rösta i allmänna val | b: Domstolarna väljer alla riksdagsledamöter | c: Kungen bestämmer ensam över riksdagen | d: Myndigheter röstar fram regeringen	a: By voting in general elections | b: The courts elect all members of the Riksdag | c: The king alone decides over the Riksdag | d: Government agencies vote the government into office	a: 通过普选投票 | b: 法院选出所有国会议员 | c: 国王单独决定国会 | d: 政府机关投票选出政府	Sverige är en parlamentarisk representativ demokrati: medborgarna väljer riksdagsledamöter genom att rösta i allmänna val. Riksdagen fattar sedan beslut om lagar och statens budget, så varken domstolarna, kungen eller myndigheter väljer ledamöterna.	Sweden is a parliamentary representative democracy: citizens elect members of the Riksdag by voting in general elections. The Riksdag then decides on laws and the state budget, so the courts, the king, and government agencies do not choose its members.	瑞典是议会代表民主：公民通过普选投票选出国会议员。之后国会决定法律和国家预算，因此法院、国王或政府机关并不选出议员。 (Riksdag)	pending_native_review	pending_reviewer_notes
q017	zh-Hans	3	Ch. 03 · How Sweden is governed	Så här styrs Sverige	Staten	12	Hur många ledamöter har riksdagen?	How many members does the Riksdag have?	瑞典国会有多少名议员？	c	349	349	349	a: 21 | b: 290 | c: 349 | d: 1 600	a: 21 | b: 290 | c: 349 | d: 1,600	a: 21 | b: 290 | c: 349 | d: 1,600	Riksdagen har 349 ledamöter, och de väljs vart fjärde år. Talen 21, 290 och 1 600 anger inte antalet ledamöter i riksdagen.	The Riksdag has 349 members, and they are elected every four years. The numbers 21, 290, and 1,600 do not give the number of Riksdag members.	瑞典国会有 349 名议员，他们每四年选出一次。21、290 和 1,600 不是国会议员的人数。 (Riksdag)	pending_native_review	pending_reviewer_notes
q018	zh-Hans	3	Ch. 03 · How Sweden is governed	Så här styrs Sverige	Staten	12	Vem väljer statsministern?	Who chooses the prime minister?	谁选出首相？	a	Riksdagen	The Riksdag	国会	a: Riksdagen | b: Kungen ensam | c: Polismyndigheten | d: Regionfullmäktige	a: The Riksdag | b: The king alone | c: The Swedish Police Authority | d: The regional council	a: 国会 | b: 只有国王 | c: 瑞典警察局 | d: 地区议会	Riksdagen väljer statsministern, som får i uppdrag att bilda regering. Statsministern väljer därefter ministrarna; varken kungen, Polismyndigheten eller regionfullmäktige väljer statsminister.	The Riksdag chooses the prime minister, who is then tasked with forming a government. The prime minister chooses the ministers; neither the king, the Swedish Police Authority, nor regional councils choose the prime minister.	国会选出首相，首相随后负责组成政府。首相再选择各部长；国王、警察局或地区议会都不选首相。 (Riksdag)	pending_native_review	pending_reviewer_notes
q019	zh-Hans	4	Ch. 04 · Political elections and parties	Politiska val och partier	Val och röstning	14	Hur gammal måste man ha fyllt för att ha rösträtt?	How old must a person be to have the right to vote?	要有投票权，必须年满多少岁？	b	18 år	18 years old	18 岁	a: 16 år | b: 18 år | c: 20 år | d: 25 år	a: 16 years old | b: 18 years old | c: 20 years old | d: 25 years old	a: 16 岁 | b: 18 岁 | c: 20 岁 | d: 25 岁	Man måste ha fyllt 18 år för att ha rösträtt. Därför är 16, 20 och 25 år fel här; i riksdagsval krävs också svenskt medborgarskap.	A person must have turned 18 to have the right to vote. That is why 16, 20, and 25 are wrong here; voting in a Riksdag election also requires Swedish citizenship.	要有投票权，必须已年满 18 岁。因此 16、20 和 25 岁在这里是错的；在瑞典国会选举中还需要瑞典公民身份。	pending_native_review	pending_reviewer_notes
q020	zh-Hans	4	Ch. 04 · Political elections and parties	Politiska val och partier	Folkomröstningar	14	Vad betyder det att folkomröstningar i Sverige är rådgivande?	What does it mean that referendums in Sweden are advisory?	瑞典的公投是咨询性的，这是什么意思？	a	Politikerna behöver inte följa resultatet	Politicians do not have to follow the result	政治人物不一定必须遵循结果	a: Politikerna behöver inte följa resultatet | b: Politikerna måste alltid följa resultatet | c: Folkomröstningar får bara hållas på nationell nivå | d: De ersätter ordinarie val till riksdagen	a: Politicians do not have to follow the result | b: Politicians must always follow the result | c: Referendums may only be held nationally | d: They replace regular Riksdag elections	a: 政治人物不一定必须遵循结果 | b: 政治人物必须永远遵循结果 | c: 公投只能在全国层级举行 | d: 它们取代正常的国会选举	Folkomröstningar kan hållas om en särskild fråga nationellt, i en region eller i en kommun. De är rådgivande, så politikerna behöver inte följa resultatet.	Referendums can be held on a specific issue nationally, in a region, or in a municipality. They are advisory, so politicians do not have to follow the result.	公投可以就某个特定问题在全国、地区或市镇举行。它们是咨询性的，所以政治人物不一定必须遵循结果。	pending_native_review	pending_reviewer_notes
