id	locale	chapter_id	chapter_label	source_chapter	source_section	source_page	question_sv	question_en	question_target	correct_option_id	correct_option_sv	correct_option_en	correct_option_target	options_sv	options_en	options_target	explanation_sv	explanation_en	explanation_target	native_review_status	reviewer_notes
q125	zh-Hans	13	Ch. 13 · Traditions and holidays	Traditioner och högtider	Midsommar	46	Vad är vanligt vid midsommarfirande i Sverige?	What is common during Midsummer celebrations in Sweden?	瑞典仲夏节庆祝活动中常见的是什么？	a	Utomhusfester, blomsterkransar, dans runt midsommarstången och midsommarmat	Outdoor parties, flower wreaths, dancing around the midsummer pole, and Midsummer food	户外聚会、花环、围着仲夏柱跳舞和仲夏食物	a: Utomhusfester, blomsterkransar, dans runt midsommarstången och midsommarmat | b: Fyrverkerier vid midnatt och nyårsmiddagar | c: Demonstrationer och tal om sociala och politiska frågor | d: Adventsljus, adventskalender och julotta	a: Outdoor parties, flower wreaths, dancing around the midsummer pole, and Midsummer food | b: Fireworks at midnight and New Year dinners | c: Demonstrations and speeches about social and political issues | d: Advent candles, an Advent calendar, and Christmas morning service	a: 户外聚会、花环、围着仲夏柱跳舞和仲夏食物 | b: 午夜烟花和新年晚餐 | c: 关于社会和政治问题的示威与演讲 | d: 将临期蜡烛、将临期日历和圣诞清晨礼拜	Midsommarfirandet handlar om att välkomna sommaren och ljuset. Många firar utomhus, binder blomsterkransar och dansar runt en midsommarstång, och vanlig mat är sill, färskpotatis och jordgubbar; de andra alternativen hör till nyår, första maj eller advent och jul.	Midsummer celebrations are about welcoming summer and light. Many people celebrate outdoors, make flower wreaths, and dance around a midsummer pole, and common food includes herring, new potatoes, and strawberries; the other options belong to New Year, May Day, or Advent and Christmas.	仲夏节庆祝的是迎接夏天和光明。许多人在户外庆祝，编花环并围着仲夏柱跳舞，常见食物包括鲱鱼、新鲜土豆和草莓；其他选项属于新年、五一或将临期和圣诞节。	pending_native_review	pending_reviewer_notes
q126	zh-Hans	13	Ch. 13 · Traditions and holidays	Traditioner och högtider	Några traditionella högtider under året	45	Vilket påstående om många helgdagar i Sverige stämmer?	Which statement about many public holidays in Sweden is correct?	关于瑞典许多公共假日，哪个说法正确？	a	De kommer ur kristna traditioner och ses ofta som en del av kulturarvet	They come from Christian traditions and are often seen as part of cultural heritage	它们源自基督教传统，常被视为文化遗产的一部分	a: De kommer ur kristna traditioner och ses ofta som en del av kulturarvet | b: De skapades bara av moderna företag och reklam | c: De är alltid kopplade till politiska val | d: De innebär aldrig ledighet från arbetet	a: They come from Christian traditions and are often seen as part of cultural heritage | b: They were created only by modern companies and advertising | c: They are always connected to political elections | d: They never mean time off work	a: 它们源自基督教传统，常被视为文化遗产的一部分 | b: 它们只由现代公司和广告创造 | c: 它们总是与政治选举相连 | d: 它们从不意味着可以休假	Många av årets helgdagar, till exempel jul, påsk och pingst, kommer ur kristna traditioner. Många i Sverige ser sådana traditioner som en viktig del av svenskt kulturarv även om de inte själva är troende, och flera helgdagar ger ledigt från arbetet.	Many public holidays during the year, such as Christmas, Easter, and Pentecost, come from Christian traditions. Many people in Sweden see these traditions as an important part of Swedish cultural heritage even if they are not religious themselves, and several holidays give people time off work.	一年中许多公共假日，例如圣诞节、复活节和圣灵降临节，都源自基督教传统。瑞典许多人即使自己不是信徒，也把这些传统视为瑞典文化遗产的重要部分，并且有些假日让人们可以休假。	pending_native_review	pending_reviewer_notes
q127	zh-Hans	13	Ch. 13 · Traditions and holidays	Traditioner och högtider	Nya traditioner	47	Vilken högtid avslutar fastemånaden ramadan?	Which holiday ends the fasting month of Ramadan?	哪个节日结束斋戒月 Ramadan？	a	Id al-fitr	Eid al-Fitr	开斋节 Eid al-Fitr	a: Id al-fitr | b: Nouruz | c: Newroz | d: Alla helgons dag	a: Eid al-Fitr | b: Nouruz | c: Newroz | d: All Saints’ Day	a: 开斋节 Eid al-Fitr | b: Nouruz | c: Newroz | d: 诸圣节	Id al-fitr avslutar fastemånaden ramadan. Nouruz och Newroz är i stället persiska och kurdiska nyårstraditioner som firas vid vårdagjämningen den 21 mars, och Alla helgons dag är en annan högtid.	Eid al-Fitr ends the fasting month of Ramadan. Nouruz and Newroz are instead Persian and Kurdish New Year traditions celebrated at the spring equinox on 21 March, and All Saints’ Day is a different holiday.	开斋节结束斋戒月 Ramadan。Nouruz 和 Newroz 则是波斯和库尔德的新年传统，在 3 月 21 日春分时庆祝；诸圣节是另一个节日。	pending_native_review	pending_reviewer_notes
q128	zh-Hans	13	Ch. 13 · Traditions and holidays	Traditioner och högtider	Nya traditioner	47	När firas Nouruz och Newroz?	When are Nouruz and Newroz celebrated?	Nouruz 和 Newroz 何时庆祝？	a	Vid vårdagjämningen den 21 mars	At the spring equinox on 21 March	3 月 21 日春分时	a: Vid vårdagjämningen den 21 mars | b: På midsommarafton mellan 19 och 25 juni | c: På nyårsafton den 31 december | d: På luciadagen den 13 december	a: At the spring equinox on 21 March | b: On Midsummer Eve between 19 and 25 June | c: On New Year's Eve, 31 December | d: On Lucia Day, 13 December	a: 3 月 21 日春分时 | b: 6 月 19 日至 25 日之间的仲夏夜 | c: 12 月 31 日除夕 | d: 12 月 13 日 Lucia 日	Nouruz och Newroz är persiska och kurdiska nyårstraditioner som firas i samband med vårdagjämningen den 21 mars. De andra alternativen beskriver midsommar, nyårsafton och luciadagen, som hör till andra delar av högtidsåret.	Nouruz and Newroz are Persian and Kurdish New Year traditions celebrated around the spring equinox on 21 March. The other options describe Midsummer, New Year’s Eve, and Lucia Day, which belong to other parts of the holiday year.	Nouruz 和 Newroz 是波斯和库尔德的新年传统，在 3 月 21 日春分前后庆祝。其他选项描述的是仲夏节、除夕和 Lucia 日，属于节庆年度中的其他部分。	pending_native_review	pending_reviewer_notes
q129	zh-Hans	13	Ch. 13 · Traditions and holidays	Traditioner och högtider	Lucia	47	Vad brukar Lucia bära i ett luciatåg?	What does Lucia usually wear in a Lucia procession?	Lucia 在 Lucia 队伍中通常戴什么？	a	En ljuskrona på huvudet	A crown of lights on her head	头上的光冠	a: En ljuskrona på huvudet | b: En blomsterkrans på huvudet | c: En studentmössa på huvudet | d: En adventsstjärna i handen	a: A crown of lights on her head | b: A flower wreath on her head | c: A graduation cap on her head | d: An Advent star in her hand	a: 头上的光冠 | b: 头上的花环 | c: 头上的学生帽 | d: 手中的将临期星星	I ett luciatåg bär Lucia en ljuskrona på huvudet, medan andra deltagare bär ljus i händerna och sjunger särskilda sånger. Blomsterkransar, studentmössor och adventsstjärnor hör till andra traditioner eller sammanhang.	In a Lucia procession, Lucia wears a crown of lights on her head, while other participants carry candles and sing special songs. Flower wreaths, graduation caps, and Advent stars belong to other traditions or contexts.	在 Lucia 队伍中，Lucia 头戴光冠，其他参与者手持蜡烛并唱特别的歌曲。花环、学生帽和将临期星星属于其他传统或情境。	pending_native_review	pending_reviewer_notes
q130	zh-Hans	13	Ch. 13 · Traditions and holidays	Traditioner och högtider	Jul	47	Vad kallas gudstjänsten tidigt på morgonen den 25 december?	What is the church service early on the morning of 25 December called?	12 月 25 日清晨的教堂礼拜叫什么？	a	Julotta	Julotta, a Christmas morning service	Julotta，圣诞清晨礼拜	a: Julotta | b: Luciatåg | c: Valborgsbrasa | d: Midsommarstång	a: Julotta, a Christmas morning service | b: Lucia procession | c: Walpurgis bonfire | d: Midsummer pole	a: Julotta，圣诞清晨礼拜 | b: Lucia 队伍 | c: 瓦尔普吉斯篝火 | d: 仲夏柱	Julotta är en gudstjänst i kyrkan tidigt på morgonen den 25 december. Lucia, valborgsbrasa och midsommarstång hör till andra högtider och traditioner under året.	Julotta is a church service early on the morning of 25 December. Lucia processions, Walpurgis bonfires, and midsummer poles belong to other holidays and traditions during the year.	Julotta 是 12 月 25 日清晨在教堂举行的礼拜。Lucia 队伍、瓦尔普吉斯篝火和仲夏柱属于一年中其他节日和传统。	pending_native_review	pending_reviewer_notes
q131	zh-Hans	13	Ch. 13 · Traditions and holidays	Traditioner och högtider	Påsk	45	Vad är vanligt på påskafton i Sverige?	What is common on Easter Saturday in Sweden?	在瑞典复活节前夕通常会做什么？	a	Att äta ägg, lamm, lax och sill och att barn får godis i påskägg	Eating eggs, lamb, salmon, and herring, and children getting candy in Easter eggs	吃鸡蛋、羊肉、鲑鱼和鲱鱼，孩子们得到复活节彩蛋中的糖果	a: Att äta ägg, lamm, lax och sill och att barn får godis i påskägg | b: Att tända adventsljus och öppna adventskalendrar | c: Att tända ljus på gravar för att minnas dem som har dött | d: Att ordna demonstrationer och tal om sociala frågor	a: Eating eggs, lamb, salmon, and herring, and children getting candy in Easter eggs | b: Lighting Advent candles and opening Advent calendars | c: Lighting candles on graves to remember people who have died | d: Holding demonstrations and speeches about social issues	a: 吃鸡蛋、羊肉、鲑鱼和鲱鱼，孩子们得到复活节彩蛋中的糖果 | b: 点将临期蜡烛并打开将临期日历 | c: 在坟墓上点蜡烛，纪念逝者 | d: 组织关于社会问题的示威和演讲	På påskafton är det vanligt att äta ägg, lamm, lax och sill, och barn får ofta godis i påskägg. Adventsljus, gravljus och demonstrationer hör i stället till advent, Alla helgons dag och första maj.	On Easter Saturday, it is common to eat eggs, lamb, salmon, and herring, and children often receive candy in Easter eggs. Advent candles, grave candles, and demonstrations instead belong to Advent, All Saints’ Day, and May Day.	复活节前夕通常会吃鸡蛋、羊肉、鲑鱼和鲱鱼，孩子们也常收到装在复活节彩蛋中的糖果。将临期蜡烛、墓地蜡烛和示威分别属于将临期、诸圣节和五一。	pending_native_review	pending_reviewer_notes
q132	zh-Hans	13	Ch. 13 · Traditions and holidays	Traditioner och högtider	Advent	47	Vad gör barn ofta med en adventskalender hemma?	What do children often do with an Advent calendar at home?	孩子们在家里通常如何使用将临期日历？	a	Öppnar en lucka varje dag fram till julafton	Open one door each day until Christmas Eve	每天打开一个小门，直到平安夜	a: Öppnar en lucka varje dag fram till julafton | b: Tänder stora brasor på kvällen | c: Bär ljuskrona i ett luciatåg | d: Går till julotta tidigt på morgonen	a: Open one door each day until Christmas Eve | b: Light large bonfires in the evening | c: Wear a crown of lights in a Lucia procession | d: Go to julotta early in the morning	a: 每天打开一个小门，直到平安夜 | b: 晚上点大型篝火 | c: 在 Lucia 队伍中戴光冠 | d: 清晨去参加 Julotta	Under advent har många en adventskalender hemma, och barn öppnar en lucka varje dag fram till julafton. Brasor, ljuskrona i luciatåg och julotta hör till valborg, lucia och jul, inte adventskalendern.	During Advent, many people have an Advent calendar at home, and children open one door each day until Christmas Eve. Bonfires, a crown of lights in a Lucia procession, and julotta belong to Walpurgis Night, Lucia, and Christmas, not the Advent calendar.	将临期期间，许多人家里有将临期日历，孩子们每天打开一个小门，直到平安夜。篝火、Lucia 队伍中的光冠和 Julotta 分别属于瓦尔普吉斯、Lucia 和圣诞节，而不是将临期日历。	pending_native_review	pending_reviewer_notes
q133	zh-Hans	13	Ch. 13 · Traditions and holidays	Traditioner och högtider	Sveriges nationaldag	46	Vilket år blev Sveriges nationaldag en helgdag genom riksdagsbeslut?	In which year did Sweden’s National Day become a public holiday through a Riksdag decision?	瑞典国庆日是哪一年经议会决定成为公共假日的？	a	2005	2005	2005 年	a: 2005 | b: 1523 | c: 1809 | d: 1995	a: 2005 | b: 1523 | c: 1809 | d: 1995	a: 2005 年 | b: 1523 年 | c: 1809 年 | d: 1995 年	Sveriges nationaldag den 6 juni gjordes till helgdag genom ett riksdagsbeslut 2005. Åren 1523 och 1809 nämns som historiska skäl till datumet, medan 1995 hör till Sveriges EU-medlemskap.	Sweden’s National Day on 6 June became a public holiday through a Riksdag decision in 2005. The years 1523 and 1809 are mentioned as historical reasons for the date, while 1995 belongs to Sweden’s EU membership.	6 月 6 日的瑞典国庆日经议会决定于 2005 年成为公共假日。1523 年和 1809 年被提到作为这个日期的历史原因，而 1995 年属于瑞典加入欧盟。	pending_native_review	pending_reviewer_notes
q134	zh-Hans	13	Ch. 13 · Traditions and holidays	Traditioner och högtider	Alla helgons dag	46	När firas Alla helgons dag i Sverige?	When is All Saints’ Day observed in Sweden?	瑞典何时庆祝诸圣节？	a	På en lördag i slutet av oktober eller början av november	On a Saturday at the end of October or the beginning of November	在 10 月底或 11 月初的一个星期六	a: På en lördag i slutet av oktober eller början av november | b: På en fredag mellan 19 och 25 juni | c: På den 30 april varje år | d: På de fyra söndagarna före juldagen	a: On a Saturday at the end of October or the beginning of November | b: On a Friday between 19 and 25 June | c: On 30 April every year | d: On the four Sundays before Christmas Day	a: 在 10 月底或 11 月初的一个星期六 | b: 在 6 月 19 日至 25 日之间的一个星期五 | c: 每年 4 月 30 日 | d: 在圣诞节前的四个星期日	Alla helgons dag firas på en lördag i slutet av oktober eller i början av november. Midsommarafton, valborgsmässoafton och advent har andra tidpunkter under året, därför är de alternativen fel.	All Saints’ Day is observed on a Saturday at the end of October or at the beginning of November. Midsummer Eve, Walpurgis Night, and Advent occur at other times of the year, so those options are incorrect.	诸圣节在 10 月底或 11 月初的一个星期六庆祝。仲夏夜、瓦尔普吉斯夜和将临期在一年中的其他时间，因此那些选项不正确。	pending_native_review	pending_reviewer_notes
q135	zh-Hans	13	Ch. 13 · Traditions and holidays	Traditioner och högtider	Advent	47	Vad är vanligt i många hem under advent?	What is common in many homes during Advent?	将临期期间许多家庭中常见的是什么？	a	En adventsstjärna i fönstret och en adventsljusstake med fyra ljus	An Advent star in the window and an Advent candleholder with four candles	窗户里的将临期星星和有四支蜡烛的将临期烛台	a: En adventsstjärna i fönstret och en adventsljusstake med fyra ljus | b: En midsommarstång i vardagsrummet och sill på bordet | c: Fyrverkerier varje söndag fram till julafton | d: Demonstrationer med tal om sociala och politiska frågor	a: An Advent star in the window and an Advent candleholder with four candles | b: A midsummer pole in the living room and herring on the table | c: Fireworks every Sunday until Christmas Eve | d: Demonstrations with speeches about social and political issues	a: 窗户里的将临期星星和有四支蜡烛的将临期烛台 | b: 客厅里的仲夏柱和桌上的鲱鱼 | c: 每个星期日直到平安夜都有烟花 | d: 有关社会和政治问题演讲的示威	Under advent har många en lysande adventsstjärna i fönstret och en adventsljusstake med fyra ljus på bordet. Ett ljus tänds varje söndag fram till jul, medan midsommarstång, fyrverkerier och demonstrationer hör till andra högtider.	During Advent, many homes have a lit Advent star in the window and an Advent candleholder with four candles on the table. One candle is lit each Sunday until Christmas, while midsummer poles, fireworks, and demonstrations belong to other holidays.	将临期期间，许多家庭会在窗户放发亮的将临期星星，桌上放有四支蜡烛的将临期烛台。每个星期日点一支蜡烛直到圣诞节，而仲夏柱、烟花和示威属于其他节日。	pending_native_review	pending_reviewer_notes
q136	zh-Hans	13	Ch. 13 · Traditions and holidays	Traditioner och högtider	Alla helgons dag	46	Vad gör många på Alla helgons dag i Sverige?	What do many people do on All Saints’ Day in Sweden?	瑞典许多人在诸圣节做什么？	a	Går till kyrkogården och tänder ljus på gravar	Go to cemeteries and light candles on graves	去墓地并在坟墓上点蜡烛	a: Går till kyrkogården och tänder ljus på gravar | b: Dansar runt midsommarstången och binder blomsterkransar | c: Tänder stora brasor för att välkomna våren | d: Öppnar en lucka i adventskalendern varje dag	a: Go to cemeteries and light candles on graves | b: Dance around a midsummer pole and make flower wreaths | c: Light large bonfires to welcome spring | d: Open one Advent calendar door each day	a: 去墓地并在坟墓上点蜡烛 | b: 围着仲夏柱跳舞并编花环 | c: 点大型篝火来迎接春天 | d: 每天打开将临期日历的一个小门	På Alla helgons dag går många till kyrkogården och tänder ljus på släktingars och vänners gravar för att minnas och hedra dem som har dött. Dans runt midsommarstången, brasor och adventskalendrar hör till midsommar, valborg och advent.	On All Saints’ Day, many people go to cemeteries and light candles on relatives’ and friends’ graves to remember and honor those who have died. Dancing around a midsummer pole, bonfires, and Advent calendars belong to Midsummer, Walpurgis Night, and Advent.	在诸圣节，许多人去墓地，在亲友的坟墓上点蜡烛，以纪念和尊重逝者。围着仲夏柱跳舞、篝火和将临期日历分别属于仲夏节、瓦尔普吉斯和将临期。	pending_native_review	pending_reviewer_notes
q137	zh-Hans	13	Ch. 13 · Traditions and holidays	Traditioner och högtider	Nya traditioner	47	Vad kan hända med traditioner när människor flyttar till andra länder?	What can happen to traditions when people move to other countries?	当人们移居到其他国家时，传统可能会发生什么？	a	De kan tas med och anpassas till nya platser och människor	They can be brought along and adapted to new places and people	它们可以被带去，并适应新的地方和人群	a: De kan tas med och anpassas till nya platser och människor | b: De måste alltid försvinna helt | c: De blir automatiskt svenska lagar | d: De får bara firas på Sveriges nationaldag	a: They can be brought along and adapted to new places and people | b: They must always disappear completely | c: They automatically become Swedish laws | d: They may only be celebrated on Sweden's National Day	a: 它们可以被带去，并适应新的地方和人群 | b: 它们总是必须完全消失 | c: 它们会自动成为瑞典法律 | d: 它们只能在瑞典国庆日庆祝	När människor flyttar till andra länder kan de ta med sig traditioner och anpassa dem till de platser och människor de möter. Id al-fitr, Nouruz och Newroz är exempel på traditioner som har kommit till Sverige med invandrare; därför är alternativen om att traditioner måste försvinna, bli lagar eller bara firas på nationaldagen fel.	When people move to other countries, they can bring traditions with them and adapt them to the places and people they meet. Eid al-Fitr, Nouruz, and Newroz are examples of traditions that have come to Sweden with immigrants, so the options saying traditions must disappear, become laws, or only be celebrated on National Day are incorrect.	当人们移居到其他国家时，他们可以带着传统，并使其适应遇到的新地方和人群。开斋节、Nouruz 和 Newroz 是随移民来到瑞典的传统例子；因此传统必须消失、成为法律或只能在国庆日庆祝的说法都不正确。	pending_native_review	pending_reviewer_notes
q138	zh-Hans	13	Ch. 13 · Traditions and holidays	Traditioner och högtider	Jul	47	Vad gör många med en julgran vid jul i Sverige?	What do many people do with a Christmas tree at Christmas in Sweden?	瑞典许多人在圣诞节会怎样处理一棵树？	a	Tar in en julgran i hemmet och dekorerar den med ljusslingor, kulor och glitter	Bring a Christmas tree into the home and decorate it with strings of lights, baubles, and tinsel	把一棵枞树带进家里，并用灯串、彩球和金银丝装饰	a: Tar in en julgran i hemmet och dekorerar den med ljusslingor, kulor och glitter | b: Planterar en julgran på kyrkogården och tänder gravljus | c: Dansar runt en julgran utomhus för att välkomna sommaren | d: Tänder en julgran som vårbrasa på valborgsmässoafton	a: Bring a Christmas tree into the home and decorate it with strings of lights, baubles, and tinsel | b: Plant a Christmas tree at the cemetery and light grave candles | c: Dance around a Christmas tree outdoors to welcome summer | d: Light a Christmas tree as a spring bonfire on Walpurgis Night	a: 把一棵枞树带进家里，并用灯串、彩球和金银丝装饰 | b: 在墓地种一棵树并点墓地蜡烛 | c: 在户外围着一棵树跳舞来迎接夏天 | d: 在瓦尔普吉斯夜把一棵树点燃作为春天篝火	Vid jul tar många in en julgran i hemmet och dekorerar den med ljusslingor, kulor och glitter. Julgranen hör till julfirandet, medan gravljus, midsommardans och valborgsbrasor hör till andra högtider.	At Christmas, many people bring a Christmas tree into the home and decorate it with strings of lights, baubles, and tinsel. The Christmas tree belongs to Christmas celebrations, while grave candles, Midsummer dancing, and Walpurgis bonfires belong to other holidays.	圣诞节时，许多人把一棵枞树带进家里，并用灯串、彩球和金银丝装饰。圣诞树属于圣诞庆祝，而墓地蜡烛、仲夏舞和瓦尔普吉斯篝火属于其他节日。	pending_native_review	pending_reviewer_notes
q139	zh-Hans	13	Ch. 13 · Traditions and holidays	Traditioner och högtider	Jul	47	Vad firar julen traditionellt inom kristendomen?	What does Christmas traditionally celebrate in Christianity?	圣诞节在基督教传统中庆祝什么？	a	Jesu födelse	Jesus' birth	耶稣的诞生	a: Jesu födelse | b: Vårens ankomst | c: Arbetarnas dag | d: Det nya årets ankomst	a: Jesus' birth | b: The arrival of spring | c: Workers' Day | d: The arrival of the new year	a: 耶稣的诞生 | b: 春天的到来 | c: 劳动节 | d: 新年的到来	Julen är traditionellt en kristen högtid för att fira Jesu födelse. I Sverige är julen också en stor familjehögtid, medan vårens ankomst, arbetarnas dag och det nya årets ankomst hör till valborg, första maj och nyår.	Christmas is traditionally a Christian holiday celebrating Jesus' birth. In Sweden, Christmas is also a major family holiday, while the arrival of spring, Workers' Day, and the arrival of the new year belong to Walpurgis Night, May Day, and New Year.	圣诞节传统上是庆祝耶稣诞生的基督教节日。在瑞典，圣诞节也是重要的家庭节日；春天的到来、劳动节和新年的到来分别属于瓦尔普吉斯、五一和新年。	pending_native_review	pending_reviewer_notes
