id	locale	chapter_id	chapter_label	source_chapter	source_section	source_page	question_sv	question_en	question_target	correct_option_id	correct_option_sv	correct_option_en	correct_option_target	options_sv	options_en	options_target	explanation_sv	explanation_en	explanation_target	native_review_status	reviewer_notes
q096	zh-Hant	12	Ch. 12 · A secular state and a multi-religious country	En sekulär stat och ett mångreligiöst land	Islam	44	Vilken religion beskrivs som den näst största i Sverige?	Which religion is described as the second largest in Sweden?	哪個宗教被描述為瑞典第二大宗教？	b	Islam	Islam	伊斯蘭教	a: Judendom | b: Islam | c: Hinduism | d: Buddhism	a: Judaism | b: Islam | c: Hinduism | d: Buddhism	a: 猶太教 | b: 伊斯蘭教 | c: 印度教 | d: 佛教	Islam är numera den näst största religionen i Sverige, och det finns moskéer och bönelokaler över hela landet. Antalet muslimer ökade genom invandring efter andra världskriget, därför är Islam rätt svar.	Islam is now the second-largest religion in Sweden, and there are mosques and prayer rooms throughout the country. The number of Muslims increased through immigration after the Second World War, so Islam is the correct answer.	伊斯蘭教現在是瑞典第二大宗教，全國各地都有清真寺和禮拜場所。第二次世界大戰後，穆斯林人數因移民而增加，因此伊斯蘭教是正確答案。	pending_native_review	pending_reviewer_notes
q097	zh-Hant	13	Ch. 13 · Traditions and holidays	Traditioner och högtider	Nyår	45	Vad är vanligt att göra på nyårsafton den 31 december i Sverige?	How is New Year’s Eve on 31 December commonly celebrated in Sweden?	在瑞典，12 月 31 日除夕通常如何慶祝？	a	Fira med fester och middagar och på natten med fyrverkerier	Celebrate with parties and dinners and at night with fireworks	以派對和晚餐慶祝，夜晚放煙火	a: Fira med fester och middagar och på natten med fyrverkerier | b: Stora brasor och vårsånger | c: Demonstrationer på arbetarnas dag | d: Ceremonier för nya medborgare	a: Celebrate with parties and dinners and at night with fireworks | b: Large bonfires and spring songs | c: May Day demonstrations | d: Ceremonies for new citizens	a: 以派對和晚餐慶祝，夜晚放煙火 | b: 大型篝火和春天歌曲 | c: 在勞工節遊行示威 | d: 新公民儀式	Nyårsafton den 31 december firas ofta med fester och middagar med vänner och familj. Det nya årets ankomst firas på natten med fyrverkerier, därför är alternativet om fester, middagar och fyrverkerier rätt.	New Year’s Eve on 31 December is often celebrated with parties and dinners with friends and family. The arrival of the new year is celebrated at night with fireworks, so the option about parties, dinners, and fireworks is correct.	12 月 31 日除夕常與朋友和家人一起以派對和晚餐慶祝。新年的到來在夜晚以煙火慶祝，因此關於派對、晚餐和煙火的選項是正確的。	pending_native_review	pending_reviewer_notes
q098	zh-Hant	13	Ch. 13 · Traditions and holidays	Traditioner och högtider	Sveriges nationaldag	46	Vad brukar hända på Sveriges nationaldag den 6 juni?	What usually happens on Sweden’s National Day, 6 June?	瑞典 6 月 6 日國慶日通常會發生什麼？	a	Flaggan hissas, tal hålls och många kommuner välkomnar nya medborgare	Flags are raised, speeches are held, and many municipalities welcome new citizens	升旗、演講，許多市鎮歡迎新公民	a: Flaggan hissas, tal hålls och många kommuner välkomnar nya medborgare | b: Arbetarrörelsen arrangerar demonstrationer | c: Det nya året firas på natten med fyrverkerier | d: Luciafirandet sprider ljus när året är som mörkast	a: Flags are raised, speeches are held, and many municipalities welcome new citizens | b: The labour movement arranges demonstrations | c: The new year is celebrated at night with fireworks | d: The Lucia celebration spreads light at the darkest time of year	a: 升旗、演講，許多市鎮歡迎新公民 | b: 勞工運動安排示威 | c: 夜晚以煙火慶祝新年 | d: 露西亞慶典在一年最黑暗時傳播光明	Den 6 juni är Sveriges nationaldag, och dagen blev helgdag genom ett riksdagsbeslut 2005. På nationaldagen hissas flaggan, tal hålls och många kommuner ordnar ceremonier för att välkomna nya medborgare.	6 June is Sweden’s National Day, and it became a public holiday through a Riksdag decision in 2005. On National Day, flags are raised, speeches are held, and many municipalities arrange ceremonies to welcome new citizens.	6 月 6 日是瑞典國慶日，並透過 2005 年國會決議成為公共假日。在國慶日會升旗、舉行演講，許多市鎮也安排儀式歡迎新公民。	pending_native_review	pending_reviewer_notes
q099	zh-Hant	13	Ch. 13 · Traditions and holidays	Traditioner och högtider	Midsommar	46	När firas midsommarafton i Sverige?	When is Midsummer Eve celebrated in Sweden?	瑞典何時慶祝仲夏夜？	a	På en fredag mellan 19 och 25 juni	On a Friday between 19 and 25 June	6 月 19 日至 25 日之間的一個星期五	a: På en fredag mellan 19 och 25 juni | b: På nyårsafton den 31 december | c: På Valborgsmässoafton den 30 april | d: På Luciadagen den 13 december	a: On a Friday between 19 and 25 June | b: On New Year’s Eve, 31 December | c: On Walpurgis Night, 30 April | d: On Lucia Day, 13 December	a: 6 月 19 日至 25 日之間的一個星期五 | b: 12 月 31 日除夕 | c: 4 月 30 日瓦爾普吉斯之夜 | d: 12 月 13 日露西亞日	Midsommarafton firas alltid på en fredag mellan 19 juni och 25 juni. Firandet välkomnar sommaren och ljuset och har äldre rötter från tiden före kristendomen, med utomhusfester, blomsterkransar, dans och lek runt midsommarstången samt mat som sill, färskpotatis och jordgubbar.	Midsummer Eve is always celebrated on a Friday between 19 and 25 June. The celebration welcomes summer and light and has older roots from before Christianity, with outdoor parties, flower wreaths, dancing and playing around a midsummer pole, and food such as herring, new potatoes, and strawberries.	仲夏夜總是在 6 月 19 日至 25 日之間的一個星期五慶祝。這個節日迎接夏天和光明，並有基督教以前的古老根源，包含戶外聚會、花環、圍繞仲夏柱唱跳遊戲，以及鯡魚、新鮮馬鈴薯和草莓等食物。	pending_native_review	pending_reviewer_notes
q100	zh-Hant	13	Ch. 13 · Traditions and holidays	Traditioner och högtider	Lucia	47	Vad handlar luciafirandet mycket om i Sverige?	What is the Lucia celebration largely about in Sweden?	在瑞典，露西亞慶典主要關於什麼？	a	Att sprida ljus när året är som mörkast	Spreading light when the year is at its darkest	在一年最黑暗時傳播光明	a: Att sprida ljus när året är som mörkast | b: Att välkomna våren med stora brasor | c: Att fira nationaldagen med tal | d: Att ordna demonstrationer på arbetarnas dag	a: Spreading light when the year is at its darkest | b: Welcoming spring with large bonfires | c: Celebrating National Day with speeches | d: Holding May Day demonstrations	a: 在一年最黑暗時傳播光明 | b: 以大型篝火迎接春天 | c: 以演講慶祝國慶日 | d: 在勞工節舉行示威	Luciafirandet handlar mycket om att sprida ljus när det är som mörkast på året. Firandet hör till den 13 december och kan innehålla luciatåg där en person är Lucia, bär ljuskrona och sjunger särskilda sånger tillsammans med andra deltagare.	The Lucia celebration is largely about spreading light when the year is at its darkest. The celebration is linked to 13 December and can include Lucia processions where one person is Lucia, wears a crown of lights, and sings special songs with other participants.	露西亞慶典主要是在一年最黑暗時傳播光明。這個慶典與 12 月 13 日有關，可以包括露西亞隊伍，其中一人扮演露西亞、戴著光冠，並與其他參與者一起唱特別的歌曲。	pending_native_review	pending_reviewer_notes
q101	zh-Hant	13	Ch. 13 · Traditions and holidays	Traditioner och högtider	Påsk	45	Vilken högtid firas någon gång i mars eller april och hör ihop med långfredagen och påskdagen?	Which holiday is celebrated sometime in March or April and is connected with Good Friday and Easter Sunday?	哪個節日在三月或四月的某個時間慶祝，並與耶穌受難日和復活節主日相關？	a	Påsk	Easter	復活節	a: Påsk | b: Advent | c: Första maj | d: Alla helgons dag	a: Easter | b: Advent | c: May Day | d: All Saints’ Day	a: 復活節 | b: 將臨期 | c: 五一節 | d: 諸聖日	Påsk firas någon gång i mars eller april och hör ihop med långfredagen och påskdagen. Långfredagen uppmärksammar Jesu död och påskdagen hans uppståndelse, medan advent, första maj och Alla helgons dag hör till andra delar av året.	Easter is celebrated sometime in March or April and is connected with Good Friday and Easter Sunday. Good Friday commemorates Jesus' death, and Easter Sunday celebrates his resurrection, while Advent, May Day, and All Saints' Day belong to other parts of the year.	復活節在三月或四月的某個時間慶祝，並與耶穌受難日和復活節主日相關。耶穌受難日紀念耶穌的死亡，復活節主日紀念他的復活；將臨期、五一節和諸聖日屬於一年中的其他時期。	pending_native_review	pending_reviewer_notes
q102	zh-Hant	13	Ch. 13 · Traditions and holidays	Traditioner och högtider	Valborgsmässoafton	46	Vad är typiskt för valborgsmässoafton den 30 april i Sverige?	What is typical of Walpurgis Night, 30 April, in Sweden?	瑞典 4 月 30 日瓦爾普吉斯之夜的典型活動是什麼？	a	Brasor, vårsånger och ibland ett tal till våren	Bonfires, spring songs, and sometimes a speech welcoming spring	篝火、春天歌曲，有時有迎春演講	a: Brasor, vårsånger och ibland ett tal till våren | b: Fyrverkerier vid midnatt för att fira det nya året | c: Demonstrationer och tal om sociala och politiska frågor | d: Luciatåg med ljuskrona och särskilda sånger	a: Bonfires, spring songs, and sometimes a speech welcoming spring | b: Fireworks at midnight to celebrate the new year | c: Demonstrations and speeches about social and political issues | d: Lucia processions with a crown of lights and special songs	a: 篝火、春天歌曲，有時有迎春演講 | b: 午夜煙火慶祝新年 | c: 關於社會和政治問題的示威和演講 | d: 露西亞隊伍、光冠和特殊歌曲	På valborgsmässoafton den 30 april välkomnar många våren med stora brasor på kvällen. Vid brasan sjungs ofta traditionella vårsånger, och ibland håller någon ett tal till våren; fyrverkerier, första maj-demonstrationer och luciatåg hör till andra högtider.	On Walpurgis Night, 30 April, many people welcome spring with large evening bonfires. Traditional spring songs are often sung by the bonfire, and sometimes someone gives a speech welcoming spring; fireworks, May Day demonstrations, and Lucia processions belong to other holidays.	在 4 月 30 日瓦爾普吉斯之夜，許多人晚上用大型篝火迎接春天。篝火旁常唱傳統春天歌曲，有時也有人發表迎春演講；煙火、五一示威和露西亞隊伍屬於其他節日。	pending_native_review	pending_reviewer_notes
q103	zh-Hant	13	Ch. 13 · Traditions and holidays	Traditioner och högtider	Första maj	46	Vad uppmärksammas på första maj i Sverige?	What is marked on May Day in Sweden?	瑞典五一節紀念什麼？	a	Arbetarnas dag med demonstrationer och tal	International Workers' Day with demonstrations and speeches	勞工節，有示威和演講	a: Arbetarnas dag med demonstrationer och tal | b: Det nya året med fester och fyrverkerier | c: Våren med brasor och vårsånger | d: Lucia med ljuskrona och lussebullar	a: International Workers' Day with demonstrations and speeches | b: The new year with parties and fireworks | c: Spring with bonfires and spring songs | d: Lucia with a crown of lights and saffron buns	a: 勞工節，有示威和演講 | b: 以派對和煙火慶祝新年 | c: 以篝火和春天歌曲迎接春天 | d: 露西亞、光冠和藏紅花麵包	Första maj är arbetarnas dag internationellt och är en helgdag i Sverige. Dagen uppmärksammas av arbetarrörelsen med demonstrationer runt om i landet, och personer från fackförbund, politiska partier och andra grupper håller tal om sociala och politiska frågor.	May Day is International Workers’ Day and a public holiday in Sweden. The labour movement marks the day with demonstrations around the country, and people from trade unions, political parties, and other groups give speeches about social and political issues.	五一節是國際勞工節，也是瑞典的公共假日。勞工運動在全國各地以示威紀念這一天，工會、政黨和其他團體的人會就社會和政治問題發表演講。	pending_native_review	pending_reviewer_notes
q104	zh-Hant	13	Ch. 13 · Traditions and holidays	Traditioner och högtider	Alla helgons dag	46	Vad är vanligt att göra på Alla helgons dag i Sverige?	How is All Saints’ Day commonly observed in Sweden?	瑞典諸聖日通常會做什麼？	a	Tända ljus på gravar för att minnas och hedra dem som har dött	Light candles on graves to remember and honour people who have died	在墓上點蠟燭，紀念並尊敬逝者	a: Tända ljus på gravar för att minnas och hedra dem som har dött | b: Öppna en adventskalender varje dag fram till julafton | c: Fira det nya året på natten med fyrverkerier | d: Välkomna våren med stora brasor	a: Light candles on graves to remember and honour people who have died | b: Open an Advent calendar every day until Christmas Eve | c: Celebrate the new year at night with fireworks | d: Welcome spring with large bonfires	a: 在墓上點蠟燭，紀念並尊敬逝者 | b: 每天打開降臨節日曆直到平安夜 | c: 夜晚以煙火慶祝新年 | d: 以大型篝火迎接春天	Alla helgons dag är en kristen helgdag då många går till kyrkogården och tänder ljus på släktingars och vänners gravar. Ljusen används för att minnas och hedra dem som har dött; adventskalender, nyårsfyrverkerier och valborgsbrasor hör till andra högtider.	All Saints’ Day is a Christian holiday when many people go to the cemetery and light candles on relatives’ and friends’ graves. The candles are used to remember and honour people who have died; Advent calendars, New Year fireworks, and Walpurgis bonfires belong to other holidays.	諸聖日是一個基督教節日，許多人會去墓園，在親戚和朋友的墓上點蠟燭。蠟燭用來紀念和尊敬逝者；降臨節日曆、新年煙火和瓦爾普吉斯篝火屬於其他節日。	pending_native_review	pending_reviewer_notes
q105	zh-Hant	13	Ch. 13 · Traditions and holidays	Traditioner och högtider	Advent	47	När infaller advent i Sverige?	When does Advent occur in Sweden?	瑞典的將臨期在什麼時候？	a	De fyra söndagarna före juldagen den 25 december	The four Sundays before Christmas Day, 25 December	12 月 25 日聖誕節前的四個星期日	a: De fyra söndagarna före juldagen den 25 december | b: En lördag i slutet av oktober eller början av november | c: På valborgsmässoafton den 30 april | d: På luciadagen den 13 december	a: The four Sundays before Christmas Day, 25 December | b: A Saturday at the end of October or beginning of November | c: On Walpurgis Night, 30 April | d: On Lucia Day, 13 December	a: 12 月 25 日聖誕節前的四個星期日 | b: 十月底或十一月初的一個星期六 | c: 4 月 30 日瓦爾普吉斯之夜 | d: 12 月 13 日露西亞日	Advent infaller de fyra söndagarna före juldagen den 25 december och var traditionellt en förberedelseperiod inför julen. Alternativen om Alla helgons dag, valborgsmässoafton och luciadagen beskriver andra högtider.	Advent occurs on the four Sundays before Christmas Day, 25 December, and was traditionally a period of preparation for Christmas. The options about All Saints’ Day, Walpurgis Night, and Lucia Day describe other holidays.	將臨期是在 12 月 25 日聖誕節前的四個星期日，傳統上是聖誕節前的準備期。關於諸聖日、瓦爾普吉斯之夜和露西亞日的選項描述的是其他節日。	pending_native_review	pending_reviewer_notes
q106	zh-Hant	13	Ch. 13 · Traditions and holidays	Traditioner och högtider	Jul	47	Vad är vanligt att familjer gör på julafton den 24 december i Sverige?	What do families commonly do on Christmas Eve, 24 December, in Sweden?	在瑞典，家庭在 12 月 24 日平安夜通常會做什麼？	a	Att samlas, äta särskild julmat och ge varandra julklappar	To gather, eat special Christmas food, and give each other Christmas presents	聚在一起，吃特別的聖誕食物，互送聖誕禮物	a: Att samlas, äta särskild julmat och ge varandra julklappar | b: Tända stora brasor och sjunga vårsånger | c: Delta i demonstrationer om sociala och politiska frågor | d: Fira det nya året med fyrverkerier vid midnatt	a: To gather, eat special Christmas food, and give each other Christmas presents | b: Light large bonfires and sing spring songs | c: Take part in demonstrations about social and political issues | d: Celebrate the new year with fireworks at midnight	a: 聚在一起，吃特別的聖誕食物，互送聖誕禮物 | b: 點大型篝火並唱春天歌曲 | c: 參加關於社會和政治問題的示威 | d: 午夜以煙火慶祝新年	Julen är traditionellt en kristen högtid för att fira Jesu födelse och är också en stor familjehögtid i Sverige. På julafton samlas familjer ofta för att umgås, äta särskild julmat och ge julklappar; de andra alternativen hör till valborg, första maj och nyår.	Christmas is traditionally a Christian holiday celebrating the birth of Jesus, and it is also a major family holiday in Sweden. On Christmas Eve, families often gather to spend time together, eat special Christmas food, and give presents; the other options belong to Walpurgis Night, May Day, and New Year.	聖誕節傳統上是慶祝耶穌誕生的基督教節日，在瑞典也是重要的家庭節日。平安夜，家庭常聚在一起相處、吃特別的聖誕食物並送聖誕禮物；其他選項屬於瓦爾普吉斯、五一和新年。	pending_native_review	pending_reviewer_notes
q107	zh-Hant	13	Ch. 13 · Traditions and holidays	Traditioner och högtider	Nya traditioner	47	Vilka högtider är exempel på traditioner som har kommit till Sverige med invandrare?	Which holidays are examples of traditions that have come to Sweden with immigrants?	哪些節日是隨移民來到瑞典的傳統例子？	a	Id al-fitr samt Nouruz och Newroz	Eid al-Fitr and Nouruz/Newroz	開齋節以及 Nouruz 和 Newroz	a: Id al-fitr samt Nouruz och Newroz | b: Midsommar och Lucia | c: Sveriges nationaldag och första maj | d: Valborgsmässoafton och alla helgons dag	a: Eid al-Fitr and Nouruz/Newroz | b: Midsummer and Lucia | c: Sweden’s National Day and May Day | d: Walpurgis Night and All Saints’ Day	a: 開齋節以及 Nouruz 和 Newroz | b: 仲夏節和露西亞 | c: 瑞典國慶日和五一節 | d: 瓦爾普吉斯之夜和諸聖日	Människor som flyttar till andra länder kan ta med sig traditioner och anpassa dem till nya platser. Exempel är Id al-fitr, som avslutar fastemånaden ramadan, och de persiska och kurdiska nyårstraditionerna Nouruz och Newroz vid vårdagjämningen.	People who move to other countries can bring traditions with them and adapt them to new places. Examples include Eid al-Fitr, which ends the fasting month of Ramadan, and the Persian and Kurdish New Year traditions Nouruz and Newroz at the spring equinox.	搬到其他國家的人可以帶來傳統，並使它們適應新的地方。例子包括結束齋月的開齋節，以及春分時的波斯和庫德新年傳統 Nouruz 和 Newroz。	pending_native_review	pending_reviewer_notes
q108	zh-Hant	12	Ch. 12 · A secular state and a multi-religious country	En sekulär stat och ett mångreligiöst land	Hinduism och buddhism	43	Vad finns på olika platser i Sverige för buddhister och hinduer?	What exists in different places in Sweden for Buddhists and Hindus?	在瑞典不同地方，佛教徒和印度教徒有什麼？	a	Buddhistiska och hinduiska församlingar och tempel	Buddhist and Hindu congregations and temples	佛教和印度教社群及寺廟	a: Buddhistiska och hinduiska församlingar och tempel | b: Statliga myndigheter som väljer religion | c: Kommunala domstolar för religiösa frågor | d: Endast Svenska kyrkans församlingar	a: Buddhist and Hindu congregations and temples | b: Government agencies that choose religion | c: Municipal courts for religious questions | d: Only Church of Sweden congregations	a: 佛教和印度教社群及寺廟 | b: 選擇宗教的國家機關 | c: 處理宗教問題的市鎮法院 | d: 只有瑞典教會的堂區	Det finns både buddhistiska och hinduiska församlingar och tempel på olika platser i Sverige. Där genomförs böner, ritualer och religiösa fester; myndigheter, domstolar och Svenska kyrkan har inte den rollen.	There are both Buddhist and Hindu congregations and temples in different places in Sweden. Prayers, rituals, and religious festivals take place there; agencies, courts, and the Church of Sweden do not have that role.	瑞典不同地方有佛教和印度教社群及寺廟。在那裡會進行祈禱、儀式和宗教節慶；機關、法院和瑞典教會沒有這個角色。	pending_native_review	pending_reviewer_notes
q109	zh-Hant	12	Ch. 12 · A secular state and a multi-religious country	En sekulär stat och ett mångreligiöst land	Religionens roll	42	Vilket påstående om religionens roll i Sverige stämmer?	Which statement about the role of religion in Sweden is correct?	關於宗教在瑞典的角色，哪個說法正確？	a	Religionens roll har minskat, men religionsfrågor har fått större uppmärksamhet	The role of religion has decreased, but religious questions have received more attention	宗教的角色已減少，但宗教問題受到更多關注	a: Religionens roll har minskat, men religionsfrågor har fått större uppmärksamhet | b: Alla religiösa högtider har förbjudits i Sverige | c: Bara en världsreligion är representerad i Sverige | d: Svenska kyrkans medlemsantal ökar	a: The role of religion has decreased, but religious questions have received more attention | b: All religious holidays have been banned in Sweden | c: Only one world religion is represented in Sweden | d: Church of Sweden membership is increasing	a: 宗教的角色已減少，但宗教問題受到更多關注 | b: 瑞典禁止了所有宗教節日 | c: 瑞典只代表一個世界宗教 | d: 瑞典教會會員數正在增加	Kristendomen har satt många kulturella spår i Sverige, men religionens roll i samhället har minskat. Samtidigt har religion och religiösa frågor fått större uppmärksamhet, och nästan alla världens religioner finns representerade i Sverige; därför är de andra alternativen fel.	Christianity has left many cultural traces in Sweden, but the role of religion in society has decreased. At the same time, religion and religious questions have received more attention, and almost all world religions are represented in Sweden; that makes the other options incorrect.	基督教在瑞典留下了許多文化痕跡，但宗教在社會中的角色已經減少。同時，宗教和宗教問題受到更多關注，幾乎所有世界宗教在瑞典都有代表；因此其他選項不正確。	pending_native_review	pending_reviewer_notes
q110	zh-Hant	12	Ch. 12 · A secular state and a multi-religious country	En sekulär stat och ett mångreligiöst land	Judendom	43	Vilket påstående om judendomens historia i Sverige stämmer?	Which statement about Judaism's history in Sweden is correct?	關於猶太教在瑞典的歷史，哪個說法正確？	a	Judar fick fullständiga medborgerliga rättigheter i Sverige först 1870	Jews received full civil rights in Sweden only in 1870	猶太人在瑞典直到 1870 年才獲得完整公民權利	a: Judar fick fullständiga medborgerliga rättigheter i Sverige först 1870 | b: Judendom kom till Sverige först efter år 2000 | c: Det finns inga judiska församlingar eller synagogor i dagens Sverige | d: Judendom är den största religionen i Sverige	a: Jews received full civil rights in Sweden only in 1870 | b: Judaism came to Sweden only after 2000 | c: There are no Jewish congregations or synagogues in Sweden today | d: Judaism is the largest religion in Sweden	a: 猶太人在瑞典直到 1870 年才獲得完整公民權利 | b: 猶太教直到 2000 年後才來到瑞典 | c: 今天瑞典沒有猶太社群或猶太會堂 | d: 猶太教是瑞典最大的宗教	Judendomens historia i Sverige kan spåras tillbaka till 1700-talet. Judar fick fullständiga medborgerliga rättigheter i Sverige först 1870, och i dag finns flera judiska församlingar och synagogor; därför är alternativen om år 2000, inga församlingar eller största religion fel.	Judaism's history in Sweden can be traced back to the 18th century. Jews received full civil rights in Sweden only in 1870, and today there are several Jewish congregations and synagogues; therefore the options about the year 2000, no congregations, or being the largest religion are incorrect.	猶太教在瑞典的歷史可以追溯到 18 世紀。猶太人在瑞典直到 1870 年才獲得完整公民權利，今天也有多個猶太社群和猶太會堂；因此關於 2000 年、沒有社群或是最大宗教的選項都不正確。	pending_native_review	pending_reviewer_notes
