id	locale	chapter_id	chapter_label	source_chapter	source_section	source_page	question_sv	question_en	question_target	correct_option_id	correct_option_sv	correct_option_en	correct_option_target	options_sv	options_en	options_target	explanation_sv	explanation_en	explanation_target	native_review_status	reviewer_notes
q125	zh-Hant	13	Ch. 13 · Traditions and holidays	Traditioner och högtider	Midsommar	46	Vad är vanligt vid midsommarfirande i Sverige?	What is common during Midsummer celebrations in Sweden?	瑞典仲夏節慶祝活動中常見的是什麼？	a	Utomhusfester, blomsterkransar, dans runt midsommarstången och midsommarmat	Outdoor parties, flower wreaths, dancing around the midsummer pole, and Midsummer food	戶外聚會、花環、圍著仲夏柱跳舞和仲夏食物	a: Utomhusfester, blomsterkransar, dans runt midsommarstången och midsommarmat | b: Fyrverkerier vid midnatt och nyårsmiddagar | c: Demonstrationer och tal om sociala och politiska frågor | d: Adventsljus, adventskalender och julotta	a: Outdoor parties, flower wreaths, dancing around the midsummer pole, and Midsummer food | b: Fireworks at midnight and New Year dinners | c: Demonstrations and speeches about social and political issues | d: Advent candles, an Advent calendar, and Christmas morning service	a: 戶外聚會、花環、圍著仲夏柱跳舞和仲夏食物 | b: 午夜煙火和新年晚餐 | c: 關於社會和政治問題的示威與演講 | d: 將臨期蠟燭、將臨期日曆和聖誕清晨禮拜	Midsommarfirandet handlar om att välkomna sommaren och ljuset. Många firar utomhus, binder blomsterkransar och dansar runt en midsommarstång, och vanlig mat är sill, färskpotatis och jordgubbar; de andra alternativen hör till nyår, första maj eller advent och jul.	Midsummer celebrations are about welcoming summer and light. Many people celebrate outdoors, make flower wreaths, and dance around a midsummer pole, and common food includes herring, new potatoes, and strawberries; the other options belong to New Year, May Day, or Advent and Christmas.	仲夏節慶祝的是迎接夏天和光明。許多人在戶外慶祝，編花環並圍著仲夏柱跳舞，常見食物包括鯡魚、新鮮馬鈴薯和草莓；其他選項屬於新年、五一或將臨期和聖誕節。	pending_native_review	pending_reviewer_notes
q126	zh-Hant	13	Ch. 13 · Traditions and holidays	Traditioner och högtider	Några traditionella högtider under året	45	Vilket påstående om många helgdagar i Sverige stämmer?	Which statement about many public holidays in Sweden is correct?	關於瑞典許多公共假日，哪個說法正確？	a	De kommer ur kristna traditioner och ses ofta som en del av kulturarvet	They come from Christian traditions and are often seen as part of cultural heritage	它們源自基督教傳統，常被視為文化遺產的一部分	a: De kommer ur kristna traditioner och ses ofta som en del av kulturarvet | b: De skapades bara av moderna företag och reklam | c: De är alltid kopplade till politiska val | d: De innebär aldrig ledighet från arbetet	a: They come from Christian traditions and are often seen as part of cultural heritage | b: They were created only by modern companies and advertising | c: They are always connected to political elections | d: They never mean time off work	a: 它們源自基督教傳統，常被視為文化遺產的一部分 | b: 它們只由現代公司和廣告創造 | c: 它們總是與政治選舉相連 | d: 它們從不意味著可以休假	Många av årets helgdagar, till exempel jul, påsk och pingst, kommer ur kristna traditioner. Många i Sverige ser sådana traditioner som en viktig del av svenskt kulturarv även om de inte själva är troende, och flera helgdagar ger ledigt från arbetet.	Many public holidays during the year, such as Christmas, Easter, and Pentecost, come from Christian traditions. Many people in Sweden see these traditions as an important part of Swedish cultural heritage even if they are not religious themselves, and several holidays give people time off work.	一年中許多公共假日，例如聖誕節、復活節和聖靈降臨節，都源自基督教傳統。瑞典許多人即使自己不是信徒，也把這些傳統視為瑞典文化遺產的重要部分，並且有些假日讓人們可以休假。	pending_native_review	pending_reviewer_notes
q127	zh-Hant	13	Ch. 13 · Traditions and holidays	Traditioner och högtider	Nya traditioner	47	Vilken högtid avslutar fastemånaden ramadan?	Which holiday ends the fasting month of Ramadan?	哪個節日結束齋戒月 Ramadan？	a	Id al-fitr	Eid al-Fitr	開齋節 Eid al-Fitr	a: Id al-fitr | b: Nouruz | c: Newroz | d: Alla helgons dag	a: Eid al-Fitr | b: Nouruz | c: Newroz | d: All Saints’ Day	a: 開齋節 Eid al-Fitr | b: Nouruz | c: Newroz | d: 諸聖節	Id al-fitr avslutar fastemånaden ramadan. Nouruz och Newroz är i stället persiska och kurdiska nyårstraditioner som firas vid vårdagjämningen den 21 mars, och Alla helgons dag är en annan högtid.	Eid al-Fitr ends the fasting month of Ramadan. Nouruz and Newroz are instead Persian and Kurdish New Year traditions celebrated at the spring equinox on 21 March, and All Saints’ Day is a different holiday.	開齋節結束齋戒月 Ramadan。Nouruz 和 Newroz 則是波斯和庫爾德的新年傳統，在 3 月 21 日春分時慶祝；諸聖節是另一個節日。	pending_native_review	pending_reviewer_notes
q128	zh-Hant	13	Ch. 13 · Traditions and holidays	Traditioner och högtider	Nya traditioner	47	När firas Nouruz och Newroz?	When are Nouruz and Newroz celebrated?	Nouruz 和 Newroz 何時慶祝？	a	Vid vårdagjämningen den 21 mars	At the spring equinox on 21 March	3 月 21 日春分時	a: Vid vårdagjämningen den 21 mars | b: På midsommarafton mellan 19 och 25 juni | c: På nyårsafton den 31 december | d: På luciadagen den 13 december	a: At the spring equinox on 21 March | b: On Midsummer Eve between 19 and 25 June | c: On New Year's Eve, 31 December | d: On Lucia Day, 13 December	a: 3 月 21 日春分時 | b: 6 月 19 日至 25 日之間的仲夏夜 | c: 12 月 31 日除夕 | d: 12 月 13 日 Lucia 日	Nouruz och Newroz är persiska och kurdiska nyårstraditioner som firas i samband med vårdagjämningen den 21 mars. De andra alternativen beskriver midsommar, nyårsafton och luciadagen, som hör till andra delar av högtidsåret.	Nouruz and Newroz are Persian and Kurdish New Year traditions celebrated around the spring equinox on 21 March. The other options describe Midsummer, New Year’s Eve, and Lucia Day, which belong to other parts of the holiday year.	Nouruz 和 Newroz 是波斯和庫爾德的新年傳統，在 3 月 21 日春分前後慶祝。其他選項描述的是仲夏節、除夕和 Lucia 日，屬於節慶年度中的其他部分。	pending_native_review	pending_reviewer_notes
q129	zh-Hant	13	Ch. 13 · Traditions and holidays	Traditioner och högtider	Lucia	47	Vad brukar Lucia bära i ett luciatåg?	What does Lucia usually wear in a Lucia procession?	Lucia 在 Lucia 隊伍中通常戴什麼？	a	En ljuskrona på huvudet	A crown of lights on her head	頭上的光冠	a: En ljuskrona på huvudet | b: En blomsterkrans på huvudet | c: En studentmössa på huvudet | d: En adventsstjärna i handen	a: A crown of lights on her head | b: A flower wreath on her head | c: A graduation cap on her head | d: An Advent star in her hand	a: 頭上的光冠 | b: 頭上的花環 | c: 頭上的學生帽 | d: 手中的將臨期星星	I ett luciatåg bär Lucia en ljuskrona på huvudet, medan andra deltagare bär ljus i händerna och sjunger särskilda sånger. Blomsterkransar, studentmössor och adventsstjärnor hör till andra traditioner eller sammanhang.	In a Lucia procession, Lucia wears a crown of lights on her head, while other participants carry candles and sing special songs. Flower wreaths, graduation caps, and Advent stars belong to other traditions or contexts.	在 Lucia 隊伍中，Lucia 頭戴光冠，其他參與者手持蠟燭並唱特別的歌曲。花環、學生帽和將臨期星星屬於其他傳統或情境。	pending_native_review	pending_reviewer_notes
q130	zh-Hant	13	Ch. 13 · Traditions and holidays	Traditioner och högtider	Jul	47	Vad kallas gudstjänsten tidigt på morgonen den 25 december?	What is the church service early on the morning of 25 December called?	12 月 25 日清晨的教堂禮拜叫什麼？	a	Julotta	Julotta, a Christmas morning service	Julotta，聖誕清晨禮拜	a: Julotta | b: Luciatåg | c: Valborgsbrasa | d: Midsommarstång	a: Julotta, a Christmas morning service | b: Lucia procession | c: Walpurgis bonfire | d: Midsummer pole	a: Julotta，聖誕清晨禮拜 | b: Lucia 隊伍 | c: 瓦爾普吉斯篝火 | d: 仲夏柱	Julotta är en gudstjänst i kyrkan tidigt på morgonen den 25 december. Lucia, valborgsbrasa och midsommarstång hör till andra högtider och traditioner under året.	Julotta is a church service early on the morning of 25 December. Lucia processions, Walpurgis bonfires, and midsummer poles belong to other holidays and traditions during the year.	Julotta 是 12 月 25 日清晨在教堂舉行的禮拜。Lucia 隊伍、瓦爾普吉斯篝火和仲夏柱屬於一年中其他節日和傳統。	pending_native_review	pending_reviewer_notes
q131	zh-Hant	13	Ch. 13 · Traditions and holidays	Traditioner och högtider	Påsk	45	Vad är vanligt på påskafton i Sverige?	What is common on Easter Saturday in Sweden?	在瑞典復活節前夕通常會做什麼？	a	Att äta ägg, lamm, lax och sill och att barn får godis i påskägg	Eating eggs, lamb, salmon, and herring, and children getting candy in Easter eggs	吃雞蛋、羊肉、鮭魚和鯡魚，孩子們得到復活節彩蛋中的糖果	a: Att äta ägg, lamm, lax och sill och att barn får godis i påskägg | b: Att tända adventsljus och öppna adventskalendrar | c: Att tända ljus på gravar för att minnas dem som har dött | d: Att ordna demonstrationer och tal om sociala frågor	a: Eating eggs, lamb, salmon, and herring, and children getting candy in Easter eggs | b: Lighting Advent candles and opening Advent calendars | c: Lighting candles on graves to remember people who have died | d: Holding demonstrations and speeches about social issues	a: 吃雞蛋、羊肉、鮭魚和鯡魚，孩子們得到復活節彩蛋中的糖果 | b: 點將臨期蠟燭並打開將臨期日曆 | c: 在墳墓上點蠟燭，紀念逝者 | d: 組織關於社會問題的示威和演講	På påskafton är det vanligt att äta ägg, lamm, lax och sill, och barn får ofta godis i påskägg. Adventsljus, gravljus och demonstrationer hör i stället till advent, Alla helgons dag och första maj.	On Easter Saturday, it is common to eat eggs, lamb, salmon, and herring, and children often receive candy in Easter eggs. Advent candles, grave candles, and demonstrations instead belong to Advent, All Saints’ Day, and May Day.	復活節前夕通常會吃雞蛋、羊肉、鮭魚和鯡魚，孩子們也常收到裝在復活節彩蛋中的糖果。將臨期蠟燭、墓地蠟燭和示威分別屬於將臨期、諸聖節和五一。	pending_native_review	pending_reviewer_notes
q132	zh-Hant	13	Ch. 13 · Traditions and holidays	Traditioner och högtider	Advent	47	Vad gör barn ofta med en adventskalender hemma?	What do children often do with an Advent calendar at home?	孩子們在家裡通常如何使用將臨期日曆？	a	Öppnar en lucka varje dag fram till julafton	Open one door each day until Christmas Eve	每天打開一個小門，直到平安夜	a: Öppnar en lucka varje dag fram till julafton | b: Tänder stora brasor på kvällen | c: Bär ljuskrona i ett luciatåg | d: Går till julotta tidigt på morgonen	a: Open one door each day until Christmas Eve | b: Light large bonfires in the evening | c: Wear a crown of lights in a Lucia procession | d: Go to julotta early in the morning	a: 每天打開一個小門，直到平安夜 | b: 晚上點大型篝火 | c: 在 Lucia 隊伍中戴光冠 | d: 清晨去參加 Julotta	Under advent har många en adventskalender hemma, och barn öppnar en lucka varje dag fram till julafton. Brasor, ljuskrona i luciatåg och julotta hör till valborg, lucia och jul, inte adventskalendern.	During Advent, many people have an Advent calendar at home, and children open one door each day until Christmas Eve. Bonfires, a crown of lights in a Lucia procession, and julotta belong to Walpurgis Night, Lucia, and Christmas, not the Advent calendar.	將臨期期間，許多人家裡有將臨期日曆，孩子們每天打開一個小門，直到平安夜。篝火、Lucia 隊伍中的光冠和 Julotta 分別屬於瓦爾普吉斯、Lucia 和聖誕節，而不是將臨期日曆。	pending_native_review	pending_reviewer_notes
q133	zh-Hant	13	Ch. 13 · Traditions and holidays	Traditioner och högtider	Sveriges nationaldag	46	Vilket år blev Sveriges nationaldag en helgdag genom riksdagsbeslut?	In which year did Sweden’s National Day become a public holiday through a Riksdag decision?	瑞典國慶日是哪一年經議會決定成為公共假日的？	a	2005	2005	2005 年	a: 2005 | b: 1523 | c: 1809 | d: 1995	a: 2005 | b: 1523 | c: 1809 | d: 1995	a: 2005 年 | b: 1523 年 | c: 1809 年 | d: 1995 年	Sveriges nationaldag den 6 juni gjordes till helgdag genom ett riksdagsbeslut 2005. Åren 1523 och 1809 nämns som historiska skäl till datumet, medan 1995 hör till Sveriges EU-medlemskap.	Sweden’s National Day on 6 June became a public holiday through a Riksdag decision in 2005. The years 1523 and 1809 are mentioned as historical reasons for the date, while 1995 belongs to Sweden’s EU membership.	6 月 6 日的瑞典國慶日經議會決定於 2005 年成為公共假日。1523 年和 1809 年被提到作為這個日期的歷史原因，而 1995 年屬於瑞典加入歐盟。	pending_native_review	pending_reviewer_notes
q134	zh-Hant	13	Ch. 13 · Traditions and holidays	Traditioner och högtider	Alla helgons dag	46	När firas Alla helgons dag i Sverige?	When is All Saints’ Day observed in Sweden?	瑞典何時慶祝諸聖節？	a	På en lördag i slutet av oktober eller början av november	On a Saturday at the end of October or the beginning of November	在 10 月底或 11 月初的一個星期六	a: På en lördag i slutet av oktober eller början av november | b: På en fredag mellan 19 och 25 juni | c: På den 30 april varje år | d: På de fyra söndagarna före juldagen	a: On a Saturday at the end of October or the beginning of November | b: On a Friday between 19 and 25 June | c: On 30 April every year | d: On the four Sundays before Christmas Day	a: 在 10 月底或 11 月初的一個星期六 | b: 在 6 月 19 日至 25 日之間的一個星期五 | c: 每年 4 月 30 日 | d: 在聖誕節前的四個星期日	Alla helgons dag firas på en lördag i slutet av oktober eller i början av november. Midsommarafton, valborgsmässoafton och advent har andra tidpunkter under året, därför är de alternativen fel.	All Saints’ Day is observed on a Saturday at the end of October or at the beginning of November. Midsummer Eve, Walpurgis Night, and Advent occur at other times of the year, so those options are incorrect.	諸聖節在 10 月底或 11 月初的一個星期六慶祝。仲夏夜、瓦爾普吉斯夜和將臨期在一年中的其他時間，因此那些選項不正確。	pending_native_review	pending_reviewer_notes
q135	zh-Hant	13	Ch. 13 · Traditions and holidays	Traditioner och högtider	Advent	47	Vad är vanligt i många hem under advent?	What is common in many homes during Advent?	將臨期期間許多家庭中常見的是什麼？	a	En adventsstjärna i fönstret och en adventsljusstake med fyra ljus	An Advent star in the window and an Advent candleholder with four candles	窗戶裡的將臨期星星和有四支蠟燭的將臨期燭台	a: En adventsstjärna i fönstret och en adventsljusstake med fyra ljus | b: En midsommarstång i vardagsrummet och sill på bordet | c: Fyrverkerier varje söndag fram till julafton | d: Demonstrationer med tal om sociala och politiska frågor	a: An Advent star in the window and an Advent candleholder with four candles | b: A midsummer pole in the living room and herring on the table | c: Fireworks every Sunday until Christmas Eve | d: Demonstrations with speeches about social and political issues	a: 窗戶裡的將臨期星星和有四支蠟燭的將臨期燭台 | b: 客廳裡的仲夏柱和桌上的鯡魚 | c: 每個星期日直到平安夜都有煙火 | d: 有關社會和政治問題演講的示威	Under advent har många en lysande adventsstjärna i fönstret och en adventsljusstake med fyra ljus på bordet. Ett ljus tänds varje söndag fram till jul, medan midsommarstång, fyrverkerier och demonstrationer hör till andra högtider.	During Advent, many homes have a lit Advent star in the window and an Advent candleholder with four candles on the table. One candle is lit each Sunday until Christmas, while midsummer poles, fireworks, and demonstrations belong to other holidays.	將臨期期間，許多家庭會在窗戶放發亮的將臨期星星，桌上放有四支蠟燭的將臨期燭台。每個星期日點一支蠟燭直到聖誕節，而仲夏柱、煙火和示威屬於其他節日。	pending_native_review	pending_reviewer_notes
q136	zh-Hant	13	Ch. 13 · Traditions and holidays	Traditioner och högtider	Alla helgons dag	46	Vad gör många på Alla helgons dag i Sverige?	What do many people do on All Saints’ Day in Sweden?	瑞典許多人在諸聖節做什麼？	a	Går till kyrkogården och tänder ljus på gravar	Go to cemeteries and light candles on graves	去墓地並在墳墓上點蠟燭	a: Går till kyrkogården och tänder ljus på gravar | b: Dansar runt midsommarstången och binder blomsterkransar | c: Tänder stora brasor för att välkomna våren | d: Öppnar en lucka i adventskalendern varje dag	a: Go to cemeteries and light candles on graves | b: Dance around a midsummer pole and make flower wreaths | c: Light large bonfires to welcome spring | d: Open one Advent calendar door each day	a: 去墓地並在墳墓上點蠟燭 | b: 圍著仲夏柱跳舞並編花環 | c: 點大型篝火來迎接春天 | d: 每天打開將臨期日曆的一個小門	På Alla helgons dag går många till kyrkogården och tänder ljus på släktingars och vänners gravar för att minnas och hedra dem som har dött. Dans runt midsommarstången, brasor och adventskalendrar hör till midsommar, valborg och advent.	On All Saints’ Day, many people go to cemeteries and light candles on relatives’ and friends’ graves to remember and honor those who have died. Dancing around a midsummer pole, bonfires, and Advent calendars belong to Midsummer, Walpurgis Night, and Advent.	在諸聖節，許多人去墓地，在親友的墳墓上點蠟燭，以紀念和尊重逝者。圍著仲夏柱跳舞、篝火和將臨期日曆分別屬於仲夏節、瓦爾普吉斯和將臨期。	pending_native_review	pending_reviewer_notes
q137	zh-Hant	13	Ch. 13 · Traditions and holidays	Traditioner och högtider	Nya traditioner	47	Vad kan hända med traditioner när människor flyttar till andra länder?	What can happen to traditions when people move to other countries?	當人們移居到其他國家時，傳統可能會發生什麼？	a	De kan tas med och anpassas till nya platser och människor	They can be brought along and adapted to new places and people	它們可以被帶去，並適應新的地方和人群	a: De kan tas med och anpassas till nya platser och människor | b: De måste alltid försvinna helt | c: De blir automatiskt svenska lagar | d: De får bara firas på Sveriges nationaldag	a: They can be brought along and adapted to new places and people | b: They must always disappear completely | c: They automatically become Swedish laws | d: They may only be celebrated on Sweden's National Day	a: 它們可以被帶去，並適應新的地方和人群 | b: 它們總是必須完全消失 | c: 它們會自動成為瑞典法律 | d: 它們只能在瑞典國慶日慶祝	När människor flyttar till andra länder kan de ta med sig traditioner och anpassa dem till de platser och människor de möter. Id al-fitr, Nouruz och Newroz är exempel på traditioner som har kommit till Sverige med invandrare; därför är alternativen om att traditioner måste försvinna, bli lagar eller bara firas på nationaldagen fel.	When people move to other countries, they can bring traditions with them and adapt them to the places and people they meet. Eid al-Fitr, Nouruz, and Newroz are examples of traditions that have come to Sweden with immigrants, so the options saying traditions must disappear, become laws, or only be celebrated on National Day are incorrect.	當人們移居到其他國家時，他們可以帶著傳統，並使其適應遇到的新地方和人群。開齋節、Nouruz 和 Newroz 是隨移民來到瑞典的傳統例子；因此傳統必須消失、成為法律或只能在國慶日慶祝的說法都不正確。	pending_native_review	pending_reviewer_notes
q138	zh-Hant	13	Ch. 13 · Traditions and holidays	Traditioner och högtider	Jul	47	Vad gör många med en julgran vid jul i Sverige?	What do many people do with a Christmas tree at Christmas in Sweden?	瑞典許多人在聖誕節會怎樣處理一棵樹？	a	Tar in en julgran i hemmet och dekorerar den med ljusslingor, kulor och glitter	Bring a Christmas tree into the home and decorate it with strings of lights, baubles, and tinsel	把一棵樅樹帶進家裡，並用燈串、彩球和金銀絲裝飾	a: Tar in en julgran i hemmet och dekorerar den med ljusslingor, kulor och glitter | b: Planterar en julgran på kyrkogården och tänder gravljus | c: Dansar runt en julgran utomhus för att välkomna sommaren | d: Tänder en julgran som vårbrasa på valborgsmässoafton	a: Bring a Christmas tree into the home and decorate it with strings of lights, baubles, and tinsel | b: Plant a Christmas tree at the cemetery and light grave candles | c: Dance around a Christmas tree outdoors to welcome summer | d: Light a Christmas tree as a spring bonfire on Walpurgis Night	a: 把一棵樅樹帶進家裡，並用燈串、彩球和金銀絲裝飾 | b: 在墓地種一棵樹並點墓地蠟燭 | c: 在戶外圍著一棵樹跳舞來迎接夏天 | d: 在瓦爾普吉斯夜把一棵樹點燃作為春天篝火	Vid jul tar många in en julgran i hemmet och dekorerar den med ljusslingor, kulor och glitter. Julgranen hör till julfirandet, medan gravljus, midsommardans och valborgsbrasor hör till andra högtider.	At Christmas, many people bring a Christmas tree into the home and decorate it with strings of lights, baubles, and tinsel. The Christmas tree belongs to Christmas celebrations, while grave candles, Midsummer dancing, and Walpurgis bonfires belong to other holidays.	聖誕節時，許多人把一棵樅樹帶進家裡，並用燈串、彩球和金銀絲裝飾。聖誕樹屬於聖誕慶祝，而墓地蠟燭、仲夏舞和瓦爾普吉斯篝火屬於其他節日。	pending_native_review	pending_reviewer_notes
q139	zh-Hant	13	Ch. 13 · Traditions and holidays	Traditioner och högtider	Jul	47	Vad firar julen traditionellt inom kristendomen?	What does Christmas traditionally celebrate in Christianity?	聖誕節在基督教傳統中慶祝什麼？	a	Jesu födelse	Jesus' birth	耶穌的誕生	a: Jesu födelse | b: Vårens ankomst | c: Arbetarnas dag | d: Det nya årets ankomst	a: Jesus' birth | b: The arrival of spring | c: Workers' Day | d: The arrival of the new year	a: 耶穌的誕生 | b: 春天的到來 | c: 勞工節 | d: 新年的到來	Julen är traditionellt en kristen högtid för att fira Jesu födelse. I Sverige är julen också en stor familjehögtid, medan vårens ankomst, arbetarnas dag och det nya årets ankomst hör till valborg, första maj och nyår.	Christmas is traditionally a Christian holiday celebrating Jesus' birth. In Sweden, Christmas is also a major family holiday, while the arrival of spring, Workers' Day, and the arrival of the new year belong to Walpurgis Night, May Day, and New Year.	聖誕節傳統上是慶祝耶穌誕生的基督教節日。在瑞典，聖誕節也是重要的家庭節日；春天的到來、勞工節和新年的到來分別屬於瓦爾普吉斯、五一和新年。	pending_native_review	pending_reviewer_notes
