lang	source_quality	title	url	why_use	style_or_term_notes
ti	official-fact+register	Informationsverige Tigrinya healthcare rights and duties	https://www.informationsverige.se/ti/om-sverige/att-varda-sin-halsa-i-sverige/rattigheter-och-skyldigheter-i-motet-med-varden.html	Rights/duties register and public-service headings.	Seed source; expand with exact terminology after native review.
ti	official-fact+register	Informationsverige Tigrinya method-support PDF	https://www.informationsverige.se/download/18.1fd25853182fcf87c9f3b69/1662440952468/MS_RattigheterOchSkyldigheter_A3_TIG.pdf	Rights/duties education material; verify license before copying text.	Seed source; expand with exact terminology after native review.
ti	official-fact+register	Informationsverige Tigrinya democracy	https://www.informationsverige.se/ti/om-sverige/att-paverka-i-sverige/vad-ar-demokrati.html	Tigrinya civic register for democracy, rights, participation, freedom of expression, and source criticism navigation.	Use for terms such as ደሞክራሲ, ምርጫ, ናጽነት ሓሳብካ ምግላጽ, ኣብ ሽወደን.
ti	official-fact+register	Informationsverige Tigrinya how Sweden is governed	https://www.informationsverige.se/ti/om-sverige/att-paverka-i-sverige/sa-styrs-sverige.html	Tigrinya civic register for Swedish governance and institution explanations.	Use to keep Swedish governance levels and institution names precise.
ti	official-fact+register	Informationsverige Tigrinya discrimination	https://www.informationsverige.se/ti/om-sverige/individens-rattigheter-och-skyldigheter/diskriminering.html	Tigrinya register for discrimination definitions, protected grounds, and help-seeking.	Use for sensitive rights-based wording and DO/discrimination terms.
ti	official-fact+register	Informationsverige Tigrinya gender equality	https://www.informationsverige.se/ti/om-sverige/individens-rattigheter-och-skyldigheter/kvinnors-rattigheter-och-jamstalldhet.html	Tigrinya register for women rights, gender equality, violence/support, and family responsibility.	Use for sensitive-topic tone; verify terms with native reviewer before shipping.
ti	style-anchor	Tigrinya civic localization style guide	docs/localization/sample-corpus/ti/style-guide.md	Project-local guide distilled from Tigrinya official Swedish civic pages.	Use as mandatory audit before translating Tigrinya UI/questions.
